name,link,ingredients,steps,nutrition
Pumpkin Whoopie Pies,https://www.allrecipes.com/recipe/11331/pumpkin-whoopie-pies/,"{'quantity': '2', 'unit': 'cups', 'name': 'packed brown sugar'}, {'quantity': '1', 'unit': 'cup', 'name': 'vegetable oil'}, {'quantity': '1 ½', 'unit': 'cups', 'name': 'solid pack pumpkin puree'}, {'quantity': '2', 'unit': 'large', 'name': 'eggs'}, {'quantity': '3', 'unit': 'cups', 'name': 'all-purpose flour'}, {'quantity': '1 ½', 'unit': 'tablespoons', 'name': 'ground cinnamon'}, {'quantity': '½', 'unit': 'tablespoon', 'name': 'ground ginger'}, {'quantity': '½', 'unit': 'tablespoon', 'name': 'ground cloves'}, {'quantity': '1', 'unit': 'teaspoon', 'name': 'salt'}, {'quantity': '1', 'unit': 'teaspoon', 'name': 'baking powder'}, {'quantity': '1', 'unit': 'teaspoon', 'name': 'baking soda'}, {'quantity': '1', 'unit': 'teaspoon', 'name': 'vanilla extract'}, {'quantity': '1', 'unit': '', 'name': 'egg white'}, {'quantity': '2', 'unit': 'tablespoons', 'name': 'milk'}, {'quantity': '1', 'unit': 'teaspoon', 'name': 'vanilla extract'}, {'quantity': '2', 'unit': 'cups', 'name': ""confectioners' sugar, divided""}, {'quantity': '¾', 'unit': 'cup', 'name': 'shortening'}","Preheat the oven to 350 degrees F (175 degrees C). Lightly grease baking sheets.. To make the cookie dough: Combine brown sugar and oil in a bowl. Mix in pumpkin and eggs, beating well. Add flour, cinnamon, ginger, cloves, salt, baking powder, baking soda, and vanilla together into a separate bowl. Fold dry ingredients into wet ingredients and mix to combine.. Drop dough by heaping teaspoons onto the prepared baking sheets.. Bake in the preheated oven for 10 to 12 minutes. Let cookies cool while you make the filling.. To make the whoopie pie filling: Beat egg white in a bowl and mix in milk, vanilla, then 1 cup confectioners' sugar. Mix well then beat in shortening and remaining 1 cup confectioners' sugar. Beat until light and fluffy.. Assemble once cookies are cool. Make sandwiches from two cookies filled with whoopie pie filling.","calories: 425, fat: 22g, carbs: 56g, protein: 3g, servings: 18"
Pumpkin Empanadas,https://www.allrecipes.com/recipe/216489/mexican-pumpkin-empanadas/,"{'quantity': '3', 'unit': 'cups', 'name': 'all-purpose flour'}, {'quantity': '⅓', 'unit': 'cup', 'name': 'white sugar'}, {'quantity': '1 ½', 'unit': 'teaspoons', 'name': 'salt'}, {'quantity': '¼', 'unit': 'teaspoon', 'name': 'baking powder'}, {'quantity': '1', 'unit': 'cup', 'name': 'vegetable shortening'}, {'quantity': '1', 'unit': 'cup', 'name': 'warm water'}, {'quantity': '4', 'unit': 'cups', 'name': 'canned pure pumpkin'}, {'quantity': '1', 'unit': 'cup', 'name': 'white sugar'}, {'quantity': '2', 'unit': 'large', 'name': 'eggs'}, {'quantity': '1 ½', 'unit': 'teaspoons', 'name': 'ground cinnamon'}, {'quantity': '1', 'unit': 'teaspoon', 'name': 'salt'}, {'quantity': '1', 'unit': 'teaspoon', 'name': 'ground ginger'}, {'quantity': '½', 'unit': 'teaspoon', 'name': 'ground cloves'}, {'quantity': '1', 'unit': 'large', 'name': 'beaten egg'}","Preheat the oven to 350 degrees F (175 degrees C). Line baking sheets with parchment paper.. To make the dough: Whisk flour, sugar, salt, and baking powder together in a large bowl. Cut shortening into flour mixture until it resembles coarse crumbs. Stir in warm water, 2 tablespoons at a time, just until dough starts coming together. Knead dough a few times in the bowl.. Transfer dough out onto a floured surface. Cut dough in quarters, then cut each quarter into thirds to make 12 equal portions. Roll each portion into a ball. Cover with a cloth and allow to rest while you make filling.. To make the filling: Mix pumpkin, sugar, eggs, cinnamon, salt, ginger, and cloves together in a large bowl until smooth.. Roll each dough ball out on a floured surface into a thin, 6-inch circle. Spoon about 1/3 cup filling into the center of each dough circle. Fold dough over filling to make a half-moon-shaped pie, then crimp the edges together with a fork. Place onto the prepared baking sheets. Brush the tops with beaten egg.. Bake in the preheated oven until the filling is hot and crusts are golden brown, about 20 minutes.","calories: 384, fat: 19g, carbs: 52g, protein: 6g, servings: 12"
True Bangers and Mash with Onion Gravy,https://www.allrecipes.com/recipe/216071/true-bangers-and-mash-with-onion-gravy/,"{'quantity': '4', 'unit': 'links', 'name': 'pork sausage'}, {'quantity': '2', 'unit': 'pounds', 'name': 'potatoes, peeled and cubed'}, {'quantity': '¼', 'unit': 'cup', 'name': 'butter'}, {'quantity': '2', 'unit': 'tablespoons', 'name': 'milk (Optional)'}, {'quantity': '1', 'unit': 'teaspoon', 'name': 'dry mustard powder'}, {'quantity': '', 'unit': '', 'name': 'salt and ground black pepper to taste'}, {'quantity': '1', 'unit': 'tablespoon', 'name': 'butter'}, {'quantity': '2', 'unit': 'large', 'name': 'onions, chopped'}, {'quantity': '6', 'unit': 'cups', 'name': 'beef broth'}, {'quantity': '2', 'unit': 'cups', 'name': 'red wine'}",,"calories: 516, fat: 20g, carbs: 50g, protein: 14g, servings: 4"
Candy Apples,https://www.allrecipes.com/recipe/21134/candied-apples-ii/,"{'quantity': '', 'unit': '', 'name': 'cooking spray'}, {'quantity': '15', 'unit': '', 'name': 'craft sticks'}, {'quantity': '15', 'unit': 'medium', 'name': 'apples, washed and dried'}, {'quantity': '2', 'unit': 'cups', 'name': 'white sugar'}, {'quantity': '1 ½', 'unit': 'cups', 'name': 'water'}, {'quantity': '1', 'unit': 'cup', 'name': 'light corn syrup'}, {'quantity': '8', 'unit': 'drops', 'name': 'red food coloring'}","Lightly grease cookie sheets. Insert craft sticks into whole, stemmed apples.. Combine sugar, water, and corn syrup in a medium saucepan over medium-high heat. Bring to a boil and insert candy thermometer; continue to boil, without stirring, until temperature reaches 300 to 310 degrees F (149 to 154 degrees C) or until a small amount of syrup dropped into cold water forms hard, brittle threads. Remove from heat and stir in food coloring.. Holding each apple by its stick, dip in syrup, remove and turn to coat evenly. Place on prepared sheets to harden.","calories: 237, fat: 0g, carbs: 63g, protein: 0g, servings: 15"
Cinnamon Sugar Pumpkin Seeds,https://www.allrecipes.com/recipe/239621/cinnamon-toast-pumpkin-seeds/,"{'quantity': '1 ½', 'unit': 'cups', 'name': 'pumpkin seeds'}, {'quantity': '3', 'unit': 'tablespoons', 'name': 'butter, melted'}, {'quantity': '1', 'unit': 'teaspoon', 'name': 'ground cinnamon'}, {'quantity': '¼', 'unit': 'teaspoon', 'name': 'salt'}, {'quantity': '2', 'unit': 'tablespoons', 'name': 'white sugar'}","Gather the ingredients. Preheat the oven to 300 degrees F (150 degrees C). Line a baking sheet with parchment paper.. Place pumpkin seeds into a large bowl. Mix butter, cinnamon, and salt together in a small bowl; pour over seeds and toss until evenly coated. Spread seeds in a single layer on the prepared baking sheet.. Bake in the preheated oven, stirring occasionally, until seeds are light golden brown, about 40 minutes. Remove from the oven; sprinkle sugar over warm seeds and stir until evenly coated.","calories: 153, fat: 13g, carbs: 6g, protein: 5g, servings: 10"
Black Magic Cake,https://www.allrecipes.com/recipe/8372/black-magic-cake/,"{'quantity': '2', 'unit': 'cups', 'name': 'white sugar'}, {'quantity': '1 ¾', 'unit': 'cups', 'name': 'all-purpose flour'}, {'quantity': '¾', 'unit': 'cup', 'name': 'unsweetened cocoa powder'}, {'quantity': '2', 'unit': 'teaspoons', 'name': 'baking soda'}, {'quantity': '1', 'unit': 'teaspoon', 'name': 'baking powder'}, {'quantity': '1', 'unit': 'teaspoon', 'name': 'salt'}, {'quantity': '1', 'unit': 'cup', 'name': 'strong brewed coffee'}, {'quantity': '1', 'unit': 'cup', 'name': 'buttermilk'}, {'quantity': '½', 'unit': 'cup', 'name': 'vegetable oil'}, {'quantity': '2', 'unit': 'large', 'name': 'eggs'}, {'quantity': '1', 'unit': 'teaspoon', 'name': 'vanilla extract'}","Preheat the oven to 350 degrees F (175 degrees C).. Grease and flour two 9-inch round cake pans or one 9x13-inch dish.. Combine sugar, flour, cocoa, baking soda, baking powder, and salt in a large bowl. Make a well in the center. Pour coffee, buttermilk, oil, eggs, and vanilla into the well. Beat for 2 minutes on medium speed. Batter will be thin.. Pour into the prepared pans.. Bake in the preheated oven until a toothpick inserted into the center of the cake comes out clean, 30 to 40 minutes.. Cool for 10 minutes, then remove from the pans and finish cooling on a wire rack.. Fill and frost as desired.","calories: 155, fat: 6g, carbs: 26g, protein: 2g, servings: 24"
Peanut Butter Blossoms,https://www.allrecipes.com/recipe/9920/peanut-blossoms-ii/,"{'quantity': '1', 'unit': 'cup', 'name': 'shortening'}, {'quantity': '1', 'unit': 'cup', 'name': 'peanut butter'}, {'quantity': '1', 'unit': 'cup', 'name': 'packed brown sugar'}, {'quantity': '1 ½', 'unit': 'cups', 'name': 'white sugar, divided'}, {'quantity': '2', 'unit': 'large', 'name': 'eggs'}, {'quantity': '¼', 'unit': 'cup', 'name': 'milk'}, {'quantity': '2', 'unit': 'teaspoons', 'name': 'vanilla extract'}, {'quantity': '3 ½', 'unit': 'cups', 'name': 'all-purpose flour'}, {'quantity': '2', 'unit': 'teaspoons', 'name': 'baking soda'}, {'quantity': '1', 'unit': 'teaspoon', 'name': 'salt'}, {'quantity': '2', 'unit': '(9 ounce) bags', 'name': 'milk chocolate candy kisses, unwrapped'}",,"calories: 116, fat: 6g, carbs: 14g, protein: 2g, servings: 84"
Brain Hemorrhage (Halloween Alcohol Drink),https://www.allrecipes.com/recipe/229158/brain-hemorrhage-halloween-alcohol-drink/,"{'quantity': '1', 'unit': 'fluid ounce', 'name': 'chilled peach schnapps'}, {'quantity': '1', 'unit': 'teaspoon', 'name': ""chilled Irish cream liqueur (such as Bailey's)""}, {'quantity': '1', 'unit': 'splash', 'name': 'chilled grenadine syrup'}",Pour Schnapps into a shot glass. Very gently pour Bailey's over top; let sit until it begins to clump and curdle. Gently pour in grenadine.,"calories: 192, fat: 0g, carbs: 32g, servings: 1"
Cream Cheese Pumpkin Roll,https://www.allrecipes.com/recipe/245257/cream-cheese-pumpkin-roll/,"{'quantity': '¾', 'unit': 'cup', 'name': 'all-purpose flour'}, {'quantity': '2', 'unit': 'teaspoons', 'name': 'ground cinnamon'}, {'quantity': '1', 'unit': 'teaspoon', 'name': 'baking powder'}, {'quantity': '1', 'unit': 'teaspoon', 'name': 'ground ginger'}, {'quantity': '½', 'unit': 'teaspoon', 'name': 'ground nutmeg'}, {'quantity': '½', 'unit': 'teaspoon', 'name': 'salt'}, {'quantity': '1', 'unit': 'cup', 'name': 'white sugar'}, {'quantity': '3', 'unit': 'large', 'name': 'eggs'}, {'quantity': '⅔', 'unit': 'cup', 'name': 'pumpkin puree'}, {'quantity': '1', 'unit': '(8 ounce) package', 'name': 'cream cheese, softened'}, {'quantity': '1', 'unit': 'cup', 'name': ""confectioners' sugar""}, {'quantity': '¼', 'unit': 'cup', 'name': 'unsalted butter, softened'}, {'quantity': '1', 'unit': 'tablespoon', 'name': 'pumpkin puree'}, {'quantity': '1', 'unit': 'teaspoon', 'name': 'vanilla extract'}","Preheat the oven to 375 degrees F (190 degrees C). Grease a 10x15-inch jelly roll pan and line with waxed paper.. Make the cake: Combine flour, cinnamon, baking powder, ginger, nutmeg, and salt in a medium bowl.. Beat sugar and eggs in a large bowl with an electric mixer until well blended. Stir in pumpkin purée. Add flour mixture and stir until just blended. Pour batter into the prepared jelly roll pan.. Bake in the preheated oven until a toothpick inserted into the center comes out clean, about 15 minutes. Remove from the oven and cool in the pan for 10 minutes.. Turn cake out onto a clean kitchen towel. Remove and discard waxed paper. Starting with the short end of the cake, roll both the cake and towel up into a log; let cool completely, about 30 minutes.. While the cake is cooling, make the filling: Beat cream cheese, confectioners' sugar, butter, pumpkin purée, and vanilla in a mixing bowl until smooth.. Spread a large sheet of plastic wrap on a work surface. Carefully unroll the cooled cake onto the plastic wrap.. Spread filling over the cake, re-roll the cake (without the towel), and wrap carefully with plastic wrap. Transfer the filled cake, seam-side down, to a plate. Refrigerate until fully chilled, about 2 hours.","calories: 308, fat: 14g, carbs: 42g, protein: 5g, servings: 10"
Halloween Jell-O Shots,https://www.allrecipes.com/recipe/254844/halloween-candy-corn-jell-o-shots/,"{'quantity': '¾', 'unit': 'cup', 'name': 'boiling water'}, {'quantity': '1', 'unit': '(3 ounce) package', 'name': 'lemon-flavored gelatin mix (such as Jell-O)'}, {'quantity': '1', 'unit': 'cup', 'name': 'vodka'}, {'quantity': '3', 'unit': '', 'name': 'ice cubes, or as needed'}, {'quantity': '¾', 'unit': 'cup', 'name': 'boiling water'}, {'quantity': '1', 'unit': '(3 ounce) package', 'name': 'orange-flavored gelatin mix (such as Jell-O)'}, {'quantity': '3', 'unit': '', 'name': 'ice cubes, or as needed'}, {'quantity': '1', 'unit': 'cup', 'name': 'vodka'}, {'quantity': '2', 'unit': 'tablespoons', 'name': 'hot water'}, {'quantity': '1', 'unit': '(.25 ounce) envelope', 'name': 'unflavored gelatin'}, {'quantity': '1', 'unit': '(14 ounce) can', 'name': 'sweetened condensed milk'}, {'quantity': '½', 'unit': 'cup', 'name': 'light rum'}","To make the yellow layer: Pour boiling water into a small bowl. Add lemon gelatin mix and stir until dissolved.. Pour vodka into a 2-cup liquid measure; add enough ice to make 1 1/4 cups. Pour into lemon gelatin mixture and stir until slightly thickened; remove any unmelted ice. Pour mixture into 16 tall shot glasses, filling each 1/3 full. Refrigerate until lemon gelatin is set, at least 1 1/2 hours.. When lemon gelatin is set, make the orange layer: Pour boiling water into a small bowl. Add orange gelatin mix and stir until dissolved.. Pour vodka into a 2-cup liquid measure; add enough ice to make 1 1/4 cups. Pour into orange gelatin mixture and stir until slightly thickened; remove any unmelted ice. Pour into shot glasses over lemon gelatin. Refrigerate until orange gelatin is set, at least 1 1/2 hours.. When orange gelatin is set, make the white layer: Stir hot water and unflavored gelatin together in a bowl until gelatin is dissolved. Stir in condensed milk and rum. Pour into shot glasses over orange gelatin. Refrigerate until set, at least 30 minutes.","calories: 202, fat: 2g, carbs: 22g, protein: 3g, servings: 16"
