name,link,ingredients,steps,nutrition
Our 12 Best Pumpkin Seed Recipes Make Perfect Autumn Snacks,https://www.allrecipes.com/gallery/best-pumpkin-seed-recipes/,,,
10 Easy Halloween Treats With Store-Bought Shortcuts,https://www.allrecipes.com/gallery/halloween-treats-with-store-bought-shortcuts/,,,
13 Scary Halloween Cookies to Sink Your Fangs Into,https://www.allrecipes.com/gallery/scary-halloween-cookie-recipes/,,,
18 Easy Halloween Treats Kids Can Help Make,https://www.allrecipes.com/gallery/easy-kid-friendly-halloween-treats/,,,
Chef John's 13 Best Halloween Recipes Ever,https://www.allrecipes.com/chef-john-halloween-recipes-8737311,,,
“Black Magic” Chocolate Chip Cookies,https://www.allrecipes.com/black-magic-chocolate-chip-cookies-recipe-8732777,"{'quantity': '1', 'unit': 'cup', 'name': 'unsalted butter, soft'}, {'quantity': '1', 'unit': 'cup', 'name': 'white sugar'}, {'quantity': '1/2', 'unit': 'cup', 'name': 'light brown sugar'}, {'quantity': '1', 'unit': 'large', 'name': 'egg'}, {'quantity': '1', 'unit': 'tablespoon', 'name': 'activated charcoal powder'}, {'quantity': '1 1/4', 'unit': 'teaspoons', 'name': 'vanilla extract'}, {'quantity': '2', 'unit': 'tablespoons', 'name': 'milk'}, {'quantity': '1 1/4', 'unit': 'teaspoons', 'name': 'kosher salt'}, {'quantity': '1', 'unit': 'teaspoon', 'name': 'baking soda'}, {'quantity': '2 1/4', 'unit': 'cups', 'name': 'all purpose flour'}, {'quantity': '1 1/2', 'unit': 'cups', 'name': 'chocolate chips'}",,"calories: 161, fat: 8g, carbs: 21g, protein: 2g, servings: 32"
Pumpkin Oreo Cupcakes,https://www.allrecipes.com/pumpkin-oreo-cupcakes-recipe-8727217,"{'quantity': '2', 'unit': 'cups', 'name': 'cream-filled chocolate sandwich cookies (such as Oreo'}, {'quantity': '5', 'unit': 'tablespoons', 'name': 'unsalted butter,'}, {'quantity': '2', 'unit': 'tablespoons', 'name': 'brown sugar'}, {'quantity': '1', 'unit': 'pinch', 'name': 'salt'}, {'quantity': '1/4', 'unit': 'cup', 'name': 'unsalted butter'}, {'quantity': '2', 'unit': 'tablespoons', 'name': 'vegetable oil'}, {'quantity': '1/2', 'unit': 'cup', 'name': 'white sugar'}, {'quantity': '1/2', 'unit': 'cup', 'name': 'light brown sugar'}, {'quantity': '1', 'unit': 'large', 'name': 'egg'}, {'quantity': '2', 'unit': 'teaspoons', 'name': 'vanilla extract'}, {'quantity': '1', 'unit': 'cup', 'name': 'canned pumpkin puree'}, {'quantity': '1/2', 'unit': 'cup', 'name': 'sour cream'}, {'quantity': '1 1/4', 'unit': 'cups', 'name': 'cake flour'}, {'quantity': '1 1/2', 'unit': 'teaspoons', 'name': 'ground cinnamon'}, {'quantity': '1/2', 'unit': 'teaspoon', 'name': 'salt'}, {'quantity': '1/2', 'unit': 'teaspoon', 'name': 'baking powder'}, {'quantity': '1/4', 'unit': 'teaspoon', 'name': 'ground nutmeg'}, {'quantity': '1/4', 'unit': 'teaspoon', 'name': 'baking soda'}, {'quantity': '1/4', 'unit': 'teaspoon', 'name': 'ground cloves'}, {'quantity': '1/4', 'unit': 'teaspoon', 'name': 'ground allspice'}, {'quantity': '1/2', 'unit': 'cup', 'name': 'unsalted butter'}, {'quantity': '4', 'unit': 'ounces', 'name': 'cream cheese'}, {'quantity': '1 3/4', 'unit': 'cups', 'name': 'confectioners sugar'}, {'quantity': '1', 'unit': 'teaspoon', 'name': 'vanilla extract'}, {'quantity': '1/8', 'unit': 'teaspoon', 'name': 'salt'}, {'quantity': '1/2', 'unit': 'cup', 'name': 'cream-filled chocolate sandwich cookies (such as Oreo'}, {'quantity': '3', 'unit': 'tablespoons', 'name': 'cocoa powder (such as The Cocoa Trader Black Dutched Cocoa Powder'}, {'quantity': '2', 'unit': 'tablespoons', 'name': 'heavy cream'}, {'quantity': '16', 'unit': 'cookie', 'name': 'cream-filled chocolate sandwich cookies (such as Oreo'}","Preheat the oven to 350 degrees F (175 degrees C). Line 2 cupcake pans with liners.. Prepare crusts: Mix Oreo crumbs, melted butter, brown sugar, and salt together in a small bowl until combined. Place 1 packed tablespoon of crumb mixture into the bottom of about 16 cupcake liners and press into an even layer.. Bake crusts in the preheated oven for 10 minutes. Remove from oven; allow to cool. Do not turn oven off.. Meanwhile, prepare cupcakes: Beat butter, vegetable oil, white sugar, and brown sugar with an electric mixer until light and fluffy. Add egg and vanilla and beat for 3 minutes on medium-high speed. Add pumpkin and sour cream and mix until combined. Add cake flour, cinnamon, salt, baking powder, nutmeg, baking soda, cloves, and allspice and mix until just combined.. Spoon about 2 tablespoons of the pumpkin batter over each Oreo crust (see Note).. Bake cupcakes until tops spring back when lightly touched, 22 to 28 minutes. Allow cupcakes to cool in the pans for 10 minutes before removing to a wire rack to cool completely.. For frosting, beat butter with an electric mixer until smooth. Beat in cream cheese until thoroughly smooth and combined. Beat in 1 cup powdered sugar, vanilla, and salt until thoroughly combined, then beat in finely ground Oreos and black cocoa. Add in remaining 3/4 cup powdered sugar; beat until smooth and combined.. Pour in heavy cream, and mix on low speed. Gradually turn mixer speed up to medium-high and beat until frosting is light and fluffy, 3 to 4 minutes. Frost cooled cupcakes as desired and top with an additional Oreo cookie, if desired.","calories: 486, fat: 26g, carbs: 62g, protein: 4g, servings: 16"
Peanut Butter Bugle Bites,https://www.allrecipes.com/peanut-butter-bugle-bites-recipe-8724424,"{'quantity': '1', 'unit': '(7 1/2 ounce) bag', 'name': 'crunchy corn snacks (such as Bugles®)'}, {'quantity': '1', 'unit': 'cup', 'name': 'brown sugar'}, {'quantity': '1/3', 'unit': 'cup', 'name': 'butter'}, {'quantity': '2/3', 'unit': 'cup', 'name': 'peanut butter'}, {'quantity': '1/3', 'unit': 'cup', 'name': 'light corn syrup'}, {'quantity': '1/4', 'unit': 'teaspoon', 'name': 'baking soda'}, {'quantity': '1', 'unit': 'cup', 'name': 'chocolate chips'}, {'quantity': '1', 'unit': 'tablespoon', 'name': 'coconut oil'}, {'quantity': None, 'unit': None, 'name': 'sea salt (optional)'}","Line a baking sheet with parchment or waxed paper. Spread Bugles out on the sheet.. Combine sugar, butter, peanut butter, and corn syrup in a small saucepan over medium heat. Bring mixture to a boil, stirring often. Boil for 2 minutes, remove from heat, and pour over Bugles. Toss quickly to coat and spread into an even layer.. Combine chocolate chips and coconut oil in a small bowl. Melt in the microwave in 30 second increments, stirring in between each. Drizzle melted chocolate over bugles and let cool completely. For best results, refrigerate for 5 minutes to allow chocolate to harden. Break into large pieces; store in an airtight container.","calories: 360, fat: 21g, carbs: 44g, protein: 5g, servings: 10"
Pumpkin Cheese Ball,https://www.allrecipes.com/pumpkin-cheese-ball-recipe-8725706,"{'quantity': '2', 'unit': '(8-ounce) packages cream', 'name': 'cheese, softened'}, {'quantity': '1', 'unit': 'tablespoon', 'name': 'hot pepper sauce'}, {'quantity': '1', 'unit': 'teaspoon', 'name': 'paprika'}, {'quantity': '1/2', 'unit': 'teaspoon', 'name': 'minced garlic'}, {'quantity': '2', 'unit': 'cups', 'name': 'heddar cheese'}, {'quantity': '1', 'unit': None, 'name': 'bell pepper'}, {'quantity': None, 'unit': None, 'name': 'crackers for serving'}","Gather all ingredients.. Combine cream cheese, hot pepper sauce, paprika, and garlic in a food processor. Process until well combined.. Add 1 1/2 cups shredded cheese and process until cheese is finely chopped but still very visible.. Sprinkle about 3 tablespoons of the remaining shredded cheese into a 4-inch pile on a large piece of plastic wrap, and top with a rounded scoop of the cheese ball mixture.. Sprinkle the cheese ball mound with the remaining shredded cheese.. Pull sides of plastic wrap up and over the cheese ball mixture to wrap tightly and shape into a ball. (If needed, wrap with an additional piece of plastic wrap to ensure the mixture is very tightly wrapped.). Wrap 4 wide rubber bands around the cheese ball, evenly spacing them to create the indentations that are found on a pumpkin. (Depending on the size of the rubber bands, you may need to double wrap each one to create indentations that are deep enough.). Chill cheese ball in the refrigerator at least 3 hours before serving to allow flavors to meld and the cream cheese to become firm.. Before serving, remove rubber bands and unwrap cheese ball. Place a bell pepper stem on top of the pumpkin and gently press to adhere. Serve with crackers.","calories: 111, fat: 10g, carbs: 2g, protein: 4g, servings: 24"
Sausage Head Charcuterie Board,https://www.allrecipes.com/sausage-head-charcuterie-board-recipe-8715948,"{'quantity': None, 'unit': None, 'name': 'foam mannequin head'}, {'quantity': '4', 'unit': '(8 ounce) packages', 'name': 'turkey or beef meat sticks,'}, {'quantity': None, 'unit': None, 'name': 'wooden picks'}, {'quantity': '4', 'unit': 'ounces', 'name': 'prosciutto'}, {'quantity': '1', 'unit': 'mini', 'name': 'cheese round, halved (such as Babybel® Cheese'}, {'quantity': '1', 'unit': None, 'name': 'pimiento-stuffed olive,'}, {'quantity': '1/2', 'unit': 'teaspoon', 'name': 'cream cheese'}, {'quantity': '10', 'unit': 'halves', 'name': 'cocktail peanut'}, {'quantity': '2', 'unit': None, 'name': 'roasted red peppers'}, {'quantity': None, 'unit': None, 'name': 'whole grain crackers'}, {'quantity': None, 'unit': None, 'name': 'coarse grained'}, {'quantity': None, 'unit': None, 'name': 'assorted cheeses'}","Place foam head on a cake stand, and secure with tape, or place the base of head in a hollowed out pumpkin ring to secure in place.. Secure each meat stick piece with a wooden pick, arranging them around the head, custom fitting each one to resemble a face. Tear prosciutto into pieces and use the pieces to fill in any white spaces between the meat sticks.. Using wooden picks, place cheese round halves in foam head to resemble eyeballs. On the same picks, place an olive half over each cheese half to resemble pupils.. Spread cream cheese on the rounded side of peanut halves. Stick peanuts over mouth area on head, to resemble teeth.. Arrange roasted red pepper strips in between beef pieces on top of head to resemble veins.. Arrange crackers, mustard, assorted cheeses, olives, and other charcuterie accompaniments of your choice around sausage head. Enjoy!","calories: 3039, fat: 192g, carbs: 20g, protein: 292g"
Deviled Blondies,https://www.allrecipes.com/deviled-blondies-recipe-8719173,"{'quantity': '1', 'unit': 'tablespoon', 'name': 'butter'}, {'quantity': '2', 'unit': 'tablespoons', 'name': 'light brown sugar'}, {'quantity': '1', 'unit': 'rounded tablespoon', 'name': 'Gochujang chili paste,'}, {'quantity': '1 3/4', 'unit': 'cups', 'name': 'all-purpose flour'}, {'quantity': '1', 'unit': 'teaspoon', 'name': 'baking powder'}, {'quantity': '1', 'unit': 'teaspoon', 'name': 'kosher salt'}, {'quantity': '3/4', 'unit': 'cup', 'name': 'white sugar'}, {'quantity': '1/2', 'unit': 'cup packed', 'name': 'light brown sugar'}, {'quantity': '2', 'unit': 'large', 'name': 'eggs'}, {'quantity': '2', 'unit': 'teaspoons', 'name': 'vanilla extract'}, {'quantity': '2', 'unit': 'sticks', 'name': 'salted butter, melted and cooled slightly'}, {'quantity': '1/2', 'unit': 'cup', 'name': 'macadamia nuts'}",,"calories: 471, fat: 29g, carbs: 50g, protein: 5g, servings: 9"
Beetlejuice-Inspired Shrimp Cocktail,https://www.allrecipes.com/beetlejuice-inspired-shrimp-cocktail-recipe-8701693,"{'quantity': '1', 'unit': 'pound', 'name': 'shrimp'}, {'quantity': '1/2 cup plus 2', 'unit': 'tablespoons', 'name': 'olive oil'}, {'quantity': None, 'unit': None, 'name': 'salt and freshly ground black pepper to taste'}, {'quantity': '1', 'unit': 'large', 'name': 'egg'}, {'quantity': '1', 'unit': None, 'name': 'garlic clove'}, {'quantity': '1', 'unit': None, 'name': 'poblano pepper, seeded'}, {'quantity': '1/2', 'unit': 'cup', 'name': 'grapeseed or canola oil'}, {'quantity': '1', 'unit': 'tablespoon', 'name': 'lime juice'}, {'quantity': '6 to 8', 'unit': None, 'name': 'basil leaves'}","Place shrimp, shells on, in a large bowl. Add 1 tablespoon olive oil, salt, and pepper and toss.. Heat a cast iron skillet over medium heat until hot; add 1 tablespoon olive oil to the skillet.. Cook shrimp in the skillet, without crowding, for 3 to 4 minutes on each side. You may have to work in batches. Remove shrimp from skillet and allow to cool.. Combine egg, poblano pepper, garlic clove, lime juice, and basil in a food processor and blend until smooth. With processor running, slowly add 1/2 cup grapeseed oil and process until mixture is smooth and thick.. Transfer mixture to a bowl and very slowly, a drop or two at a time, whisk in remaining 1/2 cup olive oil by hand. Season with salt and pepper.","calories: 645, fat: 63g, carbs: 3g, protein: 17g, servings: 4"
Pizza Skulls Are the Deliciously Spooky Snack You Need This Halloween,https://www.allrecipes.com/pizza-skulls-recipe-8363266,"{'quantity': '1', 'unit': '(13.8-oz.)\xa0can', 'name': 'pizza crust dough'}, {'quantity': '4 1/2', 'unit': 'ounces', 'name': 'low moisture part skim mozzarella'}, {'quantity': '3/4', 'unit': 'cup', 'name': 'pizza sauce'}, {'quantity': '6', 'unit': 'tablespoons', 'name': 'pepperoni'}, {'quantity': '1 1/2', 'unit': 'ounces', 'name': 'Parmesan cheese'}, {'quantity': '1 1/2', 'unit': 'teaspoons', 'name': 'Italian seasoning'}",,"calories: 298, fat: 12g, carbs: 35g, protein: 12g, servings: 6"
Halloween Mini Cheesecakes,https://www.allrecipes.com/halloween-mini-cheesecakes-recipe-8357428,"{'quantity': '1', 'unit': '(16 ounce) package', 'name': 'refrigerated ready-to-bake sugar cookies dough,'}, {'quantity': '1 (24', 'unit': 'ounce) container', 'name': 'No Bake Cheesecake'}, {'quantity': None, 'unit': None, 'name': 'candy corn'}, {'quantity': None, 'unit': None, 'name': 'colorful icing'}, {'quantity': None, 'unit': None, 'name': 'colorful sprinkles'}","Preheat the oven to 350 degrees F (180 degrees C). Line a cupcake pan with paper liners.. Place one cookie dough piece in each cupcake liner.. Bake in the preheated oven for 12 minutes. Remove to cool on a wire rack.. Beat no bake cheesecake filling with a whisk or spoon until light and fluffy. With a disposable piping bag or spoon, pipe cheesecake on top of each cooled cookie up to the midpoint of cupcake liner. Gently flatten surface with a spoon, ensuring there are no air pockets.. Refrigerate for 15 minutes to set.. Place toppings or candy in a small bowl. Decorate with Halloween toppings, candy, icing, and sprinkles. Take out of cupcake liners and enjoy!","calories: 315, fat: 13g, carbs: 42g, protein: 8g, servings: 12"
Salted Pumpkin Caramels,https://www.allrecipes.com/salted-pumpkin-caramels-recipe-8347647,"{'quantity': '2/3', 'unit': 'cup', 'name': 'unsalted pumpkin seeds'}, {'quantity': '2/3', 'unit': 'cup', 'name': 'pumpkin puree'}, {'quantity': '1 1/4', 'unit': 'cups', 'name': 'heavy cream'}, {'quantity': '2', 'unit': 'cups', 'name': 'white sugar'}, {'quantity': '1/3', 'unit': 'cup', 'name': 'maple syrup'}, {'quantity': '1/4', 'unit': 'cup', 'name': 'light corn syrup'}, {'quantity': '1/4', 'unit': 'cup', 'name': 'water'}, {'quantity': '3', 'unit': 'tablespoons', 'name': 'unsalted butter, cut into slices'}, {'quantity': '1/4', 'unit': 'teaspoon', 'name': 'ground cinnamon'}, {'quantity': '1/8', 'unit': 'teaspoon', 'name': 'ground cloves'}, {'quantity': '1/8', 'unit': 'teaspoon', 'name': 'ground nutmeg'}, {'quantity': '1/8', 'unit': 'teaspoon', 'name': 'salt'}, {'quantity': '3/4', 'unit': 'teaspoon', 'name': 'white vinegar or lemon juice'}, {'quantity': '1/4', 'unit': 'teaspoon', 'name': 'sea salt, such as fleur de sel'}",,"calories: 57, fat: 2g, carbs: 9g, protein: 0g, servings: 64"
“Horrible Hand” Ham and Cheese Board,https://www.allrecipes.com/horrible-hand-ham-and-cheese-board-recipe-7974921,"{'quantity': '1 1/2', 'unit': 'pounds', 'name': 'cream cheese, softened'}, {'quantity': '1/3', 'unit': 'cup', 'name': 'roasted red pepper'}, {'quantity': '2', 'unit': 'tablespoons', 'name': 'talian parsley'}, {'quantity': '1/2', 'unit': 'teaspoon', 'name': 'ground black pepper'}, {'quantity': '1/4', 'unit': 'teaspoon', 'name': 'garlic powder'}, {'quantity': '1/4', 'unit': 'teaspoon', 'name': 'salt'}, {'quantity': '1', 'unit': 'pinch', 'name': 'cayenne pepper'}, {'quantity': '6', 'unit': 'ounces', 'name': 'prosciutto, or other cured ham'}, {'quantity': None, 'unit': None, 'name': 'crackers or bread to serve'}",,"calories: 116, fat: 11g, carbs: 2g, protein: 4g, servings: 24"
Pumpkin-Black Cocoa Swirl Cake,https://www.allrecipes.com/pumpkin-black-cocoa-swirl-cake-recipe-7974201,"{'quantity': None, 'unit': None, 'name': ""cooking spray with flour, such as Baker's Joy""}, {'quantity': '3', 'unit': 'cups', 'name': 'all-purpose flour'}, {'quantity': '2 1/2', 'unit': 'teaspoons', 'name': 'pumpkin pie spice'}, {'quantity': '2', 'unit': 'teaspoons', 'name': 'baking powder'}, {'quantity': '1', 'unit': 'teaspoon', 'name': 'baking soda'}, {'quantity': '1', 'unit': 'teaspoon', 'name': 'salt'}, {'quantity': '1/2', 'unit': 'cup', 'name': 'unsalted butter, softened'}, {'quantity': '1/4', 'unit': 'cup', 'name': 'vegetable oil'}, {'quantity': '2', 'unit': 'cups', 'name': 'white sugar'}, {'quantity': '4', 'unit': 'large', 'name': 'eggs, at room temperature'}, {'quantity': '1', 'unit': '(15-ounce can)', 'name': 'pumpkin puree'}, {'quantity': '2', 'unit': 'teaspoons', 'name': 'vanilla extract'}, {'quantity': '1', 'unit': 'cup', 'name': 'sour cream, at room temperature'}, {'quantity': '3', 'unit': 'tablespoons', 'name': 'cocoa powder ('}, {'quantity': None, 'unit': 'tablespoons', 'name': 'cocoa powder ('}, {'quantity': '2', 'unit': 'tablespoons', 'name': 'white sugar'}, {'quantity': '1/4', 'unit': 'cup', 'name': 'milk'}, {'quantity': '1', 'unit': 'teaspoon', 'name': 'espresso powder (optional)'}, {'quantity': '1', 'unit': '(1 ounce)', 'name': 'baking chocolate, melted and cooled slightly'}, {'quantity': '1', 'unit': 'cup', 'name': ""confectioner's sugar""}, {'quantity': '2', 'unit': 'tablespoons', 'name': 'cocoa powder'}, {'quantity': '1', 'unit': 'teaspoon', 'name': 'vanilla extract'}, {'quantity': '1', 'unit': 'pinch', 'name': 'salt'}, {'quantity': '6', 'unit': 'tablespoons', 'name': 'heavy cream, or as needed'}","Preheat the oven to 350 degrees F. Spray a 12-cup Bundt pan with a baking spray containing flour, such as Baker's Joy®.. In a large bowl, sift together flour, pumpkin pie spice, baking powder, baking soda, and salt.. In another large bowl, beat butter, oil, and 2 cups white sugar on medium-high speed with an electric mixer until creamy, about 3 minutes. Add in eggs, 1 at a time, beating well after each addition. After adding in the last egg, beat mixture on medium-high speed until doubled in volume, about 5 minutes. Add in pumpkin and vanilla, and mix until incorporated. Reduce mixer speed to low; pour in half of dry ingredients, and mix until just combined. Add in sour cream; mix until just combined. Add in remaining dry ingredients and mix until just combined.. Measure out 3 cups batter into another bowl. To this 3 cups batter, add 3 tablespoon black cocoa powder, unsweetened cocoa powder, 2 tablespoons sugar, milk, espresso powder, and melted semi-sweet chocolate. Mix on low speed until combined.. Place 1/3 of black cocoa batter into an even layer in the bottom of the prepared Bundt pan. Pour 1/2 of plain pumpkin batter over the black cocoa layer. Add another 1/3 of black cocoa batter over the top of plain pumpkin batter. Layer remaining 1/2 of plain pumpkin batter over that. Finish with remaining 1/3 of the black cocoa batter.. Bake cake in the preheated oven until a bamboo skewer inserted into the center of the cake comes out mostly clean, 60 to 65 minutes. Allow cake to cool in pan 25 to 30 minutes before inverting onto a wire rack to cool completely.. To make icing, place powdered sugar, 2 tablespoons black cocoa, 1 teaspoon vanilla extract, pinch of salt, and heavy cream into a bowl. Whisk until smooth. Drizzle icing over cooled cake.","calories: 530, fat: 22g, carbs: 76g, protein: 8g, servings: 12"
Chocolate-Candy Corn Pretzel Bites,https://www.allrecipes.com/recipe/8486405/chocolate-candy-corn-pretzel-bites/,"{'quantity': '1', 'unit': '(15 ounce) package', 'name': 'pretzel snaps (square waffle-shaped pretzels)'}, {'quantity': '1', 'unit': '(10 ounce) bag', 'name': ""chocolate candies (such as Hershey®'s Hugs®)""}, {'quantity': '1', 'unit': '(14 ounce) package', 'name': 'candy corn'}","Preheat the oven to 300 degrees F (150 degrees C). Line a baking sheet with parchment paper.. Arrange the pretzels in a single layer on the tray. Place a single Hersey's Hug on the center of each pretzel.. Bake until hugs start to melt slightly, 4 to 5 minutes. You want the chocolate candies to be soft but not entirely melted.. Remove from the oven and quickly place a candy corn on top of each hug, pressing down to secure in the chocolate. Move to the fridge to cool for about 30 minutes.","calories: 309, fat: 10g, carbs: 52g, protein: 3g, servings: 10"
Halloween Spiderweb Layered Dip,https://www.allrecipes.com/recipe/8493919/halloween-spiderweb-layered-dip/,"{'quantity': '1', 'unit': 'cup', 'name': 'guacamole'}, {'quantity': '1 ½', 'unit': 'cups', 'name': 'sour cream, divided'}, {'quantity': '1', 'unit': '(1.25 ounce) package', 'name': 'taco seasoning'}, {'quantity': '1 ½', 'unit': 'cups', 'name': 'finely shredded Cheddar and Monterey Jack cheese blend'}, {'quantity': '1', 'unit': '(15 ounce) jar', 'name': 'salsa'}, {'quantity': '1', 'unit': '(20 ounce) can', 'name': 'refried black beans'}, {'quantity': '1', 'unit': 'large', 'name': 'black olive'}, {'quantity': '1', 'unit': '(6 ounce) can', 'name': 'sliced black olives'}, {'quantity': '', 'unit': '', 'name': 'chopped green onions (for garnish)'}","Spread guacamole in the bottom of a round serving dish in an even layer.. Mix 1 cup of the sour cream with the taco seasoning in a bowl. Spread the seasoned sour cream mixture evenly over the guacamole layer.. Sprinkle cheese on top of the sour cream, then pour salsa evenly over the cheese, covering ot completely.. Pour refried beans into a microwave-safe container and warm until softened (this will make it easier to spread). Spread over the top of the salsa layer, leaving about 1 inch of the salsa showing around the edge of the dish.. Place the remaining 1/2 cup of sour cream into a piping bag, or a plastic bag with the corner snipped off. Pipe a spiderweb pattern on top of the bean layer.. Add a spider to the top by cutting the large black olive in half lengthwise to make the spider's body. Cut four of the sliced olives in half to create eight legs. Arrange the pieces on top of the web.. Arrange the remaining sliced black olives and the chopped green onions around the edge of the dip.","calories: 456, fat: 32g, carbs: 31g, protein: 16g, servings: 6"
Spooky Spider Halloween Hot Dogs,https://www.allrecipes.com/recipe/267865/spooky-spider-halloween-hot-dogs/,"{'quantity': '1', 'unit': '(8 ounce) can', 'name': 'refrigerated crescent rolls'}, {'quantity': '8', 'unit': '', 'name': 'hot dogs'}, {'quantity': '2', 'unit': 'tablespoons', 'name': 'ketchup, or to taste'}","Preheat the oven to 375 degrees F (190 degrees C).. Unroll crescent dough. Pinch or press the perforation between the triangles to get four rectangular pieces. Cut rectangles in half lengthwise, making eight narrow strips.. Make a 2-inch slice through the center of one end of a hot dog. Cut two more 2-inch slices on either side of that slice, so the ""legs"" are about the same thickness. Repeat on other end. Cut ""legs"" into remaining hot dogs.. Roll a crescent strip around center of each dog. Place spider dogs on an ungreased baking sheet.. Bake in the preheated oven until golden brown, about 11 minutes. Dip a chopstick into some ketchup and dot ""eyes"" onto each spider. Serve with remaining ketchup.","calories: 262, fat: 19g, carbs: 14g, protein: 7g, servings: 8"
Ghost Cheesecake Brownies,https://www.allrecipes.com/recipe/8499356/ghost-cheesecake-brownies/,"{'quantity': '3', 'unit': 'ounces', 'name': 'dark chocolate, chopped'}, {'quantity': '½', 'unit': 'cup', 'name': 'unsalted butter, melted'}, {'quantity': '2', 'unit': 'large', 'name': 'eggs'}, {'quantity': '1 ¼', 'unit': 'cups', 'name': 'granulated sugar'}, {'quantity': '1', 'unit': 'teaspoon', 'name': 'vanilla extract'}, {'quantity': '¾', 'unit': 'teaspoon', 'name': 'kosher salt'}, {'quantity': '⅔', 'unit': 'cup', 'name': 'all-purpose flour'}, {'quantity': '½', 'unit': '(8 ounce) package', 'name': 'cream cheese, softened'}, {'quantity': '2', 'unit': 'tablespoons', 'name': 'white sugar'}, {'quantity': '1', 'unit': 'large', 'name': 'egg white'}, {'quantity': '¼', 'unit': 'teaspoon', 'name': 'vanilla extract'}",,"calories: 355, fat: 19g, carbs: 44g, protein: 4g, servings: 9"
