name,link,ingredients,steps,nutrition
Vicki's Hush Puppies,https://www.allrecipes.com/recipe/25241/vickis-hush-puppies/,"{'quantity': '1', 'unit': 'quart', 'name': 'oil for frying, or as needed'}, {'quantity': '1', 'unit': 'large', 'name': 'onion, diced'}, {'quantity': '½', 'unit': 'cup', 'name': 'white sugar'}, {'quantity': '2', 'unit': 'large', 'name': 'eggs, beaten'}, {'quantity': '1', 'unit': 'cup', 'name': 'self-rising flour'}, {'quantity': '1', 'unit': 'cup', 'name': 'self-rising cornmeal'}",,"calories: 277, fat: 13g, carbs: 37g, protein: 5g, servings: 8"
Air Fryer Hush Puppies,https://www.allrecipes.com/recipe/277403/air-fryer-hush-puppies/,"{'quantity': '', 'unit': '', 'name': 'nonfat cooking spray'}, {'quantity': '1', 'unit': 'cup', 'name': 'yellow cornmeal'}, {'quantity': '¾', 'unit': 'cup', 'name': 'all-purpose flour'}, {'quantity': '1 ½', 'unit': 'teaspoons', 'name': 'baking powder'}, {'quantity': '½', 'unit': 'teaspoon', 'name': 'salt'}, {'quantity': '¼', 'unit': 'teaspoon', 'name': 'cayenne pepper, or more to taste'}, {'quantity': '¼', 'unit': 'teaspoon', 'name': 'garlic powder'}, {'quantity': '2', 'unit': 'tablespoons', 'name': 'minced onion'}, {'quantity': '2', 'unit': 'tablespoons', 'name': 'minced bell pepper'}, {'quantity': '¾', 'unit': 'cup', 'name': 'low-fat buttermilk'}, {'quantity': '1', 'unit': 'large', 'name': 'egg'}","Preheat an air fryer to 390 degrees F (198 degrees C) according to the manufacturer's instructions. Line the bottom of the air fryer basket with foil and spray the foil with cooking spray.. Stir cornmeal, flour, baking powder, salt, cayenne, and garlic powder together in a large bowl. Mix in onion and bell pepper.. Whisk buttermilk and egg together in a separate bowl; pour into dry ingredients and stir to combine. Let mixture rest for 5 minutes.. Use a 2-tablespoon scoop to drop portions of batter into the prepared basket; leave space between each scoop. Spray with cooking spray.. Cook in the preheated air fryer until golden brown, crispy, and cooked through, 9 to 10 minutes. Serve hot.","calories: 85, fat: 1g, carbs: 16g, protein: 3g, servings: 12"
Simple Hush Puppies,https://www.allrecipes.com/recipe/222531/simple-hush-puppies/,"{'quantity': '1', 'unit': 'quart', 'name': 'vegetable oil for frying, or as needed'}, {'quantity': '¾', 'unit': 'cup', 'name': 'milk'}, {'quantity': '1', 'unit': '', 'name': 'egg'}, {'quantity': '2', 'unit': 'tablespoons', 'name': 'minced onion'}, {'quantity': '1', 'unit': 'cup', 'name': 'baking mix'}, {'quantity': '1', 'unit': 'cup', 'name': 'cornmeal'}, {'quantity': '1', 'unit': 'teaspoon', 'name': 'salt'}","Heat oil in a deep-fryer or large saucepan to 350 degrees F (175 degrees C).. Whisk milk, egg, and onion together in a bowl. Stir pancake mix, cornmeal, and salt into milk mixture to form a smooth batter.. Scoop ping pong ball-sized balls of batter using a small ice cream scoop; drop about 5 scoops per batch into the hot oil. Fry until golden brown, 5 to 6 minutes. Remove hush puppies with a slotted spoon and drain on a paper towel-lined plate. Repeat with remaining batter.","calories: 162, fat: 10g, carbs: 16g, protein: 3g, servings: 12"
Hush Puppies,https://www.allrecipes.com/recipe/222532/hush-puppies/,"{'quantity': '1', 'unit': 'quart', 'name': 'vegetable oil for frying, or as needed'}, {'quantity': '½', 'unit': 'cup', 'name': 'all-purpose flour'}, {'quantity': '½', 'unit': 'cup', 'name': 'self-rising cornmeal'}, {'quantity': '½', 'unit': '', 'name': 'onion, minced'}, {'quantity': '½', 'unit': 'cup', 'name': 'milk'}, {'quantity': '1', 'unit': '', 'name': 'egg, beaten'}, {'quantity': '1', 'unit': 'stalk', 'name': 'celery, minced'}, {'quantity': '2', 'unit': 'cloves', 'name': 'garlic, minced'}, {'quantity': '1', 'unit': 'pinch', 'name': 'Cajun seasoning, or to taste'}","Heat oil in a deep-fryer or large saucepan to 375 degrees F (190 degrees C).. Mix flour, cornmeal, onion, milk, egg, celery, garlic, and Cajun seasoning in a bowl.. Drop ping pong ball-sized balls of batter, about 5 at a time, into the hot oil. Fry until golden brown, about 5 minutes. Remove hush puppies with a slotted spoon and drain on a paper towel-lined plate. Repeat with remaining batter.","calories: 372, fat: 25g, carbs: 32g, protein: 6g, servings: 4"
Buttermilk Hush Puppies,https://www.allrecipes.com/recipe/222243/buttermilk-hush-puppies/,"{'quantity': '1', 'unit': 'quart', 'name': 'vegetable oil for frying, or as needed'}, {'quantity': '1', 'unit': 'cup', 'name': 'buttermilk'}, {'quantity': '¼', 'unit': 'cup', 'name': 'vegetable oil'}, {'quantity': '2', 'unit': '', 'name': 'eggs, room temperature'}, {'quantity': '1', 'unit': 'cup', 'name': 'cornmeal'}, {'quantity': '1', 'unit': 'cup', 'name': 'all-purpose flour'}, {'quantity': '¼', 'unit': 'cup', 'name': 'white sugar (Optional)'}, {'quantity': '½', 'unit': 'teaspoon', 'name': 'baking soda'}, {'quantity': '½', 'unit': 'teaspoon', 'name': 'salt'}, {'quantity': '½', 'unit': 'cup', 'name': 'minced onion'}, {'quantity': '4', 'unit': '', 'name': 'green onions, minced'}","Heat 1 quart vegetable oil in a deep-fryer or large saucepan to 365 degrees F (185 degrees C).. Preheat oven to 200 degrees F (95 degrees C).. Whisk buttermilk, 1/4 cup vegetable oil, and eggs in a bowl.. Combine cornmeal, flour, sugar, baking soda, and salt in a separate bowl. Fold buttermilk mixture, onion, and green onions into cornmeal mixture until just mixed.. Drop 6 to 8 tablespoon-sized balls of batter into the hot oil; fry until each hush puppy is golden brown, turning the hush puppies to cook evenly, 6 to 10 minutes. Remove hush puppies with a slotted spoon and place on brown paper bags to drain. Repeat with any remaining batter.. Transfer hush puppies to a baking sheet and keep warm in the preheated oven until ready to serve.","calories: 339, fat: 20g, carbs: 35g, protein: 6g, servings: 8"
Quick and Easy Hush Puppies,https://www.allrecipes.com/recipe/220649/quick-and-easy-hush-puppies/,"{'quantity': '2', 'unit': '(8.5 ounce) packages', 'name': 'dry corn muffin mix (such as Jiffy®)'}, {'quantity': '1', 'unit': 'teaspoon', 'name': 'salt'}, {'quantity': '1', 'unit': 'teaspoon', 'name': 'garlic powder'}, {'quantity': '1', 'unit': 'teaspoon', 'name': 'onion powder'}, {'quantity': '½', 'unit': 'teaspoon', 'name': 'ground black pepper'}, {'quantity': '½', 'unit': 'teaspoon', 'name': 'cayenne pepper'}, {'quantity': '3', 'unit': '', 'name': 'eggs'}, {'quantity': '1', 'unit': '(5 ounce) can', 'name': 'evaporated milk'}, {'quantity': '1', 'unit': '(14.75 ounce) can', 'name': 'cream-style corn'}, {'quantity': '1', 'unit': 'quart', 'name': 'vegetable oil for frying, or as needed'}, {'quantity': '1', 'unit': 'pinch', 'name': 'salt to taste'}","Mix corn muffin mix, salt, garlic powder, onion powder, black pepper, and cayenne pepper in a bowl until blended.. Stir eggs and evaporated milk into dry ingredients until moistened.. Stir cream-style corn into mixture to make a moist batter. Let batter stand while oil heats.. Heat oil in a deep-fryer or large saucepan to 375 degrees F (190 degrees C).. Gently drop a teaspoon of batter at a time into the hot oil, staying as close to the oil as possible to avoid splattering. Fry hush puppies until golden brown, about 3 minutes per batch.. Remove hush puppies with a slotted spoon and place on a paper towel-lined plate to drain. Sprinkle with salt if desired.","calories: 176, fat: 9g, carbs: 22g, protein: 4g, servings: 20"
Mom's Cajun Hushpuppies,https://www.allrecipes.com/recipe/222245/moms-cajun-hush-puppies/,"{'quantity': '6', 'unit': 'cups', 'name': 'all-purpose flour'}, {'quantity': '3', 'unit': 'cups', 'name': 'cornmeal'}, {'quantity': '1', 'unit': 'cup', 'name': 'white sugar'}, {'quantity': '1', 'unit': 'cup', 'name': 'grated Parmesan cheese'}, {'quantity': '¼', 'unit': 'cup', 'name': 'baking powder'}, {'quantity': None, 'unit': None, 'name': 'salt and ground black pepper to taste'}, {'quantity': '5', 'unit': 'large', 'name': 'eggs'}, {'quantity': '3', 'unit': None, 'name': 'bell peppers, minced'}, {'quantity': '3', 'unit': None, 'name': 'onions, minced'}, {'quantity': '1', 'unit': '(14 ounce) can', 'name': 'cream-style corn'}, {'quantity': '1', 'unit': '(14 ounce) can', 'name': 'whole kernel corn'}, {'quantity': '1', 'unit': 'cup', 'name': 'chopped pimento peppers'}, {'quantity': '2', 'unit': 'quarts', 'name': 'vegetable oil for frying'}","Mix flour, cornmeal, sugar, Parmesan cheese, baking powder, salt, black pepper, eggs, bell peppers, onions, cream-style corn, whole kernel corn, and pimento peppers in a large bowl.. Heat oil in a deep-fryer or large saucepan to 375 degrees F (190 degrees C).. Drop 6 to 8 tablespoon-sized balls of batter into the hot oil. Fry until hush puppies are golden brown, about 5 minutes. Remove hush puppies with a slotted spoon and place on a paper towel-lined plate to drain. Repeat with any remaining batter.","calories: 348, fat: 10g, carbs: 57g, protein: 8g, servings: 24"
Hawaiian Hush Puppies,https://www.allrecipes.com/recipe/278916/hawaiian-hush-puppies/,"{'quantity': '', 'unit': '', 'name': 'oil for deep frying'}, {'quantity': '1', 'unit': '(15 ounce) can', 'name': 'cream-style corn, drained'}, {'quantity': '1', 'unit': '(15 ounce) can', 'name': 'crushed pineapple, drained'}, {'quantity': '2', 'unit': 'cups', 'name': 'cornmeal'}, {'quantity': '1', 'unit': 'cup', 'name': 'self-rising flour'}, {'quantity': '1', 'unit': 'cup', 'name': 'shredded Cheddar cheese'}, {'quantity': '½', 'unit': 'cup', 'name': 'minced onion'}, {'quantity': '½', 'unit': 'cup', 'name': 'white sugar'}, {'quantity': '2', 'unit': '', 'name': 'eggs, beaten'}, {'quantity': '1', 'unit': 'pinch', 'name': 'salt and ground black pepper to taste'}","Heat oil in a deep fryer or large saucepan to 365 degrees F (185 degrees C).. Mix canned corn, pineapple, cornmeal, flour, Cheddar cheese, onion, sugar, eggs, salt, and pepper together in a large bowl.. Drop as many teaspoonfuls of batter into the hot oil that the pan will allow; cook until golden brown or until they float to the top, about 5 minutes. Drain on a paper towel-lined plate. Repeat with any remaining batter.","calories: 79, fat: 3g, carbs: 12g, protein: 2g, servings: 50"
