name,link,ingredients,steps,nutrition,image_url
Blueberry Buttermilk Coffeecake,https://www.allrecipes.com/recipe/25965/blueberry-buttermilk-coffeecake/,"{'quantity': '4', 'unit': 'cups', 'name': 'all-purpose flour'}, {'quantity': '3', 'unit': 'teaspoons', 'name': 'baking powder'}, {'quantity': '1', 'unit': 'teaspoon', 'name': 'baking soda'}, {'quantity': '1', 'unit': 'teaspoon', 'name': 'salt'}, {'quantity': '1 ⅓', 'unit': 'cups', 'name': 'white sugar'}, {'quantity': '½', 'unit': 'cup', 'name': 'butter'}, {'quantity': '2', 'unit': '', 'name': 'eggs'}, {'quantity': '1', 'unit': 'teaspoon', 'name': 'vanilla extract'}, {'quantity': '2', 'unit': 'cups', 'name': 'buttermilk'}, {'quantity': '2', 'unit': 'cups', 'name': 'blueberries'}, {'quantity': '⅔', 'unit': 'cup', 'name': 'all-purpose flour'}, {'quantity': '⅔', 'unit': 'cup', 'name': 'white sugar'}, {'quantity': '6', 'unit': 'tablespoons', 'name': 'butter, softened'}","Preheat oven to 350 degrees F (175 degrees C). Grease and flour a 9x13 inch pan.. Sift flour, baking powder, baking soda, and salt together in a bowl. Set aside.. In a large bowl, cream together sugar and butter until light and fluffy. Beat in eggs one at a time, then stir in the vanilla. Beat in the flour mixture alternately with the buttermilk, mixing just until incorporated. Sir in blueberries. Pour batter into prepared pan.. In a small bowl, combine flour and sugar. Cut in butter until mixture resembles coarse crumbs. Sprinkle over top of batter.. Bake in the preheated oven for 45 to 60 minutes, or until a toothpick inserted into the center of the cake comes out clean. Allow to cool.","calories: 468, fat: 15g, carbs: 76g, protein: 8g, servings: 12",https://www.allrecipes.com/thmb/L0JFhAupaVbbQ7dBAm5kov4A2Wo=/1500x0/filters:no_upscale():max_bytes(150000):strip_icc()/567531-d6657aba1075458098b9f15d10f148ff.jpg
Plum Cake,https://www.allrecipes.com/recipe/7792/plum-cake/,"{'quantity': '3', 'unit': 'large', 'name': 'eggs'}, {'quantity': '½', 'unit': 'cup', 'name': 'butter, softened'}, {'quantity': '½', 'unit': 'cup', 'name': 'white sugar'}, {'quantity': '1', 'unit': 'teaspoon', 'name': 'lemon zest'}, {'quantity': '1', 'unit': 'cup', 'name': 'all-purpose flour'}, {'quantity': '½', 'unit': 'teaspoon', 'name': 'baking powder'}, {'quantity': '1 ¼', 'unit': 'cups', 'name': 'plums, pitted and quartered'}","Preheat the oven to 375 degrees F (190 degrees C). Grease and flour a 9-inch tube pan.. Separate eggs into whites and yolks. Beat egg whites until stiff peaks form; set aside.. Beat butter and sugar together in a large bowl until light and fluffy. Beat in egg yolks and lemon zest.. Stir flour and baking powder together, then blend into butter mixture. Gently fold in egg whites. Spread cake batter evenly into the prepared pan. There will only be a little over an inch of batter. Arrange plums, skin-side down, in a nice pattern over the batter.. Bake in preheated oven until a tester inserted in the center comes out clean, about 40 minutes. Transfer to a cooling rack and allow to cool before serving.","calories: 246, fat: 14g, carbs: 28g, protein: 4g, servings: 8",https://www.allrecipes.com/thmb/EuJgprgWfsIlcmweJ1mKXOovudA=/1500x0/filters:no_upscale():max_bytes(150000):strip_icc()/5717603-plum-cake-honeypoo-4x3-1-1935904447d742e8b67bc61b45d6eaa7.jpg
Eggless Date Cake,https://www.allrecipes.com/recipe/228297/eggless-date-cake/,"{'quantity': '¾', 'unit': 'cup', 'name': 'milk'}, {'quantity': '18', 'unit': '', 'name': 'dates, pitted and left whole'}, {'quantity': '½', 'unit': 'cup', 'name': 'brown sugar'}, {'quantity': '½', 'unit': 'cup', 'name': 'vegetable oil'}, {'quantity': '1', 'unit': 'teaspoon', 'name': 'vanilla extract (Optional)'}, {'quantity': '1', 'unit': 'cup', 'name': 'all-purpose flour'}, {'quantity': '1', 'unit': 'teaspoon', 'name': 'baking soda'}, {'quantity': '1', 'unit': 'teaspoon', 'name': 'ground cinnamon (Optional)'}, {'quantity': '¼', 'unit': 'cup', 'name': 'chopped walnuts (Optional)'}","Heat milk in a saucepan until almost boiling and stir in dates; let soak for several hours, refrigerated. For best flavor, refrigerate dates and milk overnight.. Preheat oven to 350 degrees F (175 degrees C). Grease a medium loaf pan.. Transfer milk and dates to food processor, add brown sugar, and process into a smooth paste. Mix in vegetable oil and vanilla extract with a few pulses.. Whisk flour, baking soda, and cinnamon in a bowl until thoroughly combined. Pulse flour mixture, about 1/4 cup at a time, into the date paste until batter is smooth; do not overmix. Stir walnuts into batter with a fork and transfer to the prepared loaf pan.. Bake in the preheated oven until a toothpick inserted into the middle of the cake comes out clean, about 40 minutes.","calories: 320, fat: 17g, carbs: 41g, protein: 3g, servings: 8",https://www.allrecipes.com/thmb/g1Oq8CMjHlAbcdDMBYQ8qGjaJxs=/1500x0/filters:no_upscale():max_bytes(150000):strip_icc()/7268705-b700b0cdc4ea4f16993f8c7693258c16.jpg
Walnut Sour Cream Coffee Cake,https://www.allrecipes.com/recipe/228422/sour-cream-coffee-cake/,"{'quantity': '1', 'unit': 'cup', 'name': 'white sugar'}, {'quantity': '½', 'unit': 'cup', 'name': 'butter'}, {'quantity': '2', 'unit': 'cups', 'name': 'all-purpose flour'}, {'quantity': '1', 'unit': '(16 ounce) container', 'name': 'reduced-fat sour cream'}, {'quantity': '2', 'unit': '', 'name': 'eggs, beaten'}, {'quantity': '1', 'unit': 'teaspoon', 'name': 'vanilla extract'}, {'quantity': '1', 'unit': 'teaspoon', 'name': 'baking powder'}, {'quantity': '1', 'unit': 'teaspoon', 'name': 'baking soda'}, {'quantity': '½', 'unit': 'teaspoon', 'name': 'salt (Optional)'}, {'quantity': '½', 'unit': 'cup', 'name': 'chopped walnuts'}, {'quantity': '½', 'unit': 'cup', 'name': 'white sugar'}, {'quantity': '2', 'unit': 'teaspoons', 'name': 'ground cinnamon'}","Preheat oven to 350 degrees F (175 degrees C). Grease a 9x13-inch pan, springform pan, or tube pan.. Beat 1 cup sugar and butter with an electric mixer in a large bowl until light and fluffy. Add flour, sour cream, eggs, vanilla, baking powder, baking soda, and salt; continue beating until ingredients integrate into a batter.. Mix walnuts, 1/2 cup sugar, and ground cinnamon in a separate bowl.. Pour about half the batter into the prepared pan. Sprinkle about half the walnut topping over the batter and top with remaining batter. Finish by sprinkling remaining topping over the batter.. Bake in preheated oven until a toothpick inserted into the center comes out clean, about 45 minutes (depending on pan used). Cool in the pans for 10 minutes before removing to cool completely on a wire rack.","calories: 337, fat: 16g, carbs: 44g, protein: 5g, servings: 12",https://www.allrecipes.com/thmb/si-AGXabsulsAxruZxgQZ8Nl-54=/1500x0/filters:no_upscale():max_bytes(150000):strip_icc()/9136584-sour-cream-coffee-cake-Carla-Hetzel-4x3-1-2000-8fbf74d6c8d74f6cb9b6193f729b0270.jpg
Blueberry Muffin Cake,https://www.allrecipes.com/recipe/274331/blueberry-muffin-cake/,"{'quantity': '', 'unit': '', 'name': 'cooking spray'}, {'quantity': '1', 'unit': 'cup', 'name': 'blueberries'}, {'quantity': '1 ½', 'unit': 'cups', 'name': 'all-purpose flour, divided'}, {'quantity': '½', 'unit': 'cup', 'name': 'white sugar'}, {'quantity': '¼', 'unit': 'cup', 'name': 'vegetable oil'}, {'quantity': '½', 'unit': 'cup', 'name': 'milk'}, {'quantity': '1', 'unit': '', 'name': 'egg'}, {'quantity': '1', 'unit': 'teaspoon', 'name': 'vanilla extract'}, {'quantity': '3', 'unit': 'teaspoons', 'name': 'baking powder'}, {'quantity': '½', 'unit': 'teaspoon', 'name': 'salt'}, {'quantity': '½', 'unit': 'cup', 'name': 'brown sugar'}, {'quantity': '⅓', 'unit': 'cup', 'name': 'all-purpose flour'}, {'quantity': '2', 'unit': 'teaspoons', 'name': 'cinnamon'}, {'quantity': '¼', 'unit': 'cup', 'name': 'butter'}","Preheat the oven to 400 degrees F (200 degrees C). Spray an 8x8-inch baking pan with cooking spray.. Toss blueberries and 1/2 cup of flour in a small bowl until blueberries are coated. Set aside.. Beat together sugar and oil with an electric mixer in a large bowl. Add milk, egg, and vanilla extract. Mix remaining 1 cup flour, baking powder, and salt in a small bowl. Add flour mixture to sugar mixture; mix until just combined. fold in blueberry mixture. Pour batter into the prepared baking pan.. Mix together brown sugar, 1/3 cup flour, and cinnamon in a bowl. Cut in butter until topping mixture is crumbly. Sprinkle on top of the cake batter.. Bake in the preheated oven until a toothpick inserted in the center comes out clean, about 30 minutes. Remove from oven and allow to cool before serving.","calories: 293, fat: 12g, carbs: 42g, protein: 4g, servings: 9",https://www.allrecipes.com/thmb/sXAiDXJnRZLU_-6t9IAgyXJdGTU=/1500x0/filters:no_upscale():max_bytes(150000):strip_icc()/6754342-e0d69018912f4c289baeb60828c11e19.jpg
Plum Kuchen,https://www.allrecipes.com/recipe/233232/plum-kuchen/,"{'quantity': '½', 'unit': 'cup', 'name': 'white sugar'}, {'quantity': '2', 'unit': 'tablespoons', 'name': 'butter'}, {'quantity': '2', 'unit': 'large', 'name': 'eggs, beaten'}, {'quantity': '1', 'unit': 'cup', 'name': 'all-purpose flour'}, {'quantity': '1', 'unit': 'teaspoon', 'name': 'baking powder'}, {'quantity': '¼', 'unit': 'teaspoon', 'name': 'salt'}, {'quantity': '1', 'unit': 'teaspoon', 'name': 'vanilla extract'}, {'quantity': '10', 'unit': None, 'name': 'ripe plums, halved and pitted'}, {'quantity': '1', 'unit': 'cup', 'name': 'white sugar'}, {'quantity': '½', 'unit': 'cup', 'name': 'all-purpose flour'}, {'quantity': '3', 'unit': 'tablespoons', 'name': 'butter, melted'}, {'quantity': '½', 'unit': 'teaspoon', 'name': 'ground cinnamon'}","Preheat the oven to 350 degrees F (175 degrees C). Grease and flour an 7x11-inch baking dish.. Beat 1/2 cup sugar and 2 tablespoons butter together in a bowl using an electric mixer until smooth and creamy. Mix eggs, 1 cup flour, baking powder, and salt into creamed butter mixture; stir in vanilla. Pour batter into the prepared baking dish. Arrange plums, skin side-down, atop batter.. Mix 1 cup sugar, 1/2 cup flour, 3 tablespoons butter, and cinnamon together in a bowl until crumbly; spoon over batter and plums.. Bake in the preheated oven until plums are softened, about 35 minutes.","calories: 232, fat: 6g, carbs: 44g, protein: 3g, servings: 12",https://www.allrecipes.com/thmb/q38w7kdyPM0XR4bdA2a6a-EKLRU=/1500x0/filters:no_upscale():max_bytes(150000):strip_icc()/1029506-5ce9b574330747f98232663d4f8a7312.jpg
Overnight Coffee Cake,https://www.allrecipes.com/recipe/7973/overnight-coffee-cake/,"{'quantity': '⅓', 'unit': 'cup', 'name': 'butter, softened'}, {'quantity': '½', 'unit': 'cup', 'name': 'white sugar'}, {'quantity': '¼', 'unit': 'cup', 'name': 'packed brown sugar'}, {'quantity': '1', 'unit': '', 'name': 'egg'}, {'quantity': '1', 'unit': 'cup', 'name': 'all-purpose flour'}, {'quantity': '½', 'unit': 'teaspoon', 'name': 'baking powder'}, {'quantity': '¼', 'unit': 'teaspoon', 'name': 'baking soda'}, {'quantity': '½', 'unit': 'teaspoon', 'name': 'ground cinnamon'}, {'quantity': '½', 'unit': 'cup', 'name': 'buttermilk'}, {'quantity': '¼', 'unit': 'cup', 'name': 'packed brown sugar'}, {'quantity': '¼', 'unit': 'cup', 'name': 'finely chopped walnuts'}, {'quantity': '¼', 'unit': 'teaspoon', 'name': 'ground cinnamon'}","Lightly grease an 8 inch square baking pan. In a large bowl, cream together the butter, white sugar, and 1/4 cup brown sugar. Beat in the egg until well blended. In a medium bowl, combine the flour, baking powder, baking soda, and 1/2 teaspoon cinnamon. Stir the flour mixture into the creamed mixture alternately with buttermilk. Spread evenly into the prepared baking pan.. In a small bowl, mix 1/4 cup brown sugar, walnuts, and 1/4 teaspoon cinnamon. Sprinkle over the batter. Cover, and refrigerate overnight.. The next day, preheat oven to 350 degrees F (175 degrees C). Bake the cake for 40 to 45 minutes in the preheated oven, or until a toothpick inserted in the center comes out clean.","calories: 177, fat: 7g, carbs: 26g, protein: 2g, servings: 12",https://www.allrecipes.com/thmb/-2jkfQ73f7YzfUS96Q68iuVEN_I=/1500x0/filters:no_upscale():max_bytes(150000):strip_icc()/590191-79ef50e4266b4d1196f9cdf2ed9936f6.jpg
Old Fashioned Crumb Cake,https://www.allrecipes.com/recipe/21438/old-fashioned-crumb-cake/,"{'quantity': '1', 'unit': 'cup', 'name': 'white sugar'}, {'quantity': '1 ½', 'unit': 'cups', 'name': 'all-purpose flour'}, {'quantity': '½', 'unit': 'cup', 'name': 'butter, cut into pieces'}, {'quantity': '1', 'unit': 'teaspoon', 'name': 'ground cinnamon'}, {'quantity': '½', 'unit': 'teaspoon', 'name': 'ground cloves'}, {'quantity': '1', 'unit': 'teaspoon', 'name': 'baking soda'}, {'quantity': '1', 'unit': 'pinch', 'name': 'salt'}, {'quantity': '1', 'unit': 'cup', 'name': 'buttermilk'}, {'quantity': '1', 'unit': '', 'name': 'egg, lightly beaten'}","Preheat oven to 350 degrees F (175 degrees C). Lightly grease a 7x11 inch baking pan or casserole dish.. Combine sugar, flour and butter. Use a fork to cut butter in until mixture resembles coarse crumbs. Set aside 1/2 cup of this mixture to use as topping.. To the remaining flour mixture, add cinnamon, cloves, baking soda and salt. Lightly stir in the buttermilk and egg. Pour batter into prepared pan. Sprinkle cake with reserved topping.. Bake in preheated oven for 25 minutes, until a toothpick inserted into center of the cake comes out clean.","calories: 204, fat: 8g, carbs: 30g, protein: 3g, servings: 12",https://www.allrecipes.com/thmb/Q0_DVXG5CaORlKz-kYVQ6P_WU6k=/1500x0/filters:no_upscale():max_bytes(150000):strip_icc()/21075-5c730acd65a04c27baa53a4e8d6ca935.jpg
Peach Kuchen,https://www.allrecipes.com/recipe/26036/peach-kuchen/,"{'quantity': '½', 'unit': 'cup', 'name': 'margarine'}, {'quantity': '¼', 'unit': 'cup', 'name': 'white sugar'}, {'quantity': '1', 'unit': '', 'name': 'egg'}, {'quantity': '1', 'unit': 'teaspoon', 'name': 'vanilla extract'}, {'quantity': '1', 'unit': 'cup', 'name': 'all-purpose flour'}, {'quantity': '½', 'unit': 'teaspoon', 'name': 'baking powder'}, {'quantity': '¼', 'unit': 'teaspoon', 'name': 'salt'}, {'quantity': '1', 'unit': '(29 ounce) can', 'name': 'sliced peaches, drained'}, {'quantity': '3', 'unit': 'tablespoons', 'name': 'white sugar'}, {'quantity': '1', 'unit': 'teaspoon', 'name': 'ground cinnamon'}","Preheat oven to 350 degrees F (175 degrees C). Grease and flour a 9 inch springform pan. Sift together the flour, baking powder and salt. Set aside.. In a large bowl, cream together the butter and sugar until light and fluffy. Beat in the egg, then stir in the vanilla. Beat in the flour mixture. Spread dough with hands over the bottom and 1 inch up the sides of prepared springform pan. Arrange peach slices in a spoke pattern over the dough. Sprinkle with sugar and cinnamon.. Bake in the preheated oven for 35 to 40 minutes, or until golden brown.","calories: 170, fat: 8g, carbs: 23g, protein: 2g, servings: 12",https://www.allrecipes.com/thmb/V4pk-4cQYs8HTGcAyzFpiZMjYX4=/1500x0/filters:no_upscale():max_bytes(150000):strip_icc()/2306248_Peach-Kuchen-4x3-1c8d7f417a9e41e3b66e69207f58a84c.jpg
Apple Dapple Cake,https://www.allrecipes.com/recipe/7437/apple-dapple-cake/,"{'quantity': '1 ½', 'unit': 'cups', 'name': 'white sugar'}, {'quantity': '1', 'unit': 'cup', 'name': 'vegetable oil'}, {'quantity': '½', 'unit': 'cup', 'name': 'butter, softened'}, {'quantity': '3', 'unit': 'large', 'name': 'eggs'}, {'quantity': '½', 'unit': 'teaspoon', 'name': 'vanilla extract'}, {'quantity': '3', 'unit': 'cups', 'name': 'all-purpose flour'}, {'quantity': '1', 'unit': 'teaspoon', 'name': 'baking soda'}, {'quantity': '½', 'unit': 'teaspoon', 'name': 'salt'}, {'quantity': '2', 'unit': 'cups', 'name': 'diced apple without peel'}, {'quantity': '1', 'unit': 'cup', 'name': 'flaked coconut'}, {'quantity': '1', 'unit': 'cup', 'name': 'raisins'}, {'quantity': '1', 'unit': 'cup', 'name': 'chopped walnuts'}, {'quantity': '1', 'unit': 'cup', 'name': 'brown sugar'}, {'quantity': '½', 'unit': 'cup', 'name': 'butter'}, {'quantity': '¼', 'unit': 'cup', 'name': 'milk'}","Preheat the oven to 325 degrees F (165 degrees C). Grease and flour a 10-inch tube pan.. Make the cake: Combine sugar, oil, and softened butter in a large mixing bowl; beat with an electric mixer until smooth and creamy. Mix in eggs, one at a time, then mix in vanilla. Gradually mix in flour, baking soda, and salt until well combined. Stir in apples, coconut, raisins, and walnuts. Pour batter into the prepared pan.. Bake in the preheated oven until a cake tester inserted in the center comes out clean, about 90 minutes. Remove from the oven and let cool from the pan for a few minutes. Run a table knife around the edges to loosen. Invert carefully onto a serving plate or cooling rack.. While the cake is cooling, make the glaze: Combine brown sugar, butter, and milk in a small saucepan; bring to a boil. Once boiling, stir for 1 minute to combine.. Pour glaze over warm cake.","calories: 512, fat: 31g, carbs: 57g, protein: 6g, servings: 14",https://www.allrecipes.com/thmb/SmJyJWiA7DEsOf9_jLDsyfTq_Ak=/1500x0/filters:no_upscale():max_bytes(150000):strip_icc()/1127416-e1a7129222804724a813de7484c2561b.jpg
Butterkuchen,https://www.allrecipes.com/recipe/17402/butterkuchen/,"{'quantity': '2', 'unit': '(.25 ounce) packages', 'name': 'dry yeast'}, {'quantity': '½', 'unit': 'cup', 'name': 'water'}, {'quantity': '¾', 'unit': 'cup', 'name': 'milk'}, {'quantity': '½', 'unit': 'cup', 'name': 'white sugar'}, {'quantity': '1', 'unit': 'teaspoon', 'name': 'salt'}, {'quantity': '½', 'unit': 'cup', 'name': 'butter'}, {'quantity': '4', 'unit': 'cups', 'name': 'all-purpose flour'}, {'quantity': '3', 'unit': '', 'name': 'eggs'}, {'quantity': '½', 'unit': 'cup', 'name': 'butter'}, {'quantity': '1', 'unit': 'cup', 'name': 'white sugar'}, {'quantity': '½', 'unit': 'teaspoon', 'name': 'ground cinnamon'}","Butter a 9x13 inch pan and set aside. In a small mixing bowl, dissolve yeast in warm water. Let stand until creamy, about 10 minutes. Place milk, 1/2 cup sugar, salt and 1/2 cup butter in saucepan. Heat until sugar dissolves and butter melts. Cool to lukewarm. Add dissolved yeast and set aside.. In large bowl combine flour, eggs and yeast mixture. Stir until smooth and blended. Pour into a buttered 9x13 inch pan, spreading dough evenly. Let rise in warm place for 45 minutes. Meanwhile, preheat oven to 375 degrees F (190 degrees C).. In a small bowl, combine 1/2 cup butter, 1 cup sugar and 1/2 teaspoon cinnamon. mix together and sprinkle over the dough. Bake in preheated oven for 30 minutes, or until the top is golden and syrupy.","calories: 207, fat: 9g, carbs: 29g, protein: 4g, servings: 24",https://www.allrecipes.com/thmb/2IiaYLNuNQ-56P0M95EeV0XWm54=/1500x0/filters:no_upscale():max_bytes(150000):strip_icc()/17402butterkuchenKim4x3-00d514413b6b4b6f8d7c393f87d1a592.jpg
Irish Coffee Cake,https://www.allrecipes.com/recipe/278835/irish-coffee-cake/,"{'quantity': '2 ¼', 'unit': 'cups', 'name': 'all-purpose flour'}, {'quantity': '1 ½', 'unit': 'cups', 'name': 'white sugar'}, {'quantity': '2 ¼', 'unit': 'teaspoons', 'name': 'baking powder'}, {'quantity': '½', 'unit': 'teaspoon', 'name': 'salt'}, {'quantity': '3', 'unit': '(1 ounce) squares', 'name': 'unsweetened chocolate'}, {'quantity': '3', 'unit': '', 'name': 'eggs'}, {'quantity': '1 ⅔', 'unit': 'cups', 'name': 'whipping cream, chilled'}, {'quantity': '2', 'unit': 'teaspoons', 'name': 'vanilla extract'}, {'quantity': '½', 'unit': 'cup', 'name': 'Irish whiskey'}, {'quantity': '3', 'unit': 'tablespoons', 'name': 'instant coffee granules'}, {'quantity': '2', 'unit': 'tablespoons', 'name': 'white sugar'}, {'quantity': '2', 'unit': 'tablespoons', 'name': 'Irish whiskey'}, {'quantity': '1', 'unit': 'tablespoon', 'name': 'instant coffee granules'}, {'quantity': '⅔', 'unit': 'cup', 'name': 'butter, softened'}, {'quantity': '2', 'unit': 'teaspoons', 'name': 'vanilla extract'}, {'quantity': '2 ⅔', 'unit': 'cups', 'name': 'powdered sugar'}, {'quantity': '1', 'unit': '(6 ounce) package', 'name': 'semisweet chocolate chips'}","Preheat the oven to 350 degrees F (175 degrees C). Grease and flour two 8-inch round cake pans. Place waxed paper over a large wire cooling rack. Place a 3-quart mixing bowl in the freezer.. Mix flour, 1 1/2 cups sugar, baking powder, and salt together in a bowl.. Place unsweetened chocolate in the top of a double boiler over simmering water. Stir frequently, scraping down the sides with a rubber spatula to avoid scorching, until chocolate is melted, about 5 minutes. Set aside to cool.. Beat eggs in a bowl until thick and lemon-colored, about 5 minutes.. Remove cold bowl from the freezer and pour in chilled whipping cream; beat until stiff. Fold in eggs, melted chocolate, and vanilla extract. Add flour mixture, about 1/2 cup at a time, folding gently after each addition, until blended. Pour into the prepared cake pans.. Bake in the preheated oven until a toothpick inserted into the center comes out clean, 35 to 40 minutes. Cool in the pans for 10 minutes. Run a table knife around the edges to loosen. Invert layers carefully onto the prepared cooling rack and let cool completely, about 30 minutes. Poke holes in the top of the cakes with a skewer or long-tined fork.. Stir whiskey, coffee granules, and 2 tablespoons sugar together in a small bowl until coffee is dissolved. Pour 1/2 of the coffee-whiskey mixture over each layer. Let stand at room temperature for 30 minutes.. Meanwhile, combine whiskey and coffee granules for the frosting in a large bowl; stir until coffee is dissolved. Add butter and vanilla extract and beat until combined. Gradually mix in powdered sugar on medium speed until smooth. Transfer 1/2 cup of frosting to a pastry bag fitted with an open star tip (#32 or #4B); set aside. Use the remaining frosting to fill layers and frost sides and top of cake.. Place chocolate chips in the top of a double boiler over simmering water. Stir frequently, scraping down the sides with a rubber spatula to avoid scorching, until chocolate is melted, about 5 minutes. Allow to cool slightly, then transfer to a small pastry bag fitted with a medium-sized writing tip.. Pipe chocolate in a lattice design across the top of the cake. Pipe a shell border or rosettes around the top edge.","calories: 657, fat: 32g, carbs: 85g, protein: 6g, servings: 12",https://www.allrecipes.com/thmb/i1pTL2AkJLprcsROXUKTmYsWGpw=/1500x0/filters:no_upscale():max_bytes(150000):strip_icc()/7809239-ae9195aaa94d4a95bbbe824334f72210.jpg
Moist Peach Coffee Cake,https://www.allrecipes.com/recipe/87959/peach-coffee-cake-ii/,"{'quantity': '1', 'unit': 'cup', 'name': 'white sugar'}, {'quantity': '½', 'unit': 'cup', 'name': 'unsalted butter, softened'}, {'quantity': '1', 'unit': 'cup', 'name': 'sour cream'}, {'quantity': '2', 'unit': '', 'name': 'eggs, lightly beaten'}, {'quantity': '1', 'unit': 'teaspoon', 'name': 'vanilla extract'}, {'quantity': '2', 'unit': 'cups', 'name': 'all-purpose flour'}, {'quantity': '1 ½', 'unit': 'teaspoons', 'name': 'baking powder'}, {'quantity': '½', 'unit': 'teaspoon', 'name': 'baking soda'}, {'quantity': '½', 'unit': 'teaspoon', 'name': 'salt'}, {'quantity': '4', 'unit': 'cups', 'name': 'peeled, pitted, and sliced peaches'}, {'quantity': '1/4', 'unit': 'cup', 'name': 'flour'}, {'quantity': '1/4', 'unit': 'cup', 'name': 'sugar'}, {'quantity': '1/4', 'unit': 'cup', 'name': 'chopped pecans'}, {'quantity': '1', 'unit': 'teaspoon', 'name': 'ground cinnamon'}, {'quantity': '3', 'unit': 'tablespoons', 'name': 'unsalted butter'}","Preheat the oven to 325 degrees F (165 degrees C). Grease and flour a 9x13-inch baking pan.. Make the coffee cake: Cream sugar and butter in a large bowl with an electric mixer. Beat in sour cream, eggs, and vanilla. Mix in flour, baking powder, baking soda, and salt until combined. Spread 1/2 of the batter into the prepared baking pan. Layer with peaches, then top with remaining batter.. Make the topping: Mix flour, sugar, pecans, and cinnamon together in a small bowl. Cut in cold butter with two knives or a pastry blender until mixture resembles coarse crumbs. Sprinkle evenly over batter.. Bake in the preheated oven until a knife inserted in the center comes out clean, about 45 minutes.","calories: 215, fat: 8g, carbs: 34g, protein: 3g, servings: 16",https://www.allrecipes.com/thmb/SPwkPryeC3CbuE1oq2yQdwgIMrg=/1500x0/filters:no_upscale():max_bytes(150000):strip_icc()/4546579-97bf3a5c23e84b7d9186f7365cf975ae.jpg
Cranberry Swirl Coffee Cake,https://www.allrecipes.com/recipe/13548/cranberry-swirl-coffee-cake/,"{'quantity': '½', 'unit': 'cup', 'name': 'butter'}, {'quantity': '1', 'unit': 'cup', 'name': 'white sugar'}, {'quantity': '2', 'unit': '', 'name': 'eggs'}, {'quantity': '1', 'unit': 'teaspoon', 'name': 'almond extract'}, {'quantity': '2', 'unit': 'cups', 'name': 'all-purpose flour'}, {'quantity': '1', 'unit': 'teaspoon', 'name': 'baking powder'}, {'quantity': '1', 'unit': 'teaspoon', 'name': 'baking soda'}, {'quantity': '½', 'unit': 'teaspoon', 'name': 'salt'}, {'quantity': '1', 'unit': 'cup', 'name': 'sour cream'}, {'quantity': '1', 'unit': '(8 ounce) can', 'name': 'whole cranberry sauce'}","Preheat the oven to 350 degrees F (175 degrees C). Grease and flour a 10-inch tube pan.. In a large bowl, cream butter and sugar together until light and fluffy. Beat in eggs, one at a time, then stir in almond extract. Combine flour, baking powder, baking soda, and salt; stir into the creamed mixture alternately with sour cream.. Pour 1/3 of the batter into the prepared tube pan. Swirl 1/2 of the cranberry sauce into batter. Repeat, ending with batter on top.. Bake in the preheated oven until golden brown, about 55 minutes.","calories: 248, fat: 11g, carbs: 35g, protein: 3g, servings: 14",https://cdn.jwplayer.com/v2/media/aUYYyUM8/poster.jpg?width=720
