name,link,ingredients,steps,nutrition,image_url
Bisquick Coffee Cake,https://www.allrecipes.com/recipe/274198/bisquick-coffee-cake/,"{'quantity': '2', 'unit': 'cups', 'name': 'baking mix (such as Bisquick®)'}, {'quantity': '⅔', 'unit': 'cup', 'name': 'milk'}, {'quantity': '1', 'unit': 'large', 'name': 'egg'}, {'quantity': '2', 'unit': 'tablespoons', 'name': 'white sugar'}, {'quantity': '¼', 'unit': 'teaspoon', 'name': 'ground cinnamon'}, {'quantity': '⅔', 'unit': 'cup', 'name': 'baking mix (such as Bisquick®)'}, {'quantity': '⅔', 'unit': 'cup', 'name': 'brown sugar'}, {'quantity': '4', 'unit': 'tablespoons', 'name': 'unsalted butter, cut into pieces'}, {'quantity': '½', 'unit': 'teaspoon', 'name': 'ground cinnamon'}","Preheat the oven to 400 degrees F (200 degrees C). Grease a 9-inch square baking dish.. Make the cake: Mix baking mix, milk, egg, sugar, and cinnamon together in a bowl until well combined; spread into the bottom of the prepared baking dish.. Make the topping: Mix baking mix, brown sugar, butter, and cinnamon together in a separate bowl using a fork or pastry blender until crumbly. Sprinkle evenly over batter, then drag a butter knife across the top in a crisscross pattern.. Bake in the preheated oven until a toothpick inserted into the center comes out clean, about 25 minutes.","calories: 259, fat: 11g, carbs: 36g, protein: 4g, servings: 9",https://www.allrecipes.com/thmb/AfZclSxmEYrGi9xXJMKeyKUePoM=/1500x0/filters:no_upscale():max_bytes(150000):strip_icc()/8919797-3df696a08abd478686c378b9cdfea75d.jpg
Vasilopita - Greek New Years Cake,https://www.allrecipes.com/recipe/15723/vaselopita-greek-new-years-cake/,"{'quantity': '2', 'unit': 'cups', 'name': 'white sugar'}, {'quantity': '1', 'unit': 'cup', 'name': 'butter'}, {'quantity': '3', 'unit': 'cups', 'name': 'all-purpose flour'}, {'quantity': '6', 'unit': 'large', 'name': 'eggs'}, {'quantity': '2', 'unit': 'teaspoons', 'name': 'baking powder'}, {'quantity': '1', 'unit': 'cup', 'name': 'warm milk (110 degrees F/45 degrees C)'}, {'quantity': '½', 'unit': 'teaspoon', 'name': 'baking soda'}, {'quantity': '1', 'unit': 'tablespoon', 'name': 'fresh lemon juice'}, {'quantity': '¼', 'unit': 'cup', 'name': 'blanched slivered almonds'}, {'quantity': '2', 'unit': 'tablespoons', 'name': 'white sugar'}","Preheat the oven to 350 degrees F (175 degrees C). Generously grease a 10-inch round cake pan.. Beat sugar and butter together in a medium bowl until lighter in color; stir in flour and mix until the mixture is mealy. Add eggs one at a time, mixing well after each addition. Combine baking powder and milk; add to egg mixture, mix well. Combine lemon juice and baking soda; stir into the batter. Pour into the prepared cake pan.. Bake in the preheated oven for 20 minutes. Remove and sprinkle the nuts and sugar over the cake, then return it to the oven until cake springs back to the touch, about 20 to 30 additional minutes. Gently cut a small hole in the cake and place a quarter in the hole. Try to cover the hole with sugar. Cool cake on a rack for 10 minutes before inverting onto a plate.. Serve cake warm.","calories: 447, fat: 20g, carbs: 61g, protein: 8g, servings: 12",https://www.allrecipes.com/thmb/Qrxsywke9U-q79q50F0l_hVDvvQ=/1500x0/filters:no_upscale():max_bytes(150000):strip_icc()/6205979-a33320ecd86d451ab2e61ad1574ac771.jpg
Oatmeal Cake,https://www.allrecipes.com/recipe/8147/oatmeal-cake-ii/,"{'quantity': '1 ¼', 'unit': 'cups', 'name': 'boiling water'}, {'quantity': '1', 'unit': 'cup', 'name': 'quick-cooking oats'}, {'quantity': '½', 'unit': 'cup', 'name': 'butter'}, {'quantity': '¾', 'unit': 'cup', 'name': 'packed brown sugar'}, {'quantity': '¾', 'unit': 'cup', 'name': 'white sugar'}, {'quantity': '2', 'unit': 'large', 'name': 'eggs'}, {'quantity': '1', 'unit': 'teaspoon', 'name': 'vanilla extract'}, {'quantity': '1', 'unit': 'teaspoon', 'name': 'baking soda'}, {'quantity': '½', 'unit': 'teaspoon', 'name': 'salt'}, {'quantity': '1', 'unit': 'teaspoon', 'name': 'ground cinnamon'}, {'quantity': '1 ½', 'unit': 'cups', 'name': 'all-purpose flour'}, {'quantity': '½', 'unit': 'cup', 'name': 'raisins'}","Pour the boiling water over the quick oats and let stand for 20 minutes.. Preheat the oven to 350 degrees F (175 degrees C). Lightly grease a 9x13-inch baking pan.. Beat sugar and butter together in a large bowl with an electric mixer until creamy. Beat in eggs, then mix in oats and vanilla.. Combine baking soda, salt , cinnamon and flour. Mix until combined. Add the raisins to flour mixture and coat well.. Add raisin and flour mixture to the oatmeal mixture and stir to combine. Pour batter into the prepared pan.. Bake in the preheated oven until a toothpick inserted in the center comes out clean, about 35 minutes.","calories: 141, fat: 5g, carbs: 24g, protein: 2g, servings: 24",https://www.allrecipes.com/thmb/TLnQS9XmwvLwAojQNeZbwSN4D-Q=/1500x0/filters:no_upscale():max_bytes(150000):strip_icc()/93580-6d1a64510f9e4d2abb0d67e001c4c83e.jpg
Old Fashioned Coffee Cake with Cinnamon-Streusel Topping,https://www.allrecipes.com/recipe/8309457/old-fashioned-coffee-cake-with-cinnamon-streusel-topping/,"{'quantity': '¾', 'unit': 'cup', 'name': 'brown sugar'}, {'quantity': '⅓', 'unit': 'cup', 'name': 'all-purpose flour'}, {'quantity': '1 ½', 'unit': 'teaspoons', 'name': 'ground cinnamon'}, {'quantity': '1', 'unit': 'cup', 'name': 'brown sugar'}, {'quantity': '1', 'unit': 'cup', 'name': 'all-purpose flour'}, {'quantity': '2', 'unit': 'teaspoons', 'name': 'ground cinnamon'}, {'quantity': '¼', 'unit': 'teaspoon', 'name': 'kosher salt'}, {'quantity': '½', 'unit': 'cup', 'name': 'unsalted butter, softened'}, {'quantity': '3 ½', 'unit': 'cups', 'name': 'all-purpose flour'}, {'quantity': '1', 'unit': 'tablespoon', 'name': 'baking powder'}, {'quantity': '¼', 'unit': 'teaspoon', 'name': 'kosher salt'}, {'quantity': '1 ½', 'unit': 'cups', 'name': 'white sugar'}, {'quantity': '1', 'unit': 'cup', 'name': 'unsalted butter, softened'}, {'quantity': '3', 'unit': 'large', 'name': 'eggs'}, {'quantity': '¾', 'unit': 'cup', 'name': 'milk'}, {'quantity': '1', 'unit': '(8 ounce) container', 'name': 'sour cream'}, {'quantity': '2', 'unit': 'teaspoons', 'name': 'vanilla extract'}","Preheat the oven to 350 degrees F (175 degrees C). Lightly grease a 9x13-inch baking dish; set aside.. Prepare cinnamon layer by stirring brown sugar, flour, and cinnamon together in a small bowl until well combined; set aside.. Prepare streusel topping by combining brown sugar, flour, cinnamon, and salt in a small bowl. Add butter and stir with a fork until mixture is crumbly; set aside.. Prepare cake by whisking together flour, baking powder, and salt in a medium bowl.. Beat sugar and butter in a stand mixer fitted with the paddle attachment on medium speed until fluffy, about 3 minutes. Scrape the sides of the bowl, then turn the mixer on low speed and beat in eggs until well blended. Gradually mix in flour mixture and milk. Add sour cream and vanilla and beat for 30 seconds.. Pour 1/2 of the batter into the prepared baking dish. Sprinkle the cinnamon layer over the batter, then pour the remaining batter over top. Spread streusel topping evenly over the cake, pressing very lightly so it adheres to the batter.. Bake in the preheated oven until a toothpick inserted in the center comes out clean, 40 to 50 minutes. Remove from the oven and let cool completely before serving, about 30 minutes.","calories: 675, fat: 28g, carbs: 98g, protein: 8g, servings: 12",https://cdn.jwplayer.com/v2/media/QeXttyZn/poster.jpg?width=720
Quick Coffee Cake,https://www.allrecipes.com/recipe/19093/quick-coffee-cake/,"{'quantity': '1 ½', 'unit': 'cups', 'name': 'all-purpose flour'}, {'quantity': '1 ½', 'unit': 'teaspoons', 'name': 'baking powder'}, {'quantity': '6', 'unit': 'tablespoons', 'name': 'white sugar'}, {'quantity': '½', 'unit': 'teaspoon', 'name': 'salt'}, {'quantity': '⅓', 'unit': 'cup', 'name': 'shortening'}, {'quantity': '½', 'unit': 'cup', 'name': 'milk'}, {'quantity': '1', 'unit': '', 'name': 'egg'}, {'quantity': '½', 'unit': 'teaspoon', 'name': 'vanilla extract'}, {'quantity': '2', 'unit': 'tablespoons', 'name': 'butter, melted'}, {'quantity': '½', 'unit': 'cup', 'name': 'brown sugar'}, {'quantity': '2', 'unit': 'tablespoons', 'name': 'all-purpose flour'}, {'quantity': '½', 'unit': 'teaspoon', 'name': 'ground cinnamon'}","Preheat oven to 425 degrees F (220 degrees C). Grease and flour a 9 inch square pan.. In a large bowl mix together the flour, baking powder, sugar and salt. Cut in the shortening with a pastry blender to the size of small peas.. In a separate small bowl, beat the egg well, then stir in the milk and vanilla. Add the egg-milk mixture to the flour mixture all at once. Stir carefully until just blended.. Pour batter into prepared pan and spread evenly. Drizzle top with melted butter.. In a small bowl mix together brown sugar, 2 tablespoons flour and 1/2 teaspoon cinnamon. Sprinkle on top of cake. Bake in the preheated oven for 15 to 20 minutes, or until a toothpick inserted into the center of the cake comes out clean.","calories: 268, fat: 11g, carbs: 39g, protein: 4g, servings: 9",https://www.allrecipes.com/thmb/-5reKbmY9g5JTMWH-ub7E6KLvAQ=/1500x0/filters:no_upscale():max_bytes(150000):strip_icc()/37716-291a56c3c07b4bd9886ecb679716303c.jpg
Banana Oatmeal Crumb Cake,https://www.allrecipes.com/recipe/7899/banana-oatmeal-crumb-cake/,"{'quantity': '½', 'unit': 'cup', 'name': 'butter, softened'}, {'quantity': '⅔', 'unit': 'cup', 'name': 'packed brown sugar'}, {'quantity': '2', 'unit': '', 'name': 'eggs'}, {'quantity': '1', 'unit': 'cup', 'name': 'mashed bananas'}, {'quantity': '1', 'unit': 'teaspoon', 'name': 'vanilla extract'}, {'quantity': '¾', 'unit': 'cup', 'name': 'all-purpose flour'}, {'quantity': '1 ⅓', 'unit': 'cups', 'name': 'rolled oats'}, {'quantity': '¼', 'unit': 'teaspoon', 'name': 'salt'}, {'quantity': '1', 'unit': 'teaspoon', 'name': 'baking soda'}, {'quantity': '¾', 'unit': 'cup', 'name': 'rolled oats'}, {'quantity': '⅓', 'unit': 'cup', 'name': 'packed brown sugar'}, {'quantity': '2', 'unit': 'tablespoons', 'name': 'butter, melted'}, {'quantity': '2', 'unit': 'tablespoons', 'name': 'chopped walnuts'}, {'quantity': '½', 'unit': 'teaspoon', 'name': 'ground cinnamon'}","Stir together flour, 1 1/3 cups oats, salt, and baking soda.. In a large bowl, cream 1/2 cup butter or margarine with 2/3 cup brown sugar. Beat in the eggs, then the bananas and vanilla. Beat the flour mixture into the banana mixture. Turn the batter into a greased and floured 8 inch square pan.. Mix 3/4 cup oats, 1/3 cup brown sugar, melted butter or margarine, walnuts, and cinnamon together until crumbly. Sprinkle evenly over the top of the batter.. Bake in preheated oven at 350 degrees F (175 degrees C) for 40 to 45 minutes, or until it tests done. Transfer to a rack to cool.","calories: 274, fat: 12g, carbs: 38g, protein: 4g, servings: 12",https://www.allrecipes.com/thmb/spVaINbfR7ttLL42FPqned5zCL8=/1500x0/filters:no_upscale():max_bytes(150000):strip_icc()/260008-2acbc8b4fce147b49569243995540793.jpg
Old Fashioned Prune Cake,https://www.allrecipes.com/recipe/8323/old-fashioned-prune-cake/,"{'quantity': '1', 'unit': 'cup', 'name': 'vegetable oil'}, {'quantity': '3', 'unit': '', 'name': 'eggs'}, {'quantity': '1 ½', 'unit': 'cups', 'name': 'white sugar'}, {'quantity': '2', 'unit': 'cups', 'name': 'all-purpose flour'}, {'quantity': '1', 'unit': 'teaspoon', 'name': 'baking soda'}, {'quantity': '1', 'unit': 'teaspoon', 'name': 'salt'}, {'quantity': '1', 'unit': 'teaspoon', 'name': 'ground allspice'}, {'quantity': '1', 'unit': 'teaspoon', 'name': 'ground cinnamon'}, {'quantity': '1', 'unit': 'teaspoon', 'name': 'ground nutmeg'}, {'quantity': '1', 'unit': 'cup', 'name': 'buttermilk'}, {'quantity': '1 ¼', 'unit': 'teaspoons', 'name': 'vanilla extract'}, {'quantity': '1', 'unit': 'cup', 'name': 'prunes, pitted and chopped'}, {'quantity': '1 ½', 'unit': 'cups', 'name': 'chopped pecans'}, {'quantity': '¾', 'unit': 'cup', 'name': 'butter'}, {'quantity': '¾', 'unit': 'cup', 'name': 'buttermilk'}, {'quantity': '1 ½', 'unit': 'teaspoons', 'name': 'dark corn syrup'}, {'quantity': '1 ½', 'unit': 'cups', 'name': 'white sugar'}, {'quantity': '2', 'unit': 'teaspoons', 'name': 'vanilla extract'}","Preheat oven to 350 degrees F (175 degrees C). Grease and flour Bundt or tube pan.. In a medium bowl, mix together flour, soda, salt, allspice, cinnamon and nutmeg. Set aside.. In a large bowl, combine oil, eggs and 1 1/2 cup sugar. Beat 2 minutes at medium speed.. Add flour mixture, alternating with 1 cup buttermilk, starting and ending with dry ingredients. beat well after each addition. Stir in prunes, pecans and 1 1/4 teaspoon vanilla.. Pour into greased and floured bundt or tube pan and bake at 350 degrees F (175 degrees C) for 1 hour or until a toothpick comes out clean when inserted in the center.. Make large, deep holes in hot cake and pour topping in holes and on top of cake a little at a time, giving it time to soak in.. For the topping: In saucepan, over medium heat, cook butter, 3/4 cup buttermilk, corn syrup and 1 1/2 cup sugar until sugar and butter melt. Remove from heat and add 2 teaspoons vanilla and stir.","calories: 702, fat: 42g, carbs: 80g, protein: 7g, servings: 12",https://www.allrecipes.com/thmb/7YWuvIQxzcUL2ke8UOafTrR5jHI=/1500x0/filters:no_upscale():max_bytes(150000):strip_icc()/702919-87265fcb01244b989896dece584ed50b.jpg
Polish Cream Cheese Coffee Cake,https://www.allrecipes.com/recipe/229630/polish-cream-cheese-coffee-cake/,"{'quantity': '1', 'unit': 'cup', 'name': 'white sugar'}, {'quantity': '½', 'unit': 'cup unsalted', 'name': 'butter'}, {'quantity': '1', 'unit': '', 'name': 'egg'}, {'quantity': '1', 'unit': 'cup', 'name': 'sour cream'}, {'quantity': '1', 'unit': 'teaspoon', 'name': 'vanilla extract'}, {'quantity': '3', 'unit': 'cups', 'name': 'all-purpose flour'}, {'quantity': '1', 'unit': 'teaspoon', 'name': 'baking soda'}, {'quantity': '1', 'unit': 'teaspoon', 'name': 'baking powder'}, {'quantity': '2', 'unit': '(8 ounce) packages', 'name': 'cream cheese, softened'}, {'quantity': '½', 'unit': 'cup', 'name': 'white sugar'}, {'quantity': '1', 'unit': '', 'name': 'egg'}, {'quantity': '½', 'unit': 'cup', 'name': 'chopped pecans'}, {'quantity': '½', 'unit': 'cup', 'name': 'brown sugar'}, {'quantity': '⅓', 'unit': 'cup', 'name': 'all-purpose flour'}, {'quantity': '⅓', 'unit': 'cup unsalted', 'name': 'butter'}","Preheat the oven to 350 degrees F (175 degrees C). Grease a 9x13-inch baking dish.. Beat 1 cup white sugar, 1/2 cup butter, and 1 egg in a bowl until smooth. Add sour cream and vanilla extract; mix well. Stir in 3 cups flour, baking soda, and baking powder until a sticky dough forms. Spread 1/2 dough evenly into prepared baking dish.. Beat cream cheese, 1/2 cup white sugar, and 1 egg in a separate bowl until smooth; spoon over dough in baking dish. Drop spoonfuls remaining 1/2 dough over filling.. Combine pecans, brown sugar, 1/3 cup flour, and 1/3 cup butter in a bowl until resembles coarse crumble; sprinkle over dough.. Bake in the preheated oven until a toothpick inserted into the center comes out clean, about 45 minutes.","calories: 575, fat: 34g, carbs: 60g, protein: 9g, servings: 12",https://cdn.jwplayer.com/v2/media/2cFkCQUE/poster.jpg?width=720
Fresh Fig Cake,https://www.allrecipes.com/recipe/8290/fresh-fig-cake/,"{'quantity': '2', 'unit': 'cups', 'name': 'all-purpose flour'}, {'quantity': '2', 'unit': 'teaspoons', 'name': 'baking powder'}, {'quantity': '½', 'unit': 'teaspoon', 'name': 'salt'}, {'quantity': '1', 'unit': 'cup', 'name': 'white sugar'}, {'quantity': '¼', 'unit': 'cup', 'name': 'butter, softened'}, {'quantity': '1', 'unit': 'large', 'name': 'egg'}, {'quantity': '1', 'unit': 'cup', 'name': 'fat-free evaporated milk'}, {'quantity': '1', 'unit': 'teaspoon', 'name': 'vanilla extract'}, {'quantity': '¼', 'unit': 'teaspoon', 'name': 'almond extract'}, {'quantity': '1', 'unit': 'cup', 'name': 'chopped fresh figs'}, {'quantity': '2', 'unit': 'cups', 'name': 'chopped fresh figs'}, {'quantity': '¼', 'unit': 'cup', 'name': 'packed brown sugar'}, {'quantity': '¼', 'unit': 'cup', 'name': 'water'}, {'quantity': '1', 'unit': 'tablespoon', 'name': 'lemon juice'}","Preheat the oven to 350 degrees F (175 degrees C). Spray two 8-inch round cake pans with cooking spray.. To make the fig cake: Sift flour, salt, and baking powder together in a medium bowl; set aside.. Beat sugar and butter together in a large mixing bowl with an electric beater until fluffy. Add egg and beat well. Add flour mixture alternately with evaporated milk. Fold in vanilla, almond extract, and 1 cup chopped figs.. Spoon cake batter evenly into the prepared cake pans. Bake in the preheated oven until a toothpick inserted into the center comes out clean, 25 to 30 minutes. Cool cake layers on a wire rack.. To make the fig filling: Combine 2 cups chopped figs, brown sugar, water, and lemon juice in a saucepan. Bring to a boil. Reduce heat to a simmer and cook until thickened, about 20 minutes. Spread thinly between cooled cake layers and on top.","calories: 370, fat: 7g, carbs: 72g, protein: 7g, servings: 8",https://www.allrecipes.com/thmb/82HcR-Y0nYEyntv02Y5auGkl25s=/1500x0/filters:no_upscale():max_bytes(150000):strip_icc()/8461892-fresh-fig-cake-bvwinemaker-4x3-1-c00012b00c024daaa958610e0c393036.jpg
Simple Buttermilk Coffee Cake,https://www.allrecipes.com/recipe/232143/simple-buttermilk-coffee-cake/,"{'quantity': '2 ¼', 'unit': 'cups', 'name': 'all-purpose flour'}, {'quantity': '1 ½', 'unit': 'cups', 'name': 'white sugar'}, {'quantity': '1 ½', 'unit': 'teaspoons', 'name': 'baking powder'}, {'quantity': '¾', 'unit': 'teaspoon', 'name': 'baking soda'}, {'quantity': '½', 'unit': 'cup', 'name': 'butter, room temperature'}, {'quantity': '1', 'unit': 'cup', 'name': 'buttermilk'}, {'quantity': '2', 'unit': '', 'name': 'eggs'}, {'quantity': '½', 'unit': 'teaspoon', 'name': 'vanilla extract'}","Preheat oven to 350 degrees F (175 degrees C). Grease and flour a 9x13-inch baking dish.. Combine flour, sugar, baking powder, and baking soda in a large bowl. Cut butter into flour mixture until mixture resembles coarse crumbs. Reserve about 1 cup butter crumbs.. Stir buttermilk, eggs, and vanilla extract into remaining crumbs until batter is just combined; pour batter into prepared baking dish. Sprinkle reserved butter crumbs over batter.. Bake in the preheated oven until a toothpick inserted into the center comes out clean, about 35 minutes.","calories: 203, fat: 7g, carbs: 33g, protein: 3g, servings: 16",https://www.allrecipes.com/thmb/uVq7dYjvMN5v9NspVV7o3923IDs=/1500x0/filters:no_upscale():max_bytes(150000):strip_icc()/4018654-simple-buttermilk-coffee-cake-magicallydelicious-4x3-1-015620116ea7475a84aa77effb31810b.jpg
Sugar Free Blueberry Coffee Cake,https://www.allrecipes.com/recipe/74837/sugar-free-blueberry-coffee-cake/,"{'quantity': '1 ½', 'unit': 'cups', 'name': 'granular sucralose sweetener (such as Splenda)'}, {'quantity': '1', 'unit': 'cup', 'name': 'milk'}, {'quantity': '¾', 'unit': 'cup unsalted', 'name': 'butter, melted and cooled'}, {'quantity': '3', 'unit': '', 'name': 'eggs'}, {'quantity': '1', 'unit': 'teaspoon', 'name': 'vanilla extract'}, {'quantity': '3 3/4', 'unit': 'cups', 'name': 'all-purpose flour, divided'}, {'quantity': '2', 'unit': 'teaspoons', 'name': 'baking powder'}, {'quantity': '1 ¾', 'unit': 'cups', 'name': 'fresh or frozen blueberries'}, {'quantity': '1 ½', 'unit': 'cups', 'name': 'malitol brown sugar substitute'}, {'quantity': '2', 'unit': 'teaspoons', 'name': 'ground cinnamon'}, {'quantity': '½', 'unit': 'cup unsalted', 'name': 'butter, softened'}","Preheat the oven to 350 degrees F (175 degrees C). Grease and flour a 9x13-inch baking pan.. Whisk 1 1/2 cups sucralose sweetener, milk, 3/4 cup melted butter, eggs, and vanilla together in a large bowl. Whisk 3 cups flour and baking powder together; stir into milk mixture until just blended. Fold in blueberries. Spread evenly in the prepared pan.. Combine malitol sweetener, remaining 3/4 cup flour, and cinnamon in a small bowl; stir in 1/2 cup softened butter with a fork until mixture is crumbly. Sprinkle over top of cake.. Bake in the preheated oven until a toothpick inserted into the center comes out clean, 35 to 40 minutes. This cake is best served warm.","calories: 363, fat: 21g, carbs: 37g, protein: 7g, servings: 12",https://www.allrecipes.com/thmb/kuMtp8HnpdU-Epp8H8bT7DiHc2w=/1500x0/filters:no_upscale():max_bytes(150000):strip_icc()/330876-58be47b46b5f4a7dab3de523cbf0e9d8.jpg
Easy Raisin Cake,https://www.allrecipes.com/recipe/7342/easy-raisin-cake/,"{'quantity': '1', 'unit': 'cup', 'name': 'raisins'}, {'quantity': '2', 'unit': 'cups', 'name': 'water'}, {'quantity': '½', 'unit': 'cup', 'name': 'butter'}, {'quantity': '1', 'unit': 'teaspoon', 'name': 'baking soda'}, {'quantity': '½', 'unit': 'teaspoon', 'name': 'salt'}, {'quantity': '1', 'unit': 'cup', 'name': 'white sugar'}, {'quantity': '½', 'unit': 'teaspoon', 'name': 'ground cinnamon'}, {'quantity': '½', 'unit': 'teaspoon', 'name': 'ground nutmeg'}, {'quantity': '1', 'unit': 'cup', 'name': 'chopped walnuts'}, {'quantity': '1 ¾', 'unit': 'cups', 'name': 'all-purpose flour'}","Preheat oven to 350 degrees F (175 degrees C). Lightly grease one 10 x 10 inch baking pan.. In a large saucepan boil the raising with the water for 10 minutes. Add the butter or margarine and let cool.. In the same pan add the flour, soda, salt, sugar, cinnamon, nutmeg, and chopped nuts (optional), mix well and pour batter into a lightly greased 10x10 inch baking pan. Bake at 350 degrees F (175 degrees C) for 35 minutes. Serves 8 to 12.","calories: 150, fat: 7g, carbs: 21g, protein: 2g, servings: 24",https://www.allrecipes.com/thmb/mAIVqxYryMP6Kq9z016S7uoyQ1g=/1500x0/filters:no_upscale():max_bytes(150000):strip_icc()/1322220-60d565ba9e8e4e9292ebe47c36da96dd.jpg
Dried Cherry Cake,https://www.allrecipes.com/recipe/7436/dried-cherry-cake/,"{'quantity': '½', 'unit': 'cup', 'name': 'chopped dried cherries'}, {'quantity': '½', 'unit': 'cup', 'name': 'hot water'}, {'quantity': '½', 'unit': 'teaspoon', 'name': 'almond extract'}, {'quantity': '1 ½', 'unit': 'cups', 'name': 'all-purpose flour'}, {'quantity': '2', 'unit': 'teaspoons', 'name': 'baking powder'}, {'quantity': '¼', 'unit': 'teaspoon', 'name': 'salt'}, {'quantity': '1', 'unit': 'cup', 'name': 'white sugar'}, {'quantity': '1', 'unit': '(8 ounce) container', 'name': 'vanilla yogurt'}, {'quantity': '½', 'unit': 'cup', 'name': 'vegetable oil'}, {'quantity': '1', 'unit': '', 'name': 'egg'}, {'quantity': '1', 'unit': '', 'name': 'egg white'}, {'quantity': '¼', 'unit': 'cup', 'name': 'chopped pecans'}, {'quantity': '1', 'unit': 'tablespoon', 'name': 'white sugar'}","Combine cherries, hot water, and almond extract: let stand 20 minutes. Drain cherries, and pat dry between layers of paper towels. Set aside.. In a large bowl, combine flour, salt, baking powder, and 1 cup white sugar. Add yogurt, eggs, and oil. Stir well. Fold in cherries. Pour batter into a greased and floured 9 inch round cake pan.. Stir pecans and 1 tablespoon white sugar together. Sprinkle on top of batter in pan.. Bake at 350 degrees F (175 degrees C) for 35 minutes, or until wooden pick comes out clean. Cool in pan on wire rack 10 minutes. Serve warm, or at room temperature.","calories: 266, fat: 12g, carbs: 37g, protein: 4g, servings: 12",https://www.allrecipes.com/thmb/v_szeK_9xLr5DMnnaww8uyA-N2k=/1500x0/filters:no_upscale():max_bytes(150000):strip_icc()/8336683-210c50736bc64b7e8b179c7518768740.jpg
Jewish Coffee Cake,https://www.allrecipes.com/recipe/15029/jewish-coffee-cake/,"{'quantity': '½', 'unit': 'cup', 'name': 'butter'}, {'quantity': '1', 'unit': 'cup', 'name': 'white sugar'}, {'quantity': '2', 'unit': '', 'name': 'eggs'}, {'quantity': '2', 'unit': 'cups', 'name': 'all-purpose flour'}, {'quantity': '1', 'unit': 'teaspoon', 'name': 'baking soda'}, {'quantity': '1', 'unit': 'teaspoon', 'name': 'baking powder'}, {'quantity': '1', 'unit': 'cup', 'name': 'sour cream'}, {'quantity': '1', 'unit': 'teaspoon', 'name': 'vanilla extract'}, {'quantity': '1', 'unit': 'cup', 'name': 'chopped walnuts'}, {'quantity': '½', 'unit': 'cup', 'name': ""confectioners' sugar""}, {'quantity': '2', 'unit': 'teaspoons', 'name': 'ground cinnamon'}, {'quantity': '2', 'unit': 'tablespoons', 'name': 'butter, melted'}","Preheat oven to 350 degrees F (175 degrees C). Grease and flour a 9x9 inch pan. Combine the flour, baking soda and baking powder; set aside.. In a medium bowl, cream together the sugar, butter and eggs until smooth. Add the flour mixture and beat until smooth. Finally, stir in the sour cream and vanilla. In a separate bowl, combine the nuts, confectioners' sugar and cinnamon.. Spread half of the batter into the 9x9 inch pan. Sprinkle a layer of the nut mixture, then spread the remaining batter and top with the rest of the nut mixture. Spread the melted butter over the top.. Bake for 1 hour in the preheated oven, until cake springs back to the touch.","calories: 364, fat: 21g, carbs: 40g, protein: 5g, servings: 12",https://www.allrecipes.com/thmb/BP155x2O2MyQ7mzmOhk8p_cdKWQ=/1500x0/filters:no_upscale():max_bytes(150000):strip_icc()/2305-1ec38988dc184627abad1f6b7f4cc610.jpg
