name,link,ingredients,steps,nutrition
Slaw of Many Colors,https://www.allrecipes.com/slaw-of-many-colors-recipe-8707151,"{'quantity': '1', 'unit': 'medium head', 'name': 'red cabbage'}, {'quantity': '1', 'unit': 'medium', 'name': 'green bell pepper'}, {'quantity': '1', 'unit': 'medium', 'name': 'onion'}, {'quantity': '1', 'unit': 'cup', 'name': 'mayonnaise'}, {'quantity': '1/2', 'unit': 'cup', 'name': 'cider vinegar'}, {'quantity': '1/2', 'unit': 'cup', 'name': 'powdered sugar'}, {'quantity': '1', 'unit': 'teaspoon', 'name': 'salt'}, {'quantity': '1', 'unit': 'teaspoon', 'name': 'black pepper'}, {'quantity': '1', 'unit': 'large', 'name': 'tomato'}",,"calories: 261, fat: 21g, carbs: 18g, protein: 2g, servings: 8"
Cowboy Coleslaw,https://www.allrecipes.com/cowboy-coleslaw-recipe-8653154,"{'quantity': '16', 'unit': 'ounce', 'name': 'coleslaw mix'}, {'quantity': '(15-ounce)', 'unit': None, 'name': 'black beans,'}, {'quantity': '1 1/2', 'unit': 'cups', 'name': 'frozen corn'}, {'quantity': '1', 'unit': 'cup', 'name': 'red bell pepper'}, {'quantity': '1/2', 'unit': 'cup', 'name': 'fresh cilantro'}, {'quantity': '1/4', 'unit': 'cup', 'name': 'seeded and finely chopped jalapeño chile'}, {'quantity': '1/2', 'unit': 'cup', 'name': 'mayonnaise'}, {'quantity': '1/2', 'unit': 'cup', 'name': 'sour cream'}, {'quantity': '1/4', 'unit': 'cup', 'name': 'lime juice'}, {'quantity': '3', 'unit': 'tablespoons', 'name': 'adobo sauce'}, {'quantity': '1', 'unit': 'tablespoon', 'name': 'taco seasoning'}, {'quantity': '2', 'unit': 'teaspoons', 'name': 'kosher salt'}, {'quantity': '1', 'unit': 'teaspoon', 'name': 'ground cumin'}, {'quantity': '1/4', 'unit': 'cup', 'name': 'scallions'}, {'quantity': None, 'unit': None, 'name': 'lime wedges'}",,"calories: 418, fat: 28g, carbs: 38g, protein: 8g, servings: 6"
Pikliz,https://www.allrecipes.com/pikliz-recipe-8655382,"{'quantity': '2', 'unit': 'cups', 'name': 'cabbage'}, {'quantity': '1', 'unit': 'cup', 'name': 'carrot'}, {'quantity': '2', 'unit': None, 'name': 'bell peppers, thinly sliced'}, {'quantity': '1/2', 'unit': 'medium', 'name': 'red onion, sliced'}, {'quantity': '3', 'unit': None, 'name': 'scallions, thinly sliced'}, {'quantity': '1 Jamaican', 'unit': None, 'name': 'Scotch bonnet pepper'}, {'quantity': '3', 'unit': 'tablespoons', 'name': 'allspice'}, {'quantity': '4', 'unit': '', 'name': 'peppercorns'}, {'quantity': '2', 'unit': None, 'name': 'cloves'}, {'quantity': '1', 'unit': None, 'name': 'bay leaf'}, {'quantity': '1 1/2', 'unit': 'cups', 'name': 'white vinegar'}, {'quantity': '2', 'unit': 'tablespoons', 'name': 'lime juice'}","Stuff cabbage, carrot, bell peppers, onion, scallions, Scotch bonnet pepper, allspice, peppercorn, cloves, and bay leaf into a mason jar with a lid until it's filled to the brim.. Add vinegar, and lime juice and press down on the ingredients. Seal the jar and shake once.. Refrigerate for 2 days for flavors to meld.","calories: 35, fat: 0g, carbs: 7g, protein: 1g, servings: 10"
Carolina Red Slaw,https://www.allrecipes.com/carolina-red-slaw-recipe-7550726,"{'quantity': '2', 'unit': 'pounds', 'name': 'green cabbage'}, {'quantity': '2', 'unit': 'teaspoons', 'name': 'kosher salt'}, {'quantity': '3/4', 'unit': 'cup', 'name': 'ketchup'}, {'quantity': '1/2', 'unit': 'cup', 'name': 'red bell peppers'}, {'quantity': '1/4', 'unit': 'cup', 'name': 'apple cider vinegar'}, {'quantity': '3', 'unit': 'tablespoons', 'name': 'white sugar'}, {'quantity': '1', 'unit': 'teaspoon', 'name': 'smoked paprika'}, {'quantity': '1/2', 'unit': 'teaspoon', 'name': 'freshly ground black pepper'}, {'quantity': '1/8', 'unit': 'teaspoon', 'name': 'cayenne pepper'}, {'quantity': '1', 'unit': 'tablespoon', 'name': 'chili sauce, or to taste'}, {'quantity': '1', 'unit': 'tablespoon', 'name': 'riracha hot sauce, or to taste'}, {'quantity': '2', 'unit': 'tablespoons', 'name': 'green onions, or as needed (optional)'}",,"calories: 76, fat: 0g, carbs: 19g, protein: 2g, servings: 8"
Best Vinegar Coleslaw,https://www.allrecipes.com/recipe/59318/amish-slaw/,"{'quantity': '1', 'unit': 'large head', 'name': 'cabbage, cored and finely shredded'}, {'quantity': '1', 'unit': 'medium', 'name': 'onion, thinly sliced'}, {'quantity': '1', 'unit': 'cup', 'name': 'white sugar'}, {'quantity': '¾', 'unit': 'cup', 'name': 'vinegar'}, {'quantity': '⅓', 'unit': 'cup', 'name': 'vegetable oil'}, {'quantity': '2', 'unit': 'teaspoons', 'name': 'celery seed'}, {'quantity': '1 ¼', 'unit': 'teaspoon', 'name': 'salt'}, {'quantity': '1', 'unit': 'teaspoon', 'name': 'prepared mustard'}, {'quantity': '¼', 'unit': 'teaspoon', 'name': 'freshly ground black pepper'}","Gather the ingredients.. Toss cabbage and onion together in a large bowl; set aside.. Combine sugar, vinegar, oil, celery seed, salt, mustard, and pepper in a small saucepan; bring to a boil and simmer, stirring frequently, until sugar is dissolved, about 3 minutes.. Let mixture cool slightly, about 5 minutes, then pour over cabbage mixture; toss well to coat.. Serve and enjoy!","calories: 224, fat: 9g, carbs: 35g, protein: 2g, servings: 8"
Warm Grilled Red Cabbage Slaw,https://www.allrecipes.com/recipe/8524012/warm-grilled-red-cabbage-slaw/,"{'quantity': '1', 'unit': 'medium', 'name': 'white onion, thinly sliced'}, {'quantity': '2', 'unit': 'tablespoons', 'name': 'olive oil'}, {'quantity': '1', 'unit': '', 'name': 'Granny Smith apple - peeled, cored and chopped'}, {'quantity': '3', 'unit': 'tablespoons', 'name': 'maple syrup'}, {'quantity': '3', 'unit': 'tablespoons', 'name': 'apple cider vinegar'}, {'quantity': '1 ½', 'unit': 'teaspoons', 'name': 'garlic powder'}, {'quantity': '1 ½', 'unit': 'teaspoons', 'name': 'onion powder'}, {'quantity': '1', 'unit': 'head', 'name': 'red cabbage, shredded'}, {'quantity': '⅓', 'unit': 'cup', 'name': 'chopped fresh parsley'}","Heat grill to medium high heat to 375 degrees F (190 degrees C).. Pour olive oil into a grill pan and sauté onion for 2 minutes. Add chopped apples, maple syrup, apple cider vinegar, garlic powder, and onion powder to the grill pan and stir until mixed.. Reduce heat to low at 300 degrees F (150 degrees C). Add red cabbage to the grill pan and cook until cabbage is wilted and lightly tender, about 15 minutes.. Remove from heat and add parsley. Enjoy warm.","calories: 160, fat: 6g, carbs: 27g, protein: 3g, servings: 5"
Napa Cabbage Salad,https://www.allrecipes.com/recipe/18517/napa-cabbage-salad/,"{'quantity': '1', 'unit': 'head', 'name': 'napa cabbage'}, {'quantity': '1', 'unit': 'bunch', 'name': 'minced green onions'}, {'quantity': '⅓', 'unit': 'cup', 'name': 'butter'}, {'quantity': '1', 'unit': '(3 ounce) package', 'name': 'ramen noodles, broken'}, {'quantity': '1', 'unit': 'cup', 'name': 'slivered almonds'}, {'quantity': '2', 'unit': 'tablespoons', 'name': 'sesame seeds'}, {'quantity': '¾', 'unit': 'cup', 'name': 'vegetable oil'}, {'quantity': '½', 'unit': 'cup', 'name': 'white sugar'}, {'quantity': '¼', 'unit': 'cup', 'name': 'cider vinegar'}, {'quantity': '2', 'unit': 'tablespoons', 'name': 'soy sauce'}","Gather the ingredients.. Finely shred cabbage; do not chop. Combine green onions and cabbage in a large bowl. Cover and refrigerate until ready to serve.. Preheat the oven to 350 degrees F (175 degrees C). Make the crunchy topping: Melt butter in a pot. Stir ramen noodles, almonds, and sesame seeds into the pot with melted butter.. Spoon the mixture onto a baking sheet and bake the crunchies in the preheated oven, turning often to make sure they do not burn, for 5 to 7 minutes. When they are browned remove them from the oven.. Make the dressing: Heat oil, sugar, vinegar, and soy sauce together in a small saucepan. Bring the dressing to a boil, let boil for 1 minute. Remove the pan from heat and let cool.. Toss together cabbage with crunchy topping and dressing immediately before serving. Serve right away or the crunchies will get soggy.. Enjoy!","calories: 632, fat: 51g, carbs: 40g, protein: 9g, servings: 6"
Best Ramen Noodle Salad,https://www.allrecipes.com/recipe/237732/top-ramen-salad/,"{'quantity': '2', 'unit': '(3 ounce) packages', 'name': 'chicken-flavored ramen noodles, broken into pieces, seasoning packets reserved'}, {'quantity': '½', 'unit': 'cup', 'name': 'raw sunflower seeds'}, {'quantity': '½', 'unit': 'cup', 'name': 'slivered almonds'}, {'quantity': '1', 'unit': '(16 ounce) package', 'name': 'coleslaw mix'}, {'quantity': '3', 'unit': '', 'name': 'green onions, chopped'}, {'quantity': '½', 'unit': 'cup', 'name': 'olive oil'}, {'quantity': '3', 'unit': 'tablespoons', 'name': 'white vinegar'}, {'quantity': '1', 'unit': 'tablespoon', 'name': 'white sugar'}, {'quantity': '½', 'unit': 'teaspoon', 'name': 'ground black pepper'}",,"calories: 450, fat: 31g, carbs: 35g, protein: 10g, servings: 6"
Traditional Creamy Coleslaw,https://www.allrecipes.com/recipe/232311/traditional-creamy-coleslaw/,"{'quantity': '1', 'unit': 'cup', 'name': 'mayonnaise'}, {'quantity': '¼', 'unit': 'cup', 'name': 'white sugar'}, {'quantity': '2', 'unit': 'tablespoons', 'name': 'seasoned rice wine vinegar'}, {'quantity': '1 ½', 'unit': 'tablespoons', 'name': 'lemon juice'}, {'quantity': '1', 'unit': 'tablespoon', 'name': 'prepared horseradish'}, {'quantity': '½', 'unit': 'teaspoon', 'name': 'onion powder'}, {'quantity': '½', 'unit': 'teaspoon', 'name': 'dry mustard'}, {'quantity': '½', 'unit': 'teaspoon', 'name': 'celery salt'}, {'quantity': '½', 'unit': 'teaspoon', 'name': 'salt'}, {'quantity': '½', 'unit': 'teaspoon', 'name': 'ground black pepper'}, {'quantity': '1', 'unit': '(28 ounce) package', 'name': 'coleslaw mix'}","Whisk mayonnaise, sugar, vinegar, lemon juice, horseradish, onion powder, dry mustard, celery salt, salt, and pepper in a large mixing bowl until sugar has dissolved.. Fold coleslaw mix into dressing until well combined. Cover and refrigerate for at least 1 hour before serving.","calories: 204, fat: 16g, carbs: 14g, protein: 1g, servings: 12"
20 Fresh Coleslaw Ideas for Crunchtastic Summer Meals,https://www.allrecipes.com/summer-coleslaw-recipes-8677625,,,
Summer Meat Slaw,https://www.allrecipes.com/summer-meat-slaw-recipe-8666307,"{'quantity': '1', 'unit': 'head', 'name': 'green cabbage'}, {'quantity': '1/2', 'unit': 'cup', 'name': 'green onions'}, {'quantity': '1', 'unit': None, 'name': 'red bell pepper'}, {'quantity': '1', 'unit': 'large', 'name': 'carrot'}, {'quantity': '2', 'unit': 'cloves', 'name': 'garlic'}, {'quantity': '4', 'unit': 'cups', 'name': 'pulled pork'}, {'quantity': '1/4', 'unit': 'cup', 'name': 'avocado oil'}, {'quantity': '1', 'unit': 'teaspoon', 'name': 'kosher salt'}, {'quantity': '1/2', 'unit': 'teaspoon', 'name': 'ground black pepper'}, {'quantity': '2', 'unit': 'teaspoons', 'name': 'riracha'}, {'quantity': '1/3', 'unit': 'cup', 'name': 'seasoned rice vinegar'}, {'quantity': '1/3', 'unit': 'cup', 'name': 'chopped cilantro'}",,"calories: 321, fat: 13g, carbs: 35g, protein: 19g, servings: 8"
"Charred Cabbage, Ginger, and Sesame Slaw",https://www.allrecipes.com/charred-cabbage-ginger-and-sesame-slaw-recipe-8657652,"{'quantity': '1', 'unit': None, 'name': 'red cabbage (about 2 pounds)'}, {'quantity': '1', 'unit': None, 'name': 'lime, halved'}, {'quantity': '6', 'unit': None, 'name': 'green onions'}, {'quantity': '1', 'unit': 'piece)', 'name': 'fresh ginger, unpeeled'}, {'quantity': '2', 'unit': None, 'name': 'carrots, peeled and coarsely shredded'}, {'quantity': '3', 'unit': 'tablespoons', 'name': 'vegetable oil'}, {'quantity': '3', 'unit': 'tablespoons', 'name': 'rice vinegar'}, {'quantity': '2', 'unit': 'teaspoons', 'name': 'honey or agave syrup'}, {'quantity': '2', 'unit': 'teaspoons', 'name': 'riracha'}, {'quantity': '1', 'unit': 'teaspoon', 'name': 'toasted sesame oil'}, {'quantity': '1', 'unit': None, 'name': 'clove garlic, minced'}, {'quantity': '1/2', 'unit': 'teaspoon', 'name': 'crushed red pepper'}, {'quantity': '1/4', 'unit': 'teaspoon', 'name': 'salt'}, {'quantity': '4', 'unit': 'teaspoons', 'name': 'sesame seeds, toasted'}, {'quantity': None, 'unit': None, 'name': 'chopped, unsalted roasted peanuts, for garnish'}","Preheat an outdoor grill to medium heat (350 degrees F to 375 degrees F/175 degrees C to 190 degrees C) . Remove any wilted outer leaves from cabbage, then cut the head into quarters.. Lightly oil grill grates. Arrange cabbage and lime, cut sides down, along with green onions and ginger, on grill grates and cover. Grill green onions and lime, turning halfway through, until charred, 2 to 4 minutes for onions and 6 to 8 minutes for lime. Grill cabbage and ginger, turning halfway through, until cabbage is charred and ginger is softened, 12 to 16 minutes.. When cool enough to handle, core and shred cabbage. Chop green onions, discarding any completely charred parts. Toss together carrots, cabbage, and green onions in a large bowl.. Peel and grate 1 tablespoon ginger (save any remaining ginger for another use).. In a small bowl, whisk together ginger, juice from grilled lime, vegetable oil, vinegar, honey, sriracha, sesame oil, garlic, crushed red pepper, and salt. Add to cabbage mixture and toss to combine. Cover and chill 1 hour before serving, or up to 1 week.. Just before serving, add sesame seeds; toss to combine. Garnish with peanuts.","calories: 171, fat: 10g, carbs: 20g, protein: 4g, servings: 6"
I Tried Our 5 Most Popular Creamy Coleslaw Recipes and the Winner Stole My Heart,https://www.allrecipes.com/best-creamy-coleslaw-recipe-review-7852943,,,
Southern Coleslaw,https://www.allrecipes.com/recipe/222218/nanas-southern-coleslaw/,"{'quantity': '1', 'unit': 'head', 'name': 'cabbage, finely shredded'}, {'quantity': '2', 'unit': '', 'name': 'carrots, finely chopped'}, {'quantity': '2', 'unit': 'tablespoons', 'name': 'finely chopped onion'}, {'quantity': '½', 'unit': 'cup', 'name': 'mayonnaise'}, {'quantity': '⅓', 'unit': 'cup', 'name': 'white sugar'}, {'quantity': '¼', 'unit': 'cup', 'name': 'milk'}, {'quantity': '¼', 'unit': 'cup', 'name': 'buttermilk'}, {'quantity': '2', 'unit': 'tablespoons', 'name': 'lemon juice'}, {'quantity': '2', 'unit': 'tablespoons', 'name': 'distilled white vinegar'}, {'quantity': '½', 'unit': 'teaspoon', 'name': 'salt'}, {'quantity': '⅛', 'unit': 'teaspoon', 'name': 'ground black pepper'}",,"calories: 184, fat: 11g, carbs: 20g, protein: 3g, servings: 8"
"Apple, Raisin, and Carrot Slaw",https://www.allrecipes.com/apple-raisin-and-carrot-slaw-recipe-7182208,"{'quantity': '1/3', 'unit': 'cup', 'name': 'yogurt (such as Icelandic Skyr'}, {'quantity': '1/3', 'unit': 'cup', 'name': 'light mayonnaise'}, {'quantity': '1 1/2', 'unit': 'tablespoons', 'name': 'cider vinegar'}, {'quantity': '1', 'unit': 'tablespoon', 'name': 'poppy seeds'}, {'quantity': '1', 'unit': 'teaspoon', 'name': 'dijon mustard'}, {'quantity': '1/2', 'unit': 'teaspoon', 'name': 'salt'}, {'quantity': '1/2', 'unit': 'teaspoon', 'name': 'black pepper'}, {'quantity': '5', 'unit': 'cups', 'name': 'cabbage'}, {'quantity': '1/3', 'unit': 'cup', 'name': 'carrot'}, {'quantity': '2', 'unit': 'cups', 'name': 'red apple'}, {'quantity': '1/2', 'unit': 'cup', 'name': 'golden raisins'}, {'quantity': None, 'unit': None, 'name': 'fresh parsley'}","Whisk together yogurt, mayonnaise, vinegar, poppy seeds, mustard, salt, and pepper in a large bowl. Stir in cabbage, carrot, apple, and raisins. Garnish with fresh parsley.","calories: 107, fat: 3g, carbs: 20g, protein: 3g, servings: 8"
Copycat KFC Coleslaw,https://www.allrecipes.com/recipe/8536918/copycat-kfc-coleslaw/,"{'quantity': '1', 'unit': '(14 ounce) package', 'name': 'coleslaw mix'}, {'quantity': '¼', 'unit': 'cup', 'name': 'finely chopped yellow onion'}, {'quantity': '½', 'unit': 'cup', 'name': 'mayonnaise'}, {'quantity': '¼', 'unit': 'cup', 'name': 'sugar'}, {'quantity': '2', 'unit': 'tablespoons', 'name': 'milk'}, {'quantity': '2', 'unit': 'tablespoons', 'name': 'buttermilk'}, {'quantity': '2', 'unit': 'tablespoons', 'name': 'white wine vinegar'}, {'quantity': '½', 'unit': 'teaspoon', 'name': 'salt'}, {'quantity': '⅛', 'unit': 'teaspoon', 'name': 'black pepper'}","Stir together coleslaw mix and onion in a large bowl.. Whisk together mayonnaise, sugar, milk, buttermilk, vinegar, salt, and pepper in a second bowl until smooth. Pour dressing over slaw; stir well and chill at least 2 hours or up to overnight.","calories: 167, fat: 12g, carbs: 14g, protein: 1g, servings: 8"
Red Cabbage Slaw,https://www.allrecipes.com/recipe/231542/red-cabbage-slaw/,"{'quantity': '1', 'unit': 'small head', 'name': 'red cabbage, thinly sliced and chopped'}, {'quantity': '½', 'unit': 'cup', 'name': 'grated carrot'}, {'quantity': '½', 'unit': 'cup', 'name': 'mayonnaise'}, {'quantity': '¼', 'unit': 'cup', 'name': 'dried cranberries'}, {'quantity': '¼', 'unit': 'cup', 'name': 'chopped walnuts'}, {'quantity': '1', 'unit': 'tablespoon', 'name': 'milk, or more as needed'}, {'quantity': '1', 'unit': 'tablespoon', 'name': 'apple cider vinegar'}, {'quantity': '1', 'unit': 'teaspoon', 'name': 'white sugar, or more to taste'}","Combine cabbage, carrot, mayonnaise, cranberries, walnuts, milk, cider vinegar, and sugar in a bowl; stir well. For best flavor results, cover and refrigerate until chilled.","calories: 216, fat: 18g, carbs: 14g, protein: 2g, servings: 6"
Asian Coleslaw,https://www.allrecipes.com/recipe/14297/asian-coleslaw/,"{'quantity': '6', 'unit': 'tablespoons', 'name': 'rice wine vinegar'}, {'quantity': '6', 'unit': 'tablespoons', 'name': 'vegetable oil'}, {'quantity': '5', 'unit': 'tablespoons', 'name': 'creamy peanut butter'}, {'quantity': '3', 'unit': 'tablespoons', 'name': 'soy sauce'}, {'quantity': '3', 'unit': 'tablespoons', 'name': 'brown sugar'}, {'quantity': '2', 'unit': 'tablespoons', 'name': 'minced fresh ginger root'}, {'quantity': '1 ½', 'unit': 'tablespoons', 'name': 'minced garlic'}, {'quantity': '5', 'unit': 'cups', 'name': 'thinly sliced green cabbage'}, {'quantity': '2', 'unit': 'cups', 'name': 'thinly sliced red cabbage'}, {'quantity': '2', 'unit': 'cups', 'name': 'shredded napa cabbage'}, {'quantity': '2', 'unit': '', 'name': 'red bell peppers, thinly sliced'}, {'quantity': '2', 'unit': '', 'name': 'carrots, julienned'}, {'quantity': '6', 'unit': '', 'name': 'green onions, chopped'}, {'quantity': '½', 'unit': 'cup', 'name': 'chopped fresh cilantro'}","To make the peanut dressing: Whisk rice vinegar, oil, peanut butter, soy sauce, brown sugar, ginger, and garlic together in a medium bowl; set aside.. To make the coleslaw: Mix green cabbage, red cabbage, napa cabbage, red bell peppers, carrots, green onions, and cilantro in a large bowl.. When ready to serve, pour dressing over cabbage mixture and toss well to combine.","calories: 184, fat: 13g, carbs: 16g, protein: 4g, servings: 10"
Japanese-Style Cabbage Salad,https://www.allrecipes.com/recipe/150135/japanese-style-cabbage-salad/,"{'quantity': '½', 'unit': 'large head', 'name': 'cabbage, cored and shredded'}, {'quantity': '1', 'unit': 'bunch', 'name': 'green onions, thinly sliced'}, {'quantity': '1', 'unit': 'cup', 'name': 'almond slivers'}, {'quantity': '¼', 'unit': 'cup', 'name': 'toasted sesame seeds'}, {'quantity': '3', 'unit': 'tablespoons', 'name': 'sesame oil'}, {'quantity': '3', 'unit': 'tablespoons', 'name': 'rice vinegar'}, {'quantity': '1', 'unit': 'tablespoon', 'name': 'white sugar (Optional)'}, {'quantity': '1', 'unit': 'clove', 'name': 'garlic, minced (Optional)'}, {'quantity': '1', 'unit': 'teaspoon', 'name': 'grated fresh ginger root (Optional)'}, {'quantity': '1', 'unit': 'teaspoon', 'name': 'salt'}, {'quantity': '1', 'unit': 'teaspoon', 'name': 'black pepper'}","Combine cabbage, green onions, almond, and sesame seeds in a large bowl.. Make dressing: Whisk together sesame oil, vinegar, sugar, garlic, ginger, salt, and pepper in a small bowl until sugar is dissolved.. Pour dressing over cabbage mixture and toss until well combined.","calories: 126, fat: 10g, carbs: 8g, protein: 4g, servings: 12"
Red Cabbage Salad,https://www.allrecipes.com/recipe/83727/red-cabbage-salad-ii/,"{'quantity': '⅔', 'unit': 'cup', 'name': 'red wine vinegar'}, {'quantity': '½', 'unit': 'cup', 'name': 'canola oil'}, {'quantity': '1', 'unit': 'tablespoon', 'name': 'white sugar'}, {'quantity': '1', 'unit': 'teaspoon', 'name': 'salt'}, {'quantity': '1', 'unit': 'teaspoon', 'name': 'seasoned salt'}, {'quantity': '¼', 'unit': 'teaspoon', 'name': 'ground black pepper'}, {'quantity': '¼', 'unit': 'teaspoon', 'name': 'onion powder'}, {'quantity': '1', 'unit': 'head', 'name': 'red cabbage, cored and shredded'}","Mix red wine vinegar, canola oil, sugar, salt, seasoned salt, pepper, and onion powder in a bowl.. Place cabbage in a large glass bowl. Pour dressing over cabbage and toss to coat. Cover and refrigerate, 8 hours to overnight, stirring occasionally. Drain before serving.","calories: 225, fat: 19g, carbs: 15g, protein: 2g, servings: 6"
Easy Apple Slaw,https://www.allrecipes.com/recipe/34615/easy-apple-coleslaw/,"{'quantity': '3', 'unit': 'cups', 'name': 'chopped cabbage'}, {'quantity': '1', 'unit': '', 'name': 'unpeeled red apple, cored and chopped'}, {'quantity': '1', 'unit': '', 'name': 'unpeeled Granny Smith apple, cored and chopped'}, {'quantity': '1', 'unit': '', 'name': 'carrot, grated'}, {'quantity': '½', 'unit': 'cup', 'name': 'finely chopped red bell pepper'}, {'quantity': '2', 'unit': '', 'name': 'green onions, finely chopped'}, {'quantity': '⅓', 'unit': 'cup', 'name': 'mayonnaise'}, {'quantity': '⅓', 'unit': 'cup', 'name': 'brown sugar'}, {'quantity': '1', 'unit': 'tablespoon', 'name': 'lemon juice, or to taste'}","Combine cabbage, red apple, green apple, carrot, red bell pepper, and green onions in a large bowl.. To make the dressing: Mix mayonnaise, brown sugar, and lemon juice together in a small bowl. Pour dressing over cabbage mixture; mix until evenly coated.","calories: 137, fat: 5g, carbs: 25g, protein: 1g, servings: 6"
Asian Cabbage Salad,https://www.allrecipes.com/recipe/80526/chinese-cabbage-salad/,"{'quantity': '2', 'unit': 'tablespoons', 'name': 'sesame seeds'}, {'quantity': '4', 'unit': 'cups', 'name': 'shredded cabbage'}, {'quantity': '2', 'unit': '', 'name': 'carrots, shredded'}, {'quantity': '1', 'unit': '(3 ounce) package', 'name': 'ramen noodles, crushed'}, {'quantity': '⅓', 'unit': 'cup', 'name': 'olive oil'}, {'quantity': '2', 'unit': 'tablespoons', 'name': 'white sugar'}, {'quantity': '1 ½', 'unit': 'tablespoons', 'name': 'rice vinegar'}, {'quantity': '½', 'unit': 'teaspoon', 'name': 'sesame oil'}, {'quantity': '½', 'unit': 'teaspoon', 'name': 'salt'}, {'quantity': '¼', 'unit': 'teaspoon', 'name': 'black pepper'}","Toast sesame seeds in a small skillet, shaking frequently, over medium heat until golden brown and fragrant. Transfer toasted seeds to a small plate and set aside.. Toss together cabbage, carrots, and crushed ramen noodles in a large bowl.. Whisk together olive oil, sugar, vinegar, sesame oil, salt, pepper, and ramen seasoning packet in a small bowl until combined.. Pour over cabbage mixture; toss to coat. Top with sesame seeds.","calories: 176, fat: 14g, carbs: 12g, protein: 2g, servings: 6"
Ramen Coleslaw,https://www.allrecipes.com/recipe/14441/ramen-coleslaw/,"{'quantity': '½', 'unit': 'medium head', 'name': 'cabbage, shredded'}, {'quantity': '5', 'unit': '', 'name': 'green onions, chopped'}, {'quantity': '1', 'unit': '(3 ounce) package', 'name': 'chicken flavored ramen noodles, crushed, seasoning packet reserved'}, {'quantity': '¼', 'unit': 'cup', 'name': 'sliced almonds'}, {'quantity': '2', 'unit': 'tablespoons', 'name': 'sesame seeds'}, {'quantity': '3', 'unit': 'tablespoons', 'name': 'white wine vinegar'}, {'quantity': '2', 'unit': 'tablespoons', 'name': 'vegetable oil'}, {'quantity': '2', 'unit': 'tablespoons', 'name': 'white sugar'}, {'quantity': '½', 'unit': 'teaspoon', 'name': 'salt'}, {'quantity': '½', 'unit': 'teaspoon', 'name': 'ground black pepper'}","Preheat the oven to 350 degrees F (175 degrees C).. Combine cabbage, green onions, and crushed ramen noodles in a large salad bowl; set aside.. Spread almonds and sesame seeds evenly onto a baking sheet.. Bake in the preheated oven until lightly browned, about 10 minutes.. Meanwhile, make dressing: Whisk together vinegar, oil, sugar, salt, pepper, and seasoning packet in a medium bowl.. Pour dressing over cabbage mixture; toss to coat evenly. Sprinkle with toasted almonds and sesame seeds.","calories: 253, fat: 13g, carbs: 31g, protein: 7g, servings: 4"
Susan's Vinaigrette Coleslaw,https://www.allrecipes.com/recipe/232313/susans-vinaigrette-coleslaw/,"{'quantity': '3', 'unit': 'tablespoons', 'name': 'apple cider vinegar'}, {'quantity': '3', 'unit': 'tablespoons', 'name': 'canola oil'}, {'quantity': '3', 'unit': 'tablespoons', 'name': 'white sugar'}, {'quantity': '¼', 'unit': 'teaspoon', 'name': 'dry mustard'}, {'quantity': '¼', 'unit': 'teaspoon', 'name': 'poppy seeds'}, {'quantity': '¼', 'unit': 'teaspoon', 'name': 'ground black pepper'}, {'quantity': '¼', 'unit': 'teaspoon', 'name': 'salt'}, {'quantity': '¼', 'unit': 'teaspoon', 'name': 'hot pepper sauce (Optional)'}, {'quantity': '4', 'unit': 'cups', 'name': 'shredded green cabbage'}, {'quantity': '2', 'unit': 'medium', 'name': 'carrots, shredded'}","Whisk vinegar, oil, sugar, mustard, poppy seeds, pepper, salt, and hot sauce together in a bowl until sugar has dissolved.. Mix cabbage and carrots together in a large salad bowl. Pour vinaigrette over top and toss until well combined. Cover and refrigerate for at least 2 hours before serving.","calories: 109, fat: 7g, carbs: 11g, protein: 1g, servings: 6"
20 Recipes That Start With a Bag of Coleslaw Mix,https://www.allrecipes.com/gallery/recipes-using-coleslaw-mix/,,,
