name,link,ingredients,steps,nutrition,image_url
Excellent and Healthy Cornbread,https://www.allrecipes.com/recipe/17969/excellent-and-healthy-cornbread/,"{'quantity': '1', 'unit': 'cup', 'name': 'unbleached flour'}, {'quantity': '1', 'unit': 'cup', 'name': 'cornmeal'}, {'quantity': '¼', 'unit': 'cup', 'name': 'white sugar'}, {'quantity': '1', 'unit': 'teaspoon', 'name': 'baking soda'}, {'quantity': '¾', 'unit': 'teaspoon', 'name': 'salt'}, {'quantity': '1', 'unit': 'cup', 'name': 'plain nonfat yogurt'}, {'quantity': '2', 'unit': 'large', 'name': 'eggs, beaten'}","Preheat the oven to 400 degrees F (200 degrees C). Lightly grease an 8-inch square baking pan.. Whisk flour, cornmeal, sugar, baking soda, and salt together in a large bowl. Stir in yogurt and eggs until just combined; do not overmix. Pour batter into the prepared pan.. Bake in the preheated oven until the center springs back when lightly pressed, 20 to 25 minutes.","calories: 76, fat: 1g, carbs: 14g, protein: 3g, servings: 12",https://www.allrecipes.com/thmb/J9Yng82F01AENVsUOfDHcM--w0Y=/1500x0/filters:no_upscale():max_bytes(150000):strip_icc()/819698-3d5b5616435a45b388547b0f5af7f88e.jpg
Broccoli Cornbread with Cheese,https://www.allrecipes.com/recipe/231966/broccoli-cornbread-with-cheese/,"{'quantity': '4', 'unit': 'large', 'name': 'eggs'}, {'quantity': '1', 'unit': 'cup', 'name': 'cottage cheese'}, {'quantity': '¾', 'unit': 'cup', 'name': 'butter, melted'}, {'quantity': '2', 'unit': '(8.5 ounce) packages', 'name': 'corn bread/muffin mix'}, {'quantity': '1', 'unit': '(10 ounce) package', 'name': 'frozen chopped broccoli, thawed'}, {'quantity': '1', 'unit': 'large', 'name': 'onion, chopped'}, {'quantity': '1 ½', 'unit': 'cups', 'name': 'shredded Cheddar cheese'}","Preheat the oven to 375 degrees F (190 degrees C). Grease a 9x13-inch baking dish.. Beat together eggs, cottage cheese, and melted butter in a large bowl until well combined. Stir in cornbread mix until just moistened. Fold in broccoli, onion, and 1 cup Cheddar cheese. Pour into the prepared baking dish and sprinkle with remaining 1/2 cup Cheddar cheese.. Bake in the preheated oven until a toothpick inserted into the center comes out clean, 35 to 40 minutes. Cool in the baking dish for 10 minutes before slicing and serving warm.","calories: 367, fat: 23g, carbs: 30g, protein: 12g, servings: 12",https://www.allrecipes.com/thmb/qUlP4lWzK8npKgO89tnppeohFZI=/1500x0/filters:no_upscale():max_bytes(150000):strip_icc()/2436147-broccoli-cornbread-with-cheese-Allrecipes-Magazine-4x3-1-cfa8865239e245f19a8cdedd5fe7271a.jpg
Skillet Cornbread,https://www.allrecipes.com/recipe/231158/skillet-corn-bread/,"{'quantity': '1 ¼', 'unit': 'cups', 'name': 'milk'}, {'quantity': '1', 'unit': 'cup', 'name': 'cornmeal'}, {'quantity': '1', 'unit': 'cup', 'name': 'all-purpose flour'}, {'quantity': '4', 'unit': 'teaspoons', 'name': 'baking powder'}, {'quantity': '¾', 'unit': 'teaspoon', 'name': 'kosher salt'}, {'quantity': '2', 'unit': '', 'name': 'eggs, beaten'}, {'quantity': '¼', 'unit': 'cup', 'name': 'unsalted butter, melted'}, {'quantity': '1', 'unit': 'tablespoon', 'name': 'vegetable oil'}","Place a 9-inch cast iron skillet into the oven and preheat to 425 degrees F (220 degrees C).. Mix milk and cornmeal together in small bowl. Let soak for 10 minutes.. Sift flour, baking powder, and salt together into a mixing bowl. Add cornmeal mixture, eggs, and butter; beat until a smooth batter forms, about 1 minute.. Remove the hot skillet from the oven. Add vegetable oil to the skillet and swish to coat. Pour out any excess oil, then pour batter into the skillet.. Bake in the preheated oven until a toothpick inserted into the center comes out clean, 18 to 23 minutes. Cut into wedges to serve.","calories: 225, fat: 10g, carbs: 28g, protein: 6g, servings: 8",https://www.allrecipes.com/thmb/t_tELTIp1gwIoY7TtzXUWJJUcnI=/1500x0/filters:no_upscale():max_bytes(150000):strip_icc()/231158skillet-corn-breadladonnalangwell2x1-1997941fa70b4a91a44f6fc6d64d81be.jpg
Mom's Mexican Cornbread,https://www.allrecipes.com/recipe/66428/moms-mexican-cornbread/,"{'quantity': '1', 'unit': 'pound', 'name': 'ground beef'}, {'quantity': '1', 'unit': 'cup', 'name': 'cornmeal'}, {'quantity': '1', 'unit': 'teaspoon', 'name': 'salt'}, {'quantity': '1', 'unit': 'teaspoon', 'name': 'baking soda'}, {'quantity': '1', 'unit': '(14.5 ounce) can', 'name': 'cream-style corn'}, {'quantity': '1', 'unit': 'cup', 'name': 'milk'}, {'quantity': '1', 'unit': 'cup', 'name': 'shredded Cheddar cheese'}, {'quantity': '1', 'unit': '', 'name': 'onion, chopped'}, {'quantity': '2', 'unit': None, 'name': 'jalapeño peppers, chopped'}, {'quantity': '1', 'unit': '', 'name': 'egg'}","Preheat the oven to 350 degrees F (175 degrees C). Coat a 9X12-inch baking dish with cooking spray.. Heat a large skillet over medium heat. Add ground beef; cook and stir until no longer pink. Set aside.. Whisk cornmeal, salt, and baking soda together in a large bowl. Stir in corn, milk, Cheddar cheese, onion, jalapeños, and egg. Stir in browned beef; pour into the prepared baking dish.. Bake in the preheated oven until golden brown, about 1 hour.","calories: 205, fat: 10g, carbs: 17g, protein: 11g, servings: 12",https://www.allrecipes.com/thmb/1VY640yUdqY3BjTGC2zwAh1Qo1c=/1500x0/filters:no_upscale():max_bytes(150000):strip_icc()/2305902-857cc0903d3d4744a9338b6bf5711a28.jpg
Blueberry Cornbread,https://www.allrecipes.com/recipe/228585/blueberry-cornbread/,"{'quantity': '1', 'unit': 'cup', 'name': 'cornmeal'}, {'quantity': '1', 'unit': 'cup', 'name': 'all-purpose flour'}, {'quantity': '½', 'unit': 'cup', 'name': 'white sugar'}, {'quantity': '1', 'unit': 'tablespoon', 'name': 'baking powder'}, {'quantity': '1', 'unit': 'teaspoon', 'name': 'salt'}, {'quantity': '2', 'unit': '', 'name': 'eggs'}, {'quantity': '⅔', 'unit': 'cup', 'name': 'milk'}, {'quantity': '½', 'unit': 'cup', 'name': 'vegetable oil'}, {'quantity': '2', 'unit': 'cups', 'name': 'blueberries'}","Preheat the oven to 400 degrees F (200 degrees C). Grease a 9-inch square baking dish.. Whisk cornmeal, flour, sugar, baking powder, and salt together in a bowl. Beat eggs, milk, and oil together in a separate large bowl. Add cornmeal mixture to egg mixture; stir until just combined. Fold in blueberries; pour into the prepared baking dish.. Bake in the preheated oven until a toothpick inserted into the center comes out clean, 25 to 30 minutes.","calories: 453, fat: 21g, carbs: 60g, protein: 7g, servings: 6",https://www.allrecipes.com/thmb/t0VTCG_RD_vGUwIIL67L5MSqyS8=/1500x0/filters:no_upscale():max_bytes(150000):strip_icc()/1001855-9ede5b003aa7406bb28bb674a997e077.jpg
Homesteader Cornbread,https://www.allrecipes.com/recipe/16955/homesteader-cornbread/,"{'quantity': '1 ½', 'unit': 'cups', 'name': 'cornmeal'}, {'quantity': '2 ½', 'unit': 'cups', 'name': 'milk'}, {'quantity': '2', 'unit': 'cups', 'name': 'all-purpose flour'}, {'quantity': '1', 'unit': 'tablespoon', 'name': 'baking powder'}, {'quantity': '1', 'unit': 'teaspoon', 'name': 'salt'}, {'quantity': '⅔', 'unit': 'cup', 'name': 'white sugar'}, {'quantity': '2', 'unit': '', 'name': 'eggs'}, {'quantity': '½', 'unit': 'cup', 'name': 'vegetable oil'}","Preheat oven to 400 degrees F (200 degrees C). In a small bowl, combine cornmeal and milk; let stand for 5 minutes. Grease a 9x13 inch baking pan.. In a large bowl, whisk together flour, baking powder, salt and sugar. Mix in the cornmeal mixture, eggs and oil until smooth. Pour batter into prepared pan.. Bake in preheated oven for 30 to 35 minutes, or until a knife inserted into the center of the cornbread comes out clean.","calories: 234, fat: 9g, carbs: 33g, protein: 5g, servings: 15",https://cdn.jwplayer.com/v2/media/DLRlNSO3/poster.jpg?width=720
Real Southern Cornbread,https://www.allrecipes.com/recipe/7192/real-southern-cornbread/,"{'quantity': '2', 'unit': 'cups', 'name': 'cornmeal'}, {'quantity': '2', 'unit': 'cups', 'name': 'all-purpose flour'}, {'quantity': '½', 'unit': 'teaspoon', 'name': 'salt'}, {'quantity': '2', 'unit': 'tablespoons', 'name': 'baking powder'}, {'quantity': '2', 'unit': '', 'name': 'eggs'}, {'quantity': '1', 'unit': 'cup', 'name': 'margarine, melted'}, {'quantity': '4', 'unit': 'cups', 'name': 'buttermilk'}, {'quantity': '¼', 'unit': 'cup', 'name': 'corn oil'}","In a large bowl mix together the corn meal, flour, salt, and baking powder.. In a separate bowl mix together the eggs, butter, and buttermilk. Add to the dry ingredients and stir until well blended.. Heat a dry 12 inch cast iron skillet over high heat for 2 minutes. Add corn oil to skillet, swirl oil around to coat bottom and sides. Leave remaining oil in pan. Return to high heat for 1 minute.. Pour the cornbread batter into the skillet and cook on high heat until bubbles start to form in the center. Remove from stove.. Bake in a preheated 400 degree F (200 degree C) oven for 40 to 50 minutes, or until a knife inserted into the center comes out clean. Serve warm.","calories: 369, fat: 22g, carbs: 36g, protein: 8g, servings: 12",https://www.allrecipes.com/thmb/Xvhj4yxOtIxkno52gReH0PuKJGo=/1500x0/filters:no_upscale():max_bytes(150000):strip_icc()/4486434-3698d84fc33941d4866b7318a3227605.jpg
Creamy Cornbread Casserole,https://www.allrecipes.com/recipe/22381/creamy-cornbread-casserole/,"{'quantity': '1', 'unit': '(15 ounce) can', 'name': 'whole kernel corn, drained and 1/2 liquid reserved'}, {'quantity': '1', 'unit': '(14.75 ounce) can', 'name': 'cream-style corn'}, {'quantity': '2', 'unit': '', 'name': 'eggs'}, {'quantity': '1', 'unit': '(8 ounce) package', 'name': 'dry corn bread mix'}, {'quantity': '1', 'unit': 'cup', 'name': 'sour cream'}, {'quantity': '8', 'unit': 'ounces', 'name': 'Cheddar cheese, shredded'}","Preheat oven to 400 degrees F (200 degrees C). Lightly grease a 9x13 inch baking pan.. In a large mixing bowl, combine corn, reserved liquid, eggs, corn bread mix and sour cream; stir until blended. Pour batter into prepared pan; sprinkle with cheese.. Bake in preheated oven for 30 minutes, until golden brown.","calories: 255, fat: 13g, carbs: 26g, protein: 9g, servings: 12",https://cdn.jwplayer.com/v2/media/DSA3XiwL/poster.jpg?width=720
5 Minute Microwave Cornbread,https://www.allrecipes.com/recipe/213605/5-minute-microwave-cornbread/,"{'quantity': '½', 'unit': 'cup', 'name': 'all-purpose flour'}, {'quantity': '½', 'unit': 'cup', 'name': 'cornmeal'}, {'quantity': '½', 'unit': 'cup', 'name': 'milk'}, {'quantity': '1', 'unit': 'large', 'name': 'egg'}, {'quantity': '2', 'unit': 'tablespoons', 'name': 'white sugar'}, {'quantity': '2', 'unit': 'tablespoons', 'name': 'vegetable oil'}, {'quantity': '2', 'unit': 'teaspoons', 'name': 'baking powder'}, {'quantity': '¼', 'unit': 'teaspoon', 'name': 'salt'}","Mix together flour, cornmeal, milk, egg, sugar, oil, baking powder, and salt in a microwave-safe glass or ceramic bowl until well combined.. Heat in the microwave on high until a toothpick inserted into the center comes out clean, about 3 minutes. Rotate the bowl halfway through cooking if the microwave does not have a turntable.","calories: 154, fat: 6g, carbs: 21g, protein: 4g, servings: 6",https://www.allrecipes.com/thmb/8GldInUChfFvGQR1js629wp0CwM=/1500x0/filters:no_upscale():max_bytes(150000):strip_icc()/3438887-c151298a840640bcb7f85aeec5d27596.jpg
Cornbread Muffins,https://www.allrecipes.com/recipe/17292/cornbread-muffins-i/,"{'quantity': '⅔', 'unit': 'cup', 'name': 'white sugar'}, {'quantity': '½', 'unit': 'cup', 'name': 'butter, softened'}, {'quantity': '¼', 'unit': 'cup', 'name': 'honey'}, {'quantity': '2', 'unit': 'large', 'name': 'eggs'}, {'quantity': '½', 'unit': 'teaspoon', 'name': 'salt'}, {'quantity': '1 ½', 'unit': 'cups', 'name': 'all-purpose flour'}, {'quantity': '¾', 'unit': 'cup', 'name': 'cornmeal'}, {'quantity': '½', 'unit': 'teaspoon', 'name': 'baking powder'}, {'quantity': '½', 'unit': 'cup', 'name': 'milk'}, {'quantity': '¾', 'unit': 'cup', 'name': 'frozen corn kernels, thawed'}","Preheat the oven to 400 degrees F (200 degrees C). Grease or line 12 muffin cups.. Beat sugar, butter, honey, eggs, and salt together in a large bowl until well combined. Mix in flour, cornmeal, and baking powder; blend thoroughly. Stir in milk and corn. Pour or spoon batter into prepared muffin cups.. Bake in the preheated oven until a toothpick inserted into center of a muffin comes out clean, about 20 to 25 minutes.","calories: 243, fat: 9g, carbs: 37g, protein: 4g, servings: 12",https://www.allrecipes.com/thmb/BBnDseQVEy30lDktdRgM9iOVIPo=/1500x0/filters:no_upscale():max_bytes(150000):strip_icc()/17292-cornbread-muffins-sunny-days-nora-4x3-31718a1fbd7545b489333544ad69becb.jpg
Banana Cornbread,https://www.allrecipes.com/recipe/241303/banana-cornbread/,"{'quantity': '2', 'unit': 'cups', 'name': 'all-purpose flour'}, {'quantity': '2', 'unit': 'cups', 'name': 'cornmeal'}, {'quantity': '2', 'unit': 'cups', 'name': 'milk'}, {'quantity': '2', 'unit': '', 'name': 'bananas'}, {'quantity': '1 ⅓', 'unit': 'cups', 'name': 'white sugar'}, {'quantity': '⅔', 'unit': 'cup', 'name': 'vegetable oil'}, {'quantity': '2', 'unit': 'teaspoons', 'name': 'baking powder'}, {'quantity': '2', 'unit': 'teaspoons', 'name': 'salt'}","Preheat oven to 350 degrees F (175 degrees C). Grease a 9x13-inch baking dish.. Combine flour, cornmeal, milk, bananas, sugar, vegetable oil, baking powder, and salt together in a bowl until batter is smooth; pour into the prepared baking dish.. Bake in the preheated oven until a toothpick inserted in the center comes out clean, about 30 minutes.","calories: 196, fat: 7g, carbs: 32g, protein: 3g, servings: 24",https://www.allrecipes.com/thmb/XtdVutGkOf-XFH4sWayjjxTEmgM=/1500x0/filters:no_upscale():max_bytes(150000):strip_icc()/2543200-3e96d3101ce744638dfc998e76097925.jpg
Corn Dog Muffins,https://www.allrecipes.com/recipe/83412/corn-dog-muffins/,"{'quantity': '2', 'unit': '(8.5 ounce) packages', 'name': 'cornbread mix'}, {'quantity': '2', 'unit': 'tablespoons', 'name': 'brown sugar'}, {'quantity': '2', 'unit': 'large', 'name': 'eggs'}, {'quantity': '1 ½', 'unit': 'cups', 'name': 'milk'}, {'quantity': '1', 'unit': 'cup', 'name': 'grated Cheddar cheese'}, {'quantity': '9', 'unit': '', 'name': 'hot dogs, cut in half'}","Preheat the oven to 400 degrees F (200 degrees C). Lightly grease muffin tins.. Stir cornbread mix and brown sugar together in a large bowl. Whisk eggs and milk in a small bowl until smooth. Fold eggs and cheese into cornbread mixture until moistened. Spoon mixture into muffin tins about 2/3 full. Add 1 hot dog half to each muffin.. Bake in the preheated oven until golden brown, about 14 to 18 minutes.","calories: 246, fat: 14g, carbs: 21g, protein: 8g, servings: 18",https://cdn.jwplayer.com/v2/media/oraOk9FP/poster.jpg?width=720
Gluten-Free Cornbread,https://www.allrecipes.com/recipe/255254/gluten-free-cornbread/,"{'quantity': '1 ¼', 'unit': 'cups', 'name': 'white cornmeal'}, {'quantity': '½', 'unit': 'cup', 'name': 'white sugar'}, {'quantity': '¼', 'unit': 'cup', 'name': 'gluten-free all-purpose flour'}, {'quantity': '1', 'unit': 'tablespoon', 'name': 'gluten-free baking powder'}, {'quantity': '1', 'unit': 'cup', 'name': 'milk'}, {'quantity': '¼', 'unit': 'cup', 'name': 'butter, melted'}, {'quantity': '1', 'unit': '', 'name': 'egg'}, {'quantity': '1', 'unit': '(14.75 ounce) can', 'name': 'cream-style corn'}","Preheat oven to 400 degrees F (200 degrees C). Grease an 8-inch square pan.. Mix cornmeal, sugar, flour, and baking powder together in a bowl.. Whisk milk, butter, and egg together in another bowl. Stir into cornmeal mixture just until combined and some lumps remain. Fold in corn. Pour batter into the pan and smooth out the top.. Bake in the preheated oven until a toothpick inserted into the center comes out clean, 20 to 25 minutes.","calories: 248, fat: 8g, carbs: 42g, protein: 5g, servings: 8",https://www.allrecipes.com/thmb/fYfgwCWbMPfUCDLarE_XG2yZz1o=/1500x0/filters:no_upscale():max_bytes(150000):strip_icc()/5790510-gluten-free-cornbread-Angel-4x3-1-06d7e5d9aa744ebd97a5ceefbab86b7b.jpg
Johnnycakes,https://www.allrecipes.com/recipe/7123/johnnycakes/,"{'quantity': '2', 'unit': 'cups', 'name': 'stone ground cornmeal'}, {'quantity': '1', 'unit': 'teaspoon', 'name': 'salt'}, {'quantity': '4', 'unit': 'tablespoons', 'name': 'unsalted butter'}, {'quantity': '1', 'unit': 'cup', 'name': 'whole milk'}, {'quantity': '2', 'unit': 'tablespoons', 'name': 'boiling water'}","Cream the cornmeal, salt, and butter together. Add the milk and enough water to make a moist but firm batter.. Drop by large spoonfuls onto a hot greased griddle, and flatten slightly with the back of a spoon. When brown, turn and cook the other side.","calories: 144, fat: 6g, carbs: 20g, protein: 3g, servings: 10",https://www.allrecipes.com/thmb/i1Morw6HgZhgEJvTO2DwDNQFQkU=/1500x0/filters:no_upscale():max_bytes(150000):strip_icc()/97765-31a74d2fc08c48598ea1deab980fa0e3.jpg
Camp Cornbread,https://www.allrecipes.com/recipe/20147/camp-cornbread/,"{'quantity': '1', 'unit': '(8 ounce) package', 'name': 'corn bread muffin mix'}, {'quantity': '⅓', 'unit': 'cup', 'name': 'milk'}, {'quantity': '1', 'unit': '', 'name': 'egg, lightly beaten'}, {'quantity': '1', 'unit': '(8 ounce) can', 'name': 'canned cream corn'}, {'quantity': '½', 'unit': 'cup', 'name': 'white sugar'}","Preheat oven to 350 degrees F (175 degrees C). Lightly grease a 9x13 inch baking pan.. Place the muffin mix a large mixing bowl. Stir in the milk and egg. Mix in the cream corn and sugar. Pour batter into prepared pan.. Bake in preheated oven for 30 minutes, or until a knife inserted into the center of pan comes out clean.","calories: 131, fat: 3g, carbs: 26g, protein: 2g, servings: 12",https://www.allrecipes.com/thmb/vPotTn4PD4Z2gOFD-ytHgQP92Vc=/1500x0/filters:no_upscale():max_bytes(150000):strip_icc()/1101985-c197e2e1607d4107b15659148f27c309.jpg
We Tried 4 Cornbread Mixes and This Was Our Favorite,https://www.allrecipes.com/article/best-cornbread-mix/,,,,https://www.allrecipes.com/thmb/O4wnrlzDrrdl7trXiTbGPxdEBhQ=/1500x0/filters:no_upscale():max_bytes(150000):strip_icc()/taste-test-cornbread-mix-12b5764375354ee69bfcbf1820574df3.png
31 Thanksgiving Corn Recipes From Traditional to New Classics,https://www.allrecipes.com/gallery/thanksgiving-corn-recipes/,,,,https://www.allrecipes.com/thmb/AVX5A6FeOx2jc4RwCq5zy_lQueQ=/1500x0/filters:no_upscale():max_bytes(150000):strip_icc()/41460-Sweet-Corn-Tomalito-dc789989c7ec4d388a66ba7e73d7706b.jpg
Mexican Cornbread II,https://www.allrecipes.com/recipe/17962/mexican-cornbread-ii/,"{'quantity': '1', 'unit': '(8.5 ounce) package', 'name': 'self-rising cornmeal'}, {'quantity': '1', 'unit': '', 'name': 'egg'}, {'quantity': '½', 'unit': 'cup', 'name': 'milk'}, {'quantity': '1', 'unit': '(8 ounce) can', 'name': 'cream-style corn'}, {'quantity': '1', 'unit': 'cup', 'name': 'shredded Monterey Jack cheese'}, {'quantity': '1', 'unit': '(4 ounce) can', 'name': 'diced green chile peppers, drained'}","Preheat oven to 400 degrees F (200 degrees C). Lightly grease a 9x9 inch baking pan.. Place cornmeal mix in a large bowl. Stir in egg, milk, creamed corn, cheese and diced green chile peppers. Spread batter into prepared pan.. Bake in preheated oven for 25 minutes, or until golden brown and cornbread pulls away from sides of pan.","calories: 128, fat: 4g, carbs: 18g, protein: 5g, servings: 12",https://www.allrecipes.com/thmb/d4TQHiqZdOCZnaxuihVgsLODgVA=/1500x0/filters:no_upscale():max_bytes(150000):strip_icc()/453292-mexican-cornbread-ii-Melissa-Goff-4x3-1-fd8e72f738e04dbd93d117e49d4fe83b.jpg
Sweet Corn Cakes,https://www.allrecipes.com/recipe/21097/sweet-corn-cakes/,"{'quantity': '½', 'unit': 'cup', 'name': 'butter, softened'}, {'quantity': '⅓', 'unit': 'cup', 'name': 'masa harina'}, {'quantity': '¼', 'unit': 'cup', 'name': 'water'}, {'quantity': '1 ½', 'unit': 'cups', 'name': 'frozen corn kernels, thawed'}, {'quantity': '¼', 'unit': 'cup', 'name': 'cornmeal'}, {'quantity': '⅓', 'unit': 'cup', 'name': 'white sugar'}, {'quantity': '2', 'unit': 'tablespoons', 'name': 'heavy cream'}, {'quantity': '¼', 'unit': 'teaspoon', 'name': 'salt'}, {'quantity': '½', 'unit': 'teaspoon', 'name': 'baking powder'}","Preheat oven to 375 degrees F (190 degrees C).. In a medium bowl, beat butter with an electric mixer until creamy. Beat in the masa harina and water until well combined.. Put the corn in a blender or food processor and coarsely chop on low speed. Stir the corn and the cornmeal into the butter mixture. In another bowl, mix together the sugar, cream, salt and baking powder. Combine the two mixtures until well blended. Pour the batter into an ungreased 8x8 pan.. Cover the pan with foil and place into a 9x13 inch pan filled 3/4 inch high with hot water. Bake in preheated oven for 50 to 60 minutes, until a toothpick inserted into center of the cake comes out clean. Remove small pan from water and let sit for 10 minutes before serving.","calories: 207, fat: 13g, carbs: 22g, protein: 2g, servings: 8",https://www.allrecipes.com/thmb/lA0yfBKJFSql0e98ZN_NaqiKiPc=/1500x0/filters:no_upscale():max_bytes(150000):strip_icc()/52534-3cf860d4e5984be28c579387208ad044.jpg
Blue Corn Cornbread,https://www.allrecipes.com/recipe/187199/blue-corn-cornbread/,"{'quantity': '1', 'unit': 'cup', 'name': 'blue cornmeal'}, {'quantity': '1', 'unit': 'cup', 'name': 'all-purpose flour'}, {'quantity': '5', 'unit': 'teaspoons', 'name': 'baking powder'}, {'quantity': '¼', 'unit': 'cup', 'name': 'white sugar'}, {'quantity': '1', 'unit': 'pinch', 'name': 'salt'}, {'quantity': '2', 'unit': '', 'name': 'eggs, beaten'}, {'quantity': '1', 'unit': 'cup', 'name': 'milk'}, {'quantity': '½', 'unit': 'cup', 'name': 'butter'}","Preheat the oven to 350 degrees F (175 degrees C). Grease a 9x9-inch baking dish.. Mix together cornmeal, flour, baking powder, sugar, and salt in a bowl. Sift 3 times. Stir in beaten eggs and milk until well combined. Set aside.. Place butter in the prepared baking dish and melt in the preheated oven. Pour hot, melted butter into cornmeal mixture and mix until incorporated. Transfer batter to the prepared baking dish.. Bake on the center rack in the preheated oven until the edges of cornbread pull away from the sides of the dish and a toothpick inserted into the center comes out clean, 30 to 35 minutes. Let cool for 10 minutes before cutting.","calories: 141, fat: 7g, carbs: 17g, protein: 3g, servings: 16",https://www.allrecipes.com/thmb/awWwIVEl0UPsnMehZDweVRS1994=/1500x0/filters:no_upscale():max_bytes(150000):strip_icc()/7994393-979fe5b1299a4475ad2142103c5d7b0a.jpg
Blueberry Cornmeal Muffins,https://www.allrecipes.com/recipe/18347/blueberry-cornmeal-muffins/,"{'quantity': '1 ¼', 'unit': 'cups', 'name': 'all-purpose flour'}, {'quantity': '½', 'unit': 'cup', 'name': 'cornmeal'}, {'quantity': '½', 'unit': 'cup', 'name': 'brown sugar'}, {'quantity': '½', 'unit': 'teaspoon', 'name': 'salt'}, {'quantity': '1', 'unit': 'tablespoon', 'name': 'baking powder'}, {'quantity': '1', 'unit': 'cup', 'name': 'milk'}, {'quantity': '½', 'unit': 'cup', 'name': 'butter, melted'}, {'quantity': '1', 'unit': '', 'name': 'egg, beaten'}, {'quantity': '1', 'unit': 'cup', 'name': 'frozen blueberries'}","Preheat oven to 375 degrees F (190 degrees C). Grease muffin cups or line with paper muffin liners.. Sift flour, cornmeal, brown sugar, salt and baking powder together into a large bowl. Dredge the blueberries in the sifted ingredients. In a small bowl, combine the milk, butter and egg. Stir the wet ingredients into the flour mixture just until moistened. Spoon batter into prepared muffin tins.. Bake in preheated oven for 20 minutes. Let muffins sit for 10 minutes before removing from the pan.","calories: 180, fat: 9g, carbs: 23g, protein: 3g, servings: 12",https://www.allrecipes.com/thmb/5t7irIsvE4XzIG0V7PiwqzBK-jE=/1500x0/filters:no_upscale():max_bytes(150000):strip_icc()/5400424-blueberry-cornmeal-muffins-Mallory-Workman-4x3-1-2155a853418c459b9e55707f9391bd7f.jpg
Applesauce Cornbread,https://www.allrecipes.com/recipe/89990/applesauce-cornbread/,"{'quantity': '', 'unit': '', 'name': 'cooking spray'}, {'quantity': '1', 'unit': 'cup', 'name': 'all-purpose flour'}, {'quantity': '1', 'unit': 'cup', 'name': 'fine cornmeal'}, {'quantity': '2', 'unit': 'teaspoons', 'name': 'baking soda'}, {'quantity': '1', 'unit': 'teaspoon', 'name': 'baking powder'}, {'quantity': '½', 'unit': 'teaspoon', 'name': 'salt'}, {'quantity': '¼', 'unit': 'cup', 'name': 'sugar'}, {'quantity': '¾', 'unit': 'cup', 'name': 'skim milk'}, {'quantity': '2', 'unit': '', 'name': 'large eggs'}, {'quantity': '¼', 'unit': 'cup', 'name': 'unsweetened applesauce'}","Preheat the oven to 425 degrees F (220 degrees C). Lightly spray an 8x8-inch baking pan with cooking spray.. In a bowl, mix together flour, cornmeal, baking soda, baking powder, salt, and sugar. In a separate bowl, stir together milk, eggs, and applesauce. Fold the wet mixture into the dry; mix together well. Pour batter into the prepared pan.. Bake in the preheated oven until puffed and brown, 15 to 20 minutes.","calories: 155, fat: 2g, carbs: 30g, protein: 5g, servings: 9",https://www.allrecipes.com/thmb/01xrBhG2NmO3YnDuxP8xTVCh478=/1500x0/filters:no_upscale():max_bytes(150000):strip_icc()/1015205-2b720abb7e5f4f2c894d173b819efd64.jpg
