name,link,ingredients,steps,nutrition,image_url
Black-Eyed Pea Cornbread,https://www.allrecipes.com/recipe/259353/black-eyed-pea-cornbread/,"{'quantity': '', 'unit': '', 'name': 'cooking spray'}, {'quantity': '1', 'unit': 'pound', 'name': 'bulk spicy breakfast sausage'}, {'quantity': '1', 'unit': '', 'name': 'onion, chopped'}, {'quantity': '1', 'unit': 'cup', 'name': 'white cornmeal'}, {'quantity': '½', 'unit': 'cup', 'name': 'all-purpose flour'}, {'quantity': '1', 'unit': 'teaspoon', 'name': 'salt'}, {'quantity': '½', 'unit': 'teaspoon', 'name': 'baking soda'}, {'quantity': '1', 'unit': 'cup', 'name': 'buttermilk'}, {'quantity': '½', 'unit': 'cup', 'name': 'vegetable oil'}, {'quantity': '2', 'unit': '', 'name': 'eggs, lightly beaten'}, {'quantity': '1', 'unit': '(15 ounce) can', 'name': 'black-eyed peas, drained'}, {'quantity': '1', 'unit': '(8 ounce) package', 'name': 'shredded Cheddar cheese'}, {'quantity': '¾', 'unit': 'cup', 'name': 'cream-style corn'}, {'quantity': '1', 'unit': '(4.5 ounce) can', 'name': 'chopped green chile peppers'}, {'quantity': '¼', 'unit': 'cup', 'name': 'chopped pickled jalapeño peppers'}","Preheat the oven to 350 degrees F (175 degrees C). Grease a 9x13-inch baking dish with cooking spray.. Cook sausage and onion in a large skillet over medium heat, stirring until sausage is crumbly and no longer pink, about 5 minutes. Drain on paper towels.. Mix cornmeal, flour, salt, and baking soda together in a large bowl.. Whisk buttermilk, oil, and eggs together in a small bowl. Add to cornmeal mixture, stirring just until moistened. Stir in sausage mixture, black-eyed peas, Cheddar cheese, corn, chile peppers, and jalapeños. Pour batter into the prepared baking dish.. Bake in the preheated oven until a toothpick inserted into center comes out clean, about 1 hour.","calories: 377, fat: 25g, carbs: 24g, protein: 15g, servings: 12",https://www.allrecipes.com/thmb/uP3Z5qS_SLaD3DhEqAbUaKjumAw=/1500x0/filters:no_upscale():max_bytes(150000):strip_icc()/8241760-18bb1acb1fe8421faaaf0dcdbbd51fae.jpg
Bacon Cheddar Jalapeño Cornbread,https://www.allrecipes.com/recipe/230998/bacon-cheddar-jalapeno-cornbread/,"{'quantity': '5', 'unit': 'slices', 'name': 'bacon'}, {'quantity': '3', 'unit': 'cups', 'name': 'all-purpose flour'}, {'quantity': '1', 'unit': 'cup', 'name': 'yellow cornmeal'}, {'quantity': '¼', 'unit': 'cup', 'name': 'white sugar'}, {'quantity': '2', 'unit': 'tablespoons', 'name': 'baking powder'}, {'quantity': '2', 'unit': 'teaspoons', 'name': 'kosher salt'}, {'quantity': '1', 'unit': 'cup', 'name': 'milk'}, {'quantity': '1', 'unit': 'cup', 'name': 'buttermilk'}, {'quantity': '1', 'unit': 'cup', 'name': 'unsalted butter, melted'}, {'quantity': '3', 'unit': 'extra large', 'name': 'eggs, lightly beaten'}, {'quantity': '1', 'unit': '(8 ounce) package', 'name': 'shredded sharp Cheddar cheese'}, {'quantity': '3', 'unit': '', 'name': 'jalapeno peppers, diced'}","Fry bacon in a large cast iron skillet over medium-high heat, turning occasionally, until evenly browned, about 10 minutes. Transfer bacon to a paper towel-lined plate; reserve remaining bacon grease in the skillet. Crumble bacon.. Preheat the oven to 350 degrees F (175 degrees C). Place the skillet with bacon grease in the oven.. Combine flour, cornmeal, sugar, baking powder, and salt in a large bowl. Whisk milk, buttermilk, butter, and eggs in another bowl; stir milk mixture into flour mixture until just combined. Batter will be slightly lumpy. Fold in Cheddar cheese and jalapeño peppers. Allow batter to rest at room temperature for 10 minutes.. Pour batter into the hot skillet; sprinkle with crumbled bacon, gently pressing bacon into batter.. Bake in the preheated oven until a toothpick inserted into the center comes out clean, 30 to 35 minutes. Cool in the pan for 10 minutes before slicing.","calories: 445, fat: 26g, carbs: 40g, protein: 14g, servings: 12",https://www.allrecipes.com/thmb/YSGWz8iSqrPdWDJhp4QdIKFeRoo=/1500x0/filters:no_upscale():max_bytes(150000):strip_icc()/8154127-be19154e81c1419586f0f6ca6e7dd886.jpg
Authentic Mexican Corn Bread,https://www.allrecipes.com/recipe/221432/authentic-mexican-corn-bread/,"{'quantity': '1', 'unit': '(14 ounce) can', 'name': 'sweetened condensed milk (such as La Lechera®)'}, {'quantity': '½', 'unit': 'cup', 'name': 'white sugar (Optional)'}, {'quantity': '5', 'unit': '', 'name': 'large eggs'}, {'quantity': '2', 'unit': 'teaspoons', 'name': 'vanilla extract'}, {'quantity': '2', 'unit': '(15.25 ounce) cans', 'name': 'whole kernel corn, drained and rinsed'}, {'quantity': '1', 'unit': '(15 ounce) can', 'name': 'cream-style corn'}, {'quantity': '½', 'unit': 'cup', 'name': 'butter, melted'}, {'quantity': '2 ½', 'unit': 'cups', 'name': 'cornmeal'}, {'quantity': '½', 'unit': 'cup', 'name': 'all-purpose flour'}, {'quantity': '1', 'unit': 'tablespoon', 'name': 'baking soda'}, {'quantity': '1', 'unit': 'teaspoon', 'name': 'salt'}","Preheat the oven to 350 degrees F (175 degrees C). Grease and flour a 2-quart baking dish.. Whisk sweetened condensed milk and sugar together in a large bowl. Whisk in eggs, and vanilla. Stir in whole kernel corn, cream-style corn, and butter.. Whisk cornmeal, flour, baking soda, and salt in a separate bowl; stir cornmeal mixture into the corn mixture.. Pour batter into the prepared baking dish.. Bake until a toothpick inserted into the center of the cornbread comes out clean, about 45 minutes. Serve warm.","calories: 448, fat: 14g, carbs: 74g, protein: 11g, servings: 12",https://www.allrecipes.com/thmb/9i6gP8FJUHP9TbpvtYw2PDOfOBc=/1500x0/filters:no_upscale():max_bytes(150000):strip_icc()/9281485-authentic-mexican-corn-bread-Lisa-Lodermeier-4x3-1-1a3f416bc27d475a93810ec146b95776.jpg
Corn Fritters with Maple Syrup,https://www.allrecipes.com/recipe/56565/corn-fritters-with-maple-syrup/,"{'quantity': '4', 'unit': 'cups', 'name': 'vegetable oil for deep-frying'}, {'quantity': '1', 'unit': 'cup', 'name': 'cream-style corn'}, {'quantity': '1', 'unit': '', 'name': 'egg'}, {'quantity': '1', 'unit': 'cup', 'name': 'all-purpose flour'}, {'quantity': '1', 'unit': 'teaspoon', 'name': 'white sugar'}, {'quantity': '¾', 'unit': 'teaspoon', 'name': 'baking powder'}, {'quantity': '½', 'unit': 'teaspoon', 'name': 'salt'}, {'quantity': '1', 'unit': 'cup', 'name': 'maple-flavored pancake syrup'}","Heat oil in a deep fryer to 350 degrees F (175 degrees C).. Combine cream-style corn and egg in a small bowl. Stir flour, sugar, baking powder, and salt together in a medium bowl; stir in corn mixture until just blended.. Drop 1/8 cupfuls batter into hot oil. Fry until golden brown, turning once if fritters don't turn over by themselves. Drain fritters on paper towels; serve with syrup.","calories: 849, fat: 81g, carbs: 33g, protein: 2g, servings: 11",https://www.allrecipes.com/thmb/TtqCrJHhLtJ6Gt9YDO_-vpzelZU=/1500x0/filters:no_upscale():max_bytes(150000):strip_icc()/3579371-78e6d566dda944049d4712291d1c8a16.jpg
Jalapeño Cornbread,https://www.allrecipes.com/recipe/228772/jalapeno-corn-bread/,"{'quantity': '1', 'unit': '(8.25 ounce) can', 'name': 'cream-style corn'}, {'quantity': '1', 'unit': 'cup', 'name': 'yellow cornmeal'}, {'quantity': '¾', 'unit': 'cup', 'name': 'buttermilk'}, {'quantity': '3', 'unit': 'large', 'name': 'eggs'}, {'quantity': '½', 'unit': 'cup', 'name': 'corn oil'}, {'quantity': '3', 'unit': 'ounces', 'name': 'shredded Cheddar cheese'}, {'quantity': '2', 'unit': '', 'name': 'jalapeno peppers, minced'}, {'quantity': '1', 'unit': 'teaspoon', 'name': 'salt'}, {'quantity': '½', 'unit': 'teaspoon', 'name': 'baking soda'}, {'quantity': '2', 'unit': 'tablespoons', 'name': 'butter'}","Preheat the oven to 400 degrees F (200 degrees C). Move an oven rack to the center position.. Mix together cream-style corn, cornmeal, buttermilk, eggs, corn oil, Cheddar cheese, jalapeño peppers, salt, and baking soda in a large bowl until batter is well combined.. Put butter into a 9-inch square baking dish and place in the preheated oven until melted, 2 to 3 minutes.. Pour batter over melted butter in the baking dish.. Bake in the preheated oven until golden brown and a toothpick inserted into the center comes out clean, about 35 minutes.","calories: 312, fat: 23g, carbs: 21g, protein: 8g, servings: 8",https://www.allrecipes.com/thmb/p6nEYBk4X44ufOb4JwiPF4fvPTY=/1500x0/filters:no_upscale():max_bytes(150000):strip_icc()/7450375-fd91860d918f48f2b4cfc636ff3c6591.jpg
Crackling Cornbread,https://www.allrecipes.com/recipe/185944/crackling-cornbread/,"{'quantity': '1', 'unit': 'cup', 'name': 'cornmeal'}, {'quantity': '1', 'unit': 'teaspoon', 'name': 'salt'}, {'quantity': '½', 'unit': 'teaspoon', 'name': 'baking soda'}, {'quantity': '1', 'unit': 'tablespoon', 'name': 'shortening'}, {'quantity': '1', 'unit': 'cup', 'name': 'pork cracklings (fried pork skins)'}, {'quantity': '1', 'unit': 'large', 'name': 'egg'}, {'quantity': '1', 'unit': '', 'name': 'jalapeno pepper, seeded and minced'}, {'quantity': '1', 'unit': 'cup', 'name': 'buttermilk'}","Preheat the oven to 425 degrees F (220 degrees C). Stir together cornmeal, salt, and baking soda in a bowl; set aside. Place shortening into a 9-inch cast iron skillet; place in the preheated oven until the skillet is hot and shortening has melted.. Bring some water to a boil in a small saucepan. Add pork cracklings and boil until tender, 5 to 8 minutes; drain.. Meanwhile, beat egg in a bowl along with jalapeño pepper and buttermilk; stir in cracklings. Stir in cornmeal mixture until moistened; pour batter into the preheated skillet.. Bake in the preheated oven until top of cornbread is brown, and feels firm to the touch, 30 to 40 minutes. Turn out onto a serving plate and cut into wedges; serve immediately.","calories: 254, fat: 12g, carbs: 20g, protein: 14g, servings: 6",https://www.allrecipes.com/thmb/oWa6BFHy-V2BgPabJGqn6zLQ_VE=/1500x0/filters:no_upscale():max_bytes(150000):strip_icc()/972757-crackling-cornbread-Linda-T-4x3-1-a17f26ea9f50446692aa09d1d21850e2.jpg
Sweet Corn Bread,https://www.allrecipes.com/recipe/222619/sweet-corn-bread/,"{'quantity': '1', 'unit': 'cup', 'name': 'all-purpose flour'}, {'quantity': '1', 'unit': 'cup', 'name': 'cornmeal'}, {'quantity': '¼', 'unit': 'cup', 'name': 'white sugar'}, {'quantity': '½', 'unit': 'teaspoon', 'name': 'baking powder'}, {'quantity': '½', 'unit': 'teaspoon', 'name': 'baking soda'}, {'quantity': '½', 'unit': 'teaspoon', 'name': 'salt'}, {'quantity': '1', 'unit': '', 'name': 'egg, lightly beaten'}, {'quantity': '1', 'unit': 'cup', 'name': 'sour cream'}, {'quantity': '⅓', 'unit': 'cup', 'name': 'milk'}, {'quantity': '¼', 'unit': 'cup', 'name': 'butter, melted'}","Preheat the oven to 400 degrees F (205 degrees C). Lightly grease an 8-inch square baking dish.. Combine flour, cornmeal, sugar, baking powder, baking soda, and salt in a large bowl. Mix egg, sour cream, milk, and butter in a small bowl. Fold egg mixture into flour mixture until just moistened; pour into prepared baking dish.. Bake in preheated oven until a toothpick inserted near the center comes out clean, 20 to 25 minutes. Serve warm.","calories: 241, fat: 12g, carbs: 30g, protein: 4g, servings: 9",https://cdn.jwplayer.com/v2/media/SC2HOQgL/poster.jpg?width=720
Mexican-Style Sweet Cornbread,https://www.allrecipes.com/recipe/279298/mexican-style-sweet-cornbread/,"{'quantity': '1', 'unit': '(8.5 ounce) package', 'name': 'dry corn muffin mix (such as Jiffy®)'}, {'quantity': '1', 'unit': '(14.25 ounce) can', 'name': 'sweet cream-style corn'}, {'quantity': '¼', 'unit': 'cup', 'name': 'butter, melted'}, {'quantity': '¼', 'unit': 'cup', 'name': 'white sugar'}, {'quantity': '¼', 'unit': 'cup', 'name': 'water'}, {'quantity': '¼', 'unit': 'teaspoon', 'name': 'salt'}","Preheat the oven to 350 degrees F (175 degrees C). Grease a 9x5-inch loaf pan.. Combine corn muffin mix, corn, butter, sugar, water, and salt in a bowl. Pour into the greased loaf pan.. Bake in the preheated oven until all the liquid is absorbed, 45 to 50 minutes. Scoop onto serving dishes with an ice cream scoop.","calories: 237, fat: 10g, carbs: 36g, protein: 3g, servings: 8",https://www.allrecipes.com/thmb/PAITbkB04wfWSa5djmQnMlDRLu0=/1500x0/filters:no_upscale():max_bytes(150000):strip_icc()/7906123-a27e004fdf6a44179f5aa50d47af3f94.jpg
Cranberry Corn Bread,https://www.allrecipes.com/recipe/230136/cranberry-corn-bread/,"{'quantity': '½', 'unit': 'cup', 'name': 'chopped cranberries'}, {'quantity': '1', 'unit': 'tablespoon', 'name': 'white sugar'}, {'quantity': '1 ½', 'unit': 'cups', 'name': 'all-purpose flour'}, {'quantity': '1', 'unit': 'cup', 'name': 'yellow cornmeal'}, {'quantity': '½', 'unit': 'cup', 'name': 'white sugar'}, {'quantity': '1', 'unit': 'tablespoon', 'name': 'baking powder'}, {'quantity': '½', 'unit': 'teaspoon', 'name': 'baking soda'}, {'quantity': '¼', 'unit': 'teaspoon', 'name': 'salt'}, {'quantity': '1 ⅓', 'unit': 'cups', 'name': 'milk'}, {'quantity': '2', 'unit': None, 'name': 'eggs, beaten'}, {'quantity': '3', 'unit': 'tablespoons', 'name': 'unsalted butter, melted'}","Preheat the oven to 425 degrees F (220 degrees C). Grease an 8-inch square baking dish.. Toss cranberries with 1 tablespoon sugar in a bowl; set aside. Whisk flour, cornmeal, 1/2 cup sugar, baking powder, baking soda, and salt together in a separate bowl.. Whisk milk, eggs, and melted butter together in a third bowl; stir into flour mixture just until batter moistened. Stir cranberries into batter; pour into the prepared baking dish.. Bake in the preheated oven until cornbread is golden brown, 18 to 20 minutes. Let cool completely in pan before cutting into squares.","calories: 151, fat: 4g, carbs: 26g, protein: 4g, servings: 15",https://www.allrecipes.com/thmb/bj4zHFYb78lG2wWvdxVRl6uNtOc=/1500x0/filters:no_upscale():max_bytes(150000):strip_icc()/1056367-bcfd8bfd010e45bf8e74d350d4520a57.jpg
Cheesy Cornbread,https://www.allrecipes.com/recipe/282287/cheesy-cornbread/,"{'quantity': '1', 'unit': 'cup', 'name': 'flour'}, {'quantity': '1', 'unit': 'cup', 'name': 'cornmeal'}, {'quantity': '3', 'unit': 'tablespoons', 'name': 'sugar'}, {'quantity': '1', 'unit': 'tablespoon', 'name': 'baking powder'}, {'quantity': '½', 'unit': 'teaspoon', 'name': 'salt'}, {'quantity': '2', 'unit': 'large', 'name': 'eggs'}, {'quantity': '⅔', 'unit': 'cup', 'name': 'milk'}, {'quantity': '', 'unit': '', 'name': '1/2 cup Country Crock® Spread, melted'}, {'quantity': '1', 'unit': 'cup', 'name': 'corn'}, {'quantity': '1', 'unit': 'cup', 'name': 'shredded Cheddar cheese'}","Preheat oven to 350 degrees F. Grease and flour 8x8-inch baking dish.. Combine flour, cornmeal, sugar, baking powder, and salt in a large bowl. Mix eggs, milk, and melted butter. Stir egg mixture into flour mixture just until moistened. Stir in corn and cheese. Pour into prepared baking dish.. Bake 40 to 45 minutes or until toothpick inserted into center comes out clean. Cool 10 minutes then cut into 2-inch squares. Serve warm with Country Crock® Honey Butter Spread.","calories: 127, fat: 4g, carbs: 18g, protein: 5g, servings: 16",https://www.allrecipes.com/thmb/HUB9pjsnWlww_m1mWODd8e-fAdQ=/1500x0/filters:no_upscale():max_bytes(150000):strip_icc()/8720667-a78c6895607041eba45bdb145f231951.jpg
Cast Iron Skillet Buttermilk Cornbread,https://www.allrecipes.com/recipe/246405/cast-iron-skillet-buttermilk-cornbread/,"{'quantity': '1', 'unit': 'cup', 'name': 'white cornmeal'}, {'quantity': '½', 'unit': 'cup', 'name': 'yellow cornmeal'}, {'quantity': '½', 'unit': 'cup', 'name': 'all-purpose flour'}, {'quantity': '4', 'unit': 'teaspoons', 'name': 'baking powder'}, {'quantity': '1', 'unit': 'teaspoon', 'name': 'salt'}, {'quantity': '1', 'unit': 'cup', 'name': 'buttermilk'}, {'quantity': '2', 'unit': 'tablespoons', 'name': 'lard'}, {'quantity': '2', 'unit': 'tablespoons', 'name': 'vegetable oil'}, {'quantity': '1', 'unit': '', 'name': 'large egg'}, {'quantity': '1', 'unit': 'teaspoon', 'name': 'butter, or as needed'}, {'quantity': '1', 'unit': 'pinch', 'name': 'paprika (Optional)'}, {'quantity': '1', 'unit': 'pinch', 'name': 'kosher salt (Optional)'}","Place a cast iron skillet in the oven and preheat to 450 degrees F (230 degrees C).. Mix white cornmeal, yellow cornmeal, flour, baking powder, and salt together in a large bowl. Add buttermilk, lard, and vegetable oil; stir will to combine. Stir in egg until smooth batter forms.. Remove hot cast iron skillet from oven, melt butter in skillet, then pour in batter. Top with paprika and kosher salt. Return skillet to oven.. Reduce temperature to 425 degrees F (220 degrees C) and bake until cornbread is golden brown and pulling away from the sides of the pan, about 15 minutes.. Remove from oven to cool slightly, about 5 minutes. Cut into wedges.","calories: 202, fat: 9g, carbs: 27g, protein: 5g, servings: 8",https://www.allrecipes.com/thmb/rJihJvfxOMhxLp203X8O3AoTgns=/1500x0/filters:no_upscale():max_bytes(150000):strip_icc()/6090379-e6e8639ad66a4ec0945cf64e16b5dc7f.jpg
Savory Corn Muffins,https://www.allrecipes.com/recipe/76933/savory-corn-muffins/,"{'quantity': '1', 'unit': '(14.75 ounce) can', 'name': 'creamed corn'}, {'quantity': '2', 'unit': 'cups', 'name': 'yellow cornmeal, divided'}, {'quantity': '1', 'unit': 'cup', 'name': 'buttermilk'}, {'quantity': '2', 'unit': '', 'name': 'large eggs'}, {'quantity': '8', 'unit': 'tablespoons', 'name': 'melted butter'}, {'quantity': '1', 'unit': 'cup', 'name': 'all-purpose flour'}, {'quantity': '1', 'unit': 'tablespoon', 'name': 'white sugar'}, {'quantity': '1 ½', 'unit': 'teaspoons', 'name': 'salt'}, {'quantity': '2', 'unit': 'teaspoons', 'name': 'baking powder'}, {'quantity': '½', 'unit': 'teaspoon', 'name': 'baking soda'}","Adjust oven rack to middle position and heat oven to 450 degrees. Put a 12-cup muffin tin (with standard-sized molds of 12-cup capacity) in oven to heat while preparing batter.. Microwave creamed corn in a 1-quart Pyrex-type measuring cup to a full boil (or in a medium saucepan over medium heat). Stir in 1 cup of the cornmeal to make a very thick, pasty mush. If the mush is not stiff, microwave an additional 30 seconds or so. Whisk in buttermilk, then eggs and finally butter.. Mix remaining cornmeal with flour, sugar, salt, baking powder and soda in a medium bowl. Pour wet ingredients into dry and stir until just combined.. Remove muffin tin from oven; coat with non-stick cooking spray. Divide batter evenly among cups (a spring-action ice cream scoop works well).. Bake until golden brown on sides and bottom, about 15 minutes. Turn onto a wire rack; let cool 5 minutes. Serve.","calories: 240, fat: 9g, carbs: 35g, protein: 5g, servings: 12",https://www.allrecipes.com/thmb/Iczh--xcJCkipptkd6EmcA1uFGE=/1500x0/filters:no_upscale():max_bytes(150000):strip_icc()/678441-4845aa47c7604af4afcbd11a83a8e54f.jpg
Karen's Sweet Corn Bread,https://www.allrecipes.com/recipe/228113/karens-sweet-corn-bread/,"{'quantity': '½', 'unit': 'cup', 'name': 'butter'}, {'quantity': '½', 'unit': 'cup', 'name': 'white sugar'}, {'quantity': '2', 'unit': '', 'name': 'eggs'}, {'quantity': '1', 'unit': 'cup', 'name': 'yellow cornmeal'}, {'quantity': '1 ½', 'unit': 'cups', 'name': 'all-purpose flour'}, {'quantity': '2', 'unit': 'teaspoons', 'name': 'baking powder'}, {'quantity': '½', 'unit': 'teaspoon', 'name': 'salt'}, {'quantity': '1 ½', 'unit': 'cups', 'name': 'milk'}","Preheat oven to 375 degrees F (190 degrees C). Grease an 8-inch square pan.. Beat butter and sugar together in a bowl until creamy. Add eggs; beat until combined. Stir in cornmeal.. Sift flour, baking powder, and salt together in a separate bowl. Stir flour mixture, alternating with milk, into butter mixture until well combined. Pour batter into prepared pan.. Bake in the preheated oven until a toothpick inserted in the center of the bread comes out clean, 30 to 35 minutes.","calories: 227, fat: 10g, carbs: 31g, protein: 5g, servings: 12",https://cdn.jwplayer.com/v2/media/yHMHOOgd/poster.jpg?width=720
Cracklin' Bread II,https://www.allrecipes.com/recipe/55512/cracklin-bread-ii/,"{'quantity': '1', 'unit': '', 'name': 'egg'}, {'quantity': '3', 'unit': 'tablespoons', 'name': 'shortening or bacon fat'}, {'quantity': '1 ⅛', 'unit': 'cups', 'name': 'buttermilk'}, {'quantity': '1 ¼', 'unit': 'cups', 'name': 'cornmeal'}, {'quantity': '2', 'unit': 'tablespoons', 'name': 'sugar'}, {'quantity': '¼', 'unit': 'cup', 'name': 'all-purpose flour'}, {'quantity': '½', 'unit': 'teaspoon', 'name': 'baking soda'}, {'quantity': '1', 'unit': 'tablespoon', 'name': 'baking powder'}, {'quantity': '1', 'unit': 'teaspoon', 'name': 'salt'}, {'quantity': '1', 'unit': 'cup', 'name': ""crushed pork cracklin's""}","Preheat the oven to 450 degrees F (220 degrees C). Grease a 9x9 inch square baking dish.. In a medium bowl, mix together the egg, shortening and buttermilk. In a separate bowl, stir together the cornmeal, sugar, flour, baking soda, baking powder and salt. Stir the dry ingredients into the wet ingredients until smooth, then stir in the pork cracklin's. Pour the batter into the prepared baking dish.. Bake for 25 to 30 minutes in the preheated oven, until center is set and the top is slightly brown.","calories: 206, fat: 9g, carbs: 22g, protein: 10g, servings: 9",https://www.allrecipes.com/thmb/ovzZark6X5B6SP6sikY5C4EHeWI=/1500x0/filters:no_upscale():max_bytes(150000):strip_icc()/686317-67ecdf6475e547cc8a3dc1c348fe84d8.jpg
Amusement Park Cornbread,https://www.allrecipes.com/recipe/17848/amusement-park-cornbread/,"{'quantity': '⅔', 'unit': 'cup', 'name': 'white sugar'}, {'quantity': '1', 'unit': 'teaspoon', 'name': 'salt'}, {'quantity': '⅓', 'unit': 'cup', 'name': 'butter, softened'}, {'quantity': '1', 'unit': 'teaspoon', 'name': 'vanilla extract'}, {'quantity': '2', 'unit': '', 'name': 'eggs'}, {'quantity': '2', 'unit': 'cups', 'name': 'all-purpose flour'}, {'quantity': '1', 'unit': 'tablespoon', 'name': 'baking powder'}, {'quantity': '¾', 'unit': 'cup', 'name': 'cornmeal'}, {'quantity': '1 ⅓', 'unit': 'cups', 'name': 'milk'}","Preheat oven to 400 degrees F (200 degrees C). Lightly grease an 8 inch skillet.. In a large bowl, beat together sugar, salt, butter and vanilla until creamy. Stir in eggs one at a time, beating well after each addition. In a separate bowl, mix together flour, baking powder and cornmeal. Stir flour mixture into egg mixture alternately with the milk. Beat well until blended.. Bake in preheated oven for 20 minutes, or until golden brown. Serve warm.","calories: 328, fat: 10g, carbs: 52g, protein: 7g, servings: 8",https://www.allrecipes.com/thmb/TLBSmR_46Lrd0mEkvl8qnUovmW8=/1500x0/filters:no_upscale():max_bytes(150000):strip_icc()/17848amusement-park-cornbreadYoly4x3-c7ab28e5fcf5475495280949cbf3b67d.jpg
Best Ever Corn Muffins,https://www.allrecipes.com/recipe/22959/best-ever-corn-muffins/,"{'quantity': '¼', 'unit': 'cup', 'name': 'butter, softened'}, {'quantity': '9', 'unit': 'tablespoons', 'name': 'white sugar'}, {'quantity': '2', 'unit': '', 'name': 'eggs'}, {'quantity': '1', 'unit': 'tablespoon', 'name': 'vanilla extract'}, {'quantity': '1 ½', 'unit': 'cups', 'name': 'biscuit baking mix'}, {'quantity': '¼', 'unit': 'cup', 'name': 'yellow cornmeal'}, {'quantity': '⅔', 'unit': 'cup', 'name': 'milk'}","Preheat oven to 375 degrees F (190 degrees C). Grease 12 muffin cups or line with paper muffin liners.. In a large bowl, cream together the butter and sugar until light and fluffy. Stir in the eggs one at a time, beating well with each addition, then stir in the vanilla.. In a separate bowl, stir together baking mix and cornmeal. Blend this mixture into the butter/egg mixture, alternately with the milk; stir just until combined. Spoon batter into prepared muffin cups.. Bake in preheated oven for 20 to 30 minutes, until golden.","calories: 164, fat: 7g, carbs: 22g, protein: 3g, servings: 12",https://www.allrecipes.com/thmb/WP_XwnGiT0I8JEbG6XY_KwoQkgs=/1500x0/filters:no_upscale():max_bytes(150000):strip_icc()/1034988-e31ecdf6d2dc49ca81f7bbaf7b1e6c56.jpg
