name,link,ingredients,steps,nutrition,image_url
Joyful Chocolate Overnight Oats,https://www.allrecipes.com/recipe/269575/joyful-chocolate-overnight-oats/,"{'quantity': '½', 'unit': 'cup', 'name': 'rolled oats'}, {'quantity': '⅔', 'unit': 'cup', 'name': 'Almond Breeze Chocolate Almondmilk'}, {'quantity': '2', 'unit': 'teaspoons', 'name': 'powdered sugar'}, {'quantity': '2', 'unit': 'teaspoons', 'name': 'unsweetened cocoa powder'}, {'quantity': '1', 'unit': 'tablespoon', 'name': 'toasted slivered almonds'}, {'quantity': '1', 'unit': 'tablespoon', 'name': 'mini chocolate chips'}, {'quantity': '1', 'unit': 'tablespoon', 'name': 'flaked coconut'}","In pint jar or at least 12-ounce glass, mix oats, almondmilk, powdered sugar, and cocoa powder. Cover; refrigerate at least 8 hours or overnight.. To serve, stir mixture and top with almonds, chocolate chips, and coconut.","calories: 362, fat: 13g, carbs: 58g, protein: 9g, servings: 1",https://www.allrecipes.com/thmb/nqw70C9Z7ELE03rw0qTsLhHcYY4=/1500x0/filters:no_upscale():max_bytes(150000):strip_icc()/6106326-61bf6af147d14c97b9081fbbf62f89c4.jpg
Overnight Caramel Gingerbread Oats,https://www.allrecipes.com/recipe/268506/overnight-caramel-gingerbread-oats/,"{'quantity': '1', 'unit': 'tablespoon', 'name': 'butter'}, {'quantity': '¼', 'unit': '', 'name': 'pear, chopped'}, {'quantity': '2', 'unit': 'tablespoons', 'name': 'chopped walnuts'}, {'quantity': '½', 'unit': 'teaspoon', 'name': 'ground cinnamon, divided'}, {'quantity': '6', 'unit': 'ounces', 'name': 'caramel-flavored protein shake (such as Premier Protein®)'}, {'quantity': '½', 'unit': 'cup', 'name': 'rolled oats'}, {'quantity': '2', 'unit': 'teaspoons', 'name': 'pumpkin pie spice'}, {'quantity': '½', 'unit': 'teaspoon', 'name': 'ground ginger'}","Melt butter in a small pan over medium heat. Saute pear, walnuts, and 1/4 teaspoon cinnamon until pear softens, about 5 minutes. Remove from heat and let cool.. Combine protein drink and oats in a small Mason jar. Mix in cooled pear and walnuts. Seal and refrigerate, 8 hours to overnight.. Add pumpkin spice, ginger, and remaining cinnamon to the oats the following morning. Stir to combine.","calories: 477, fat: 26g, carbs: 42g, protein: 24g, servings: 1",https://www.allrecipes.com/thmb/g4AsIKj_NnXNY_Y2nKwxJ8IX_M4=/1500x0/filters:no_upscale():max_bytes(150000):strip_icc()/5832197-d4d87452e9614a5cb45457e5884523ce.jpg
Slow Cooker Pumpkin Oatmeal,https://www.allrecipes.com/recipe/259710/slow-cooker-pumpkin-oatmeal/,"{'quantity': '', 'unit': '', 'name': 'cooking spray'}, {'quantity': '2', 'unit': 'cups', 'name': 'steel-cut oats'}, {'quantity': '½', 'unit': 'cup', 'name': 'firmly packed light brown sugar'}, {'quantity': '1 ½', 'unit': 'tablespoons', 'name': 'ground cinnamon'}, {'quantity': '¾', 'unit': 'teaspoon', 'name': 'ground nutmeg'}, {'quantity': '1', 'unit': 'cup', 'name': 'canned pumpkin'}, {'quantity': '6', 'unit': 'cups', 'name': 'water'}, {'quantity': '1', 'unit': 'cup', 'name': 'fat-free half-and-half'}, {'quantity': '1', 'unit': 'cup', 'name': 'raisins'}, {'quantity': '1', 'unit': 'teaspoon', 'name': 'vanilla extract'}, {'quantity': '2', 'unit': 'tablespoons', 'name': 'firmly packed light brown sugar'}, {'quantity': '2', 'unit': 'teaspoons', 'name': 'firmly packed light brown sugar'}, {'quantity': '5', 'unit': 'tablespoons', 'name': 'chopped walnuts'}, {'quantity': '1', 'unit': 'teaspoon', 'name': 'chopped walnuts'}","Spray a small slow cooker lightly with cooking spray.. Mix oats, 1/2 cup brown sugar, cinnamon, and nutmeg together in a large bowl. Stir in pumpkin. Stir in water and half-and-half gradually. Stir in raisins and vanilla extract.. Ladle oat mixture into the slow cooker. Cook on Low until oats are soft and creamy, 7 1/2 to 8 1/2 hours.. Sprinkle 2 tablespoons plus 2 teaspoons brown sugar and 5 tablespoons plus 1 teaspoon walnuts over oatmeal.","calories: 341, fat: 7g, carbs: 67g, protein: 8g, servings: 8",https://www.allrecipes.com/thmb/jbZi08UPQh9oR_YrbvGbFvnEUjY=/1500x0/filters:no_upscale():max_bytes(150000):strip_icc()/4995106-51d619461ca44c7a83614ff0db812db2.jpg
Coconut Overnight Oats with Protein Powder,https://www.allrecipes.com/recipe/286338/coconut-overnight-oats-with-protein-powder/,"{'quantity': '1', 'unit': 'cup', 'name': 'coconut milk beverage (such as Silk®)'}, {'quantity': '1', 'unit': '(5.3 ounce) container', 'name': 'toasted coconut Greek yogurt (such as Light & Fit®)'}, {'quantity': '¾', 'unit': 'cup', 'name': 'oats'}, {'quantity': '2', 'unit': 'tablespoons', 'name': 'sweetened flaked coconut'}, {'quantity': '1', 'unit': 'scoop', 'name': 'vanilla protein powder'}","Mix coconut milk beverage, Greek yogurt, oats, coconut, and protein powder in a bowl until well combined. Divide mixture between 2 Mason jars. Refrigerate for 8 hours, or overnight.","calories: 313, fat: 8g, carbs: 31g, protein: 29g, servings: 2",https://www.allrecipes.com/thmb/CyG7bi8sHUzv-pd6IznUaKhFrsU=/1500x0/filters:no_upscale():max_bytes(150000):strip_icc()/9442630-3618ac286395434ca4fec9a624830158.jpg
Spiced Chai Overnight Oats,https://www.allrecipes.com/recipe/259215/spiced-chai-overnight-oats/,"{'quantity': '½', 'unit': 'cup', 'name': 'rolled oats'}, {'quantity': '½', 'unit': 'cup', 'name': 'brewed chai tea'}, {'quantity': '½', 'unit': 'cup', 'name': 'unsweetened almond milk'}, {'quantity': '2', 'unit': 'tablespoons', 'name': 'apple butter'}","Combine rolled oats, chai tea, almond milk, and apple butter in a jar or bowl.. Refrigerate until oats are soft, 2 hours to overnight. Stir before eating.","calories: 246, fat: 4g, carbs: 47g, protein: 6g, servings: 1",https://www.allrecipes.com/thmb/oYMRKNCqt_29ZvW1VCmau540Ut4=/1500x0/filters:no_upscale():max_bytes(150000):strip_icc()/9443405-ae049b062e134ff9b168e2b81a8de800.jpg
Peanut Butter Chocolate Overnight Oats,https://www.allrecipes.com/recipe/8450544/peanut-butter-chocolate-overnight-oats/,"{'quantity': '½', 'unit': 'cup', 'name': 'Protein Chocolate Pea, Almond and Cashewmilk (such as Silk®)'}, {'quantity': '½', 'unit': 'cup', 'name': 'quick rolled oats'}, {'quantity': '2', 'unit': 'tablespoons', 'name': 'powdered peanut butter (such as PBFit®)'}, {'quantity': '¾', 'unit': 'tablespoon', 'name': 'chia seeds'}","Combine chocolate protein milk, oats, peanut butter powder, and chia seeds in a 1/2 pint jar with lid. Cover jar with lid.. Refrigerate oatmeal for 8 hours or overnight.","calories: 291, fat: 7g, carbs: 48g, protein: 11g, servings: 1",https://www.allrecipes.com/thmb/vaxMvrkDTlVSz8eYlmOEnTSV_sc=/1500x0/filters:no_upscale():max_bytes(150000):strip_icc()/16592704001659270395342-2000-48360b3bc83b498189b82f4423dabc51.jpg
Vegan Pumpkin Overnight Oats in the Slow Cooker,https://www.allrecipes.com/recipe/263616/vegan-pumpkin-overnight-oats-in-the-slow-cooker/,"{'quantity': '2 ½', 'unit': 'cups', 'name': 'water'}, {'quantity': '1', 'unit': 'cup', 'name': 'steel-cut oats'}, {'quantity': '1', 'unit': 'cup', 'name': 'almond milk'}, {'quantity': '1', 'unit': 'cup', 'name': 'canned pumpkin puree'}, {'quantity': '1', 'unit': 'teaspoon', 'name': 'vanilla extract'}, {'quantity': '1', 'unit': 'teaspoon', 'name': 'pumpkin pie spice'}, {'quantity': '¼', 'unit': 'teaspoon', 'name': 'salt'}","Combine water, steel-cut oats, almond milk, pumpkin puree, vanilla extract, pumpkin pie spice, and salt in a slow cooker.. Cook on Low for 8 hours.","calories: 209, fat: 4g, carbs: 36g, protein: 7g, servings: 4",https://www.allrecipes.com/thmb/fJm7Y0TpIew-7cZhpMHxjUYt5ck=/1500x0/filters:no_upscale():max_bytes(150000):strip_icc()/5251745-b3a79901407043f18f2ea33e5bc7a4e1.jpg
Coconut Overnight Oats,https://www.allrecipes.com/recipe/8458930/coconut-overnight-oats/,"{'quantity': '⅓', 'unit': 'cup', 'name': 'old-fashioned oats'}, {'quantity': '⅓', 'unit': 'cup', 'name': 'coconut milk beverage'}, {'quantity': '¼', 'unit': 'cup', 'name': 'nonfat vanilla Greek yogurt'}, {'quantity': '½', 'unit': 'tablespoon', 'name': 'chia seeds'}, {'quantity': '1 ½', 'unit': 'tablespoons', 'name': 'unsweetened shredded coconut, divided'}, {'quantity': '½', 'unit': 'tablespoon', 'name': 'cacao nibs'}, {'quantity': '½', 'unit': 'tablespoon', 'name': 'sliced almonds'}","Combine oats, coconut milk beverage, Greek yogurt, chia seeds, and 1 tablespoon coconut flakes in an 8-ounce Mason jar. Stir until well combined, and cover with a lid. Refrigerate for 8 hours, or overnight.. Top with ½ tablespoon coconut flakes, cacao nibs, and almonds flakes when ready to serve. Stir and enjoy.","calories: 573, fat: 31g, carbs: 58g, protein: 19g, servings: 1",https://www.allrecipes.com/thmb/7O4AevV0t6YmXS0KI8JPXfIRxho=/1500x0/filters:no_upscale():max_bytes(150000):strip_icc()/Coconut-overnight-oats-Tammy-Lynn-1-abf40bcd43194f4db9538afd81b51c88.jpg
