name,link,ingredients,steps,nutrition,image_url
Apple Yam Casserole,https://www.allrecipes.com/recipe/21260/apple-yam-casserole/,"{'quantity': '3', 'unit': '', 'name': 'sweet potatoes, peeled and cubed'}, {'quantity': '2', 'unit': '', 'name': 'Granny Smith apples - peeled, cored and sliced'}, {'quantity': '½', 'unit': 'cup', 'name': 'packed brown sugar'}, {'quantity': '½', 'unit': 'cup', 'name': 'water'}, {'quantity': '¼', 'unit': 'teaspoon', 'name': 'ground cinnamon'}, {'quantity': '½', 'unit': 'cup', 'name': 'raisins'}, {'quantity': '2', 'unit': 'tablespoons', 'name': 'butter'}, {'quantity': '¼', 'unit': 'teaspoon', 'name': 'salt'}, {'quantity': '3', 'unit': 'tablespoons', 'name': 'all-purpose flour'}, {'quantity': '3', 'unit': 'slices', 'name': 'lemon, thinly sliced'}","Preheat oven to 350 degrees F (175 degrees C). Lightly grease a 2 quart casserole dish.. In the casserole dish, alternately layer the sweet potatoes and apples.. In a medium saucepan over medium heat, mix together brown sugar, 1/3 cup water, cinnamon, raisins, butter and salt. Cook 5 minutes.. In a small bowl, stir together remaining water and flour. Combine with the brown sugar mixture. Pour over the sweet potatoes and apples. Place the lemon slices on top.. Bake covered in the preheated oven 20 minutes. Uncover and continue baking 20 minutes, or until the sweet potatoes and apples are tender.","calories: 180, fat: 3g, carbs: 39g, protein: 2g, servings: 8",https://www.allrecipes.com/thmb/jXA65wkcHjWZg49tWSUnKi6KuyQ=/1500x0/filters:no_upscale():max_bytes(150000):strip_icc()/7173755-ffb0605017084c158c95801dc40106cd.jpg
Avocado Stuffed Yams,https://www.allrecipes.com/recipe/82227/avocado-stuffed-yams/,"{'quantity': '4', 'unit': '(8 ounce)', 'name': 'yams'}, {'quantity': '1', 'unit': 'medium', 'name': 'red bell pepper, seeded and diced'}, {'quantity': '2', 'unit': '', 'name': 'avocados - peeled, pitted, and mashed'}, {'quantity': '¼', 'unit': 'cup', 'name': 'chopped fresh cilantro'}, {'quantity': '¼', 'unit': 'cup', 'name': 'olive oil'}, {'quantity': '2', 'unit': '', 'name': 'green onions, sliced'}, {'quantity': '½', 'unit': 'teaspoon', 'name': 'ground cumin'}, {'quantity': '3', 'unit': 'tablespoons', 'name': 'lime juice'}, {'quantity': '', 'unit': '', 'name': 'salt and ground black pepper to taste'}, {'quantity': '1', 'unit': 'cup', 'name': 'shredded Cheddar cheese'}","Preheat the oven to 350 degrees F (175 degrees C). Place yams on a baking sheet.. Bake yams for 40 minutes, or until tender, turning occasionally. Set aside.. In a medium bowl, mix together the red pepper, avocado, cilantro, olive oil, green onions, cumin and lime juice.. Cut yams in half lengthwise, and fluff the centers with a fork. Top with the avocado stuffing. Season with salt and pepper, and top with shredded Cheddar cheese.","calories: 703, fat: 40g, carbs: 76g, protein: 15g, servings: 4",https://www.allrecipes.com/thmb/YFaIu90Jzbypw4w_SMgiXVi5KIk=/1500x0/filters:no_upscale():max_bytes(150000):strip_icc()/130754-e9cd7972e5564aa986f090d4d6466166.jpg
Falafel Hash,https://www.allrecipes.com/recipe/246967/falafel-hash/,"{'quantity': '3', 'unit': 'tablespoons', 'name': 'extra-virgin olive oil'}, {'quantity': '1', 'unit': '', 'name': 'onion, chopped'}, {'quantity': '8', 'unit': '', 'name': 'mushrooms, halved and sliced'}, {'quantity': '4', 'unit': '', 'name': 'garlic cloves, minced'}, {'quantity': '1', 'unit': '', 'name': 'yam, peeled and cubed'}, {'quantity': '2', 'unit': 'teaspoons', 'name': 'ground cumin'}, {'quantity': '2', 'unit': 'teaspoons', 'name': 'ground coriander'}, {'quantity': '1', 'unit': 'teaspoon', 'name': 'onion (nigella) seeds'}, {'quantity': '1', 'unit': 'teaspoon', 'name': 'black mustard seeds'}, {'quantity': '1', 'unit': 'teaspoon', 'name': 'chile powder'}, {'quantity': '1', 'unit': 'teaspoon', 'name': 'paprika'}, {'quantity': '1', 'unit': 'teaspoon', 'name': 'ground turmeric'}, {'quantity': '½', 'unit': 'head', 'name': 'cauliflower, chopped'}, {'quantity': '1', 'unit': '(15 ounce) can', 'name': 'chickpeas, drained'}, {'quantity': '½', 'unit': 'teaspoon', 'name': 'salt'}, {'quantity': '', 'unit': '', 'name': 'ground black pepper to taste'}, {'quantity': '¾', 'unit': 'cup', 'name': 'vegetable stock'}, {'quantity': '1', 'unit': 'tablespoon', 'name': 'tomato paste'}, {'quantity': '3', 'unit': 'cups', 'name': 'fresh spinach, coarsely chopped'}, {'quantity': '1', 'unit': 'bunch', 'name': 'fresh parsley, finely chopped'}, {'quantity': '1', 'unit': '', 'name': 'lemon, juiced'}, {'quantity': '1', 'unit': '', 'name': 'lime, juiced'}","Heat oil in a large flat-sided skillet over medium heat. Add onion; cook and stir until translucent, about 5 minutes. Add mushrooms and garlic; cook and stir until softened, about 2 minutes. Add yam and cook for 2 minutes.. Stir cumin, coriander, onion seeds, black mustard seeds, chile powder, paprika, and turmeric into the skillet; cook and stir until evenly distributed, about 2 minutes. Add cauliflower, chickpeas, salt, and black pepper; stir until combined.. Mix vegetable stock and tomato paste together in a small bowl; pour into the skillet. Cover and cook until yam is tender, about 15 minutes. Stir in spinach, parsley, lemon juice, and lime juice and cook until flavors combine, about 1 minute.","calories: 387, fat: 13g, carbs: 63g, protein: 11g, servings: 4",https://www.allrecipes.com/thmb/pzFvp9_-SkjnBKgNDjxN7qt_WgY=/1500x0/filters:no_upscale():max_bytes(150000):strip_icc()/3204492-487215a98f784c9da81674e8e67b509a.jpg
Island Yam Bake,https://www.allrecipes.com/recipe/127147/island-yam-bake/,"{'quantity': '2 ½', 'unit': 'pounds', 'name': 'yams, peeled and cubed'}, {'quantity': '1', 'unit': 'cup', 'name': 'pineapple and orange juice blend'}, {'quantity': '2', 'unit': 'tablespoons', 'name': 'softened butter'}, {'quantity': '½', 'unit': 'cup', 'name': '(packed) dark brown sugar'}, {'quantity': '½', 'unit': 'cup', 'name': 'chopped macadamia nuts'}","Place yams into a large pot and cover with salted water. Bring to a boil, then reduce heat to medium-low, cover, and simmer until tender, about 20 minutes. Drain and allow to steam dry for a minute or two.. Preheat oven to 325 degrees F (165 degrees C).. Return yams to the cooking pot, and mash with juice until smooth. Pack mashed yams into a 3 quart casserole dish, dot with butter, then sprinkle with brown sugar and nuts. Loosely cover with aluminum foil.. Bake in preheated oven until hot and bubbly, 35 to 40 minutes.","calories: 321, fat: 10g, carbs: 58g, protein: 3g, servings: 8",https://www.allrecipes.com/thmb/Bf3HZJ0SEgQEEgKP548IM_hCXIU=/1500x0/filters:no_upscale():max_bytes(150000):strip_icc()/922859-0e7411f5ab8a48e192dfa352447b1319.jpg
Pork Steak and Candied Yam Bake,https://www.allrecipes.com/recipe/220308/pork-steak-and-candied-yam-bake/,"{'quantity': '', 'unit': '', 'name': 'cooking spray'}, {'quantity': '6', 'unit': '', 'name': '(1/2 inch thick) boneless pork chops'}, {'quantity': '', 'unit': '', 'name': 'salt and ground black pepper to taste'}, {'quantity': '2', 'unit': 'tablespoons', 'name': 'vegetable oil'}, {'quantity': '6', 'unit': 'tablespoons', 'name': 'brown sugar, not packed'}, {'quantity': '⅔', 'unit': 'cup', 'name': 'butter'}, {'quantity': '1', 'unit': 'cup', 'name': 'apricot preserves'}, {'quantity': '¾', 'unit': 'teaspoon', 'name': 'ground cinnamon'}, {'quantity': '¾', 'unit': 'teaspoon', 'name': 'ground nutmeg'}, {'quantity': '¼', 'unit': 'teaspoon', 'name': 'ground ginger'}, {'quantity': '1 ½', 'unit': 'teaspoons', 'name': 'vanilla extract'}, {'quantity': '¼', 'unit': 'cup', 'name': 'chopped pecans'}, {'quantity': '2', 'unit': '(15 ounce) cans', 'name': 'cut yams, drained (reserve liquid)'}","Preheat the oven to 375 degrees F (190 degrees C).. Line a 9x13-inch baking dish with aluminum foil and spray with cooking spray.. Season pork chops with salt and black pepper.. Heat vegetable oil in a large skillet over medium heat. Cook pork chops until browned on both sides, 7 to 10 minutes. Drain pork chops on a paper towel-lined plate.. Heat brown sugar, butter, apricot preserves, cinnamon, nutmeg, ginger, vanilla extract, and pecans in a saucepan over medium-low heat until sugar has dissolved and sauce is thickened, about 5 minutes. Season with salt and pepper. If sauce because too thick, stir in reserved yam liquid.. Stir in yams until well coated.. Transfer pork chops to the prepared baking dish.. Spoon yam mixture on top of the pork chops.. Bake in the preheated oven until pork chops no longer pink in the center, 30 to 45 minutes. Allow pork chops to rest for 10 minutes before serving.","calories: 694, fat: 35g, carbs: 78g, protein: 20g, servings: 6",https://www.allrecipes.com/thmb/iZ0I5wODLWhKyShpcDKTRqPUxJA=/1500x0/filters:no_upscale():max_bytes(150000):strip_icc()/1051321-3d98a55f4f404cfca7c00bb2ba6d0c92.jpg
Quinoa Salad with Roasted Yams,https://www.allrecipes.com/recipe/254933/quinoa-salad-with-roasted-yams/,"{'quantity': '1 ½', 'unit': 'cups', 'name': 'diced yams'}, {'quantity': '3', 'unit': 'cups', 'name': 'water'}, {'quantity': '2', 'unit': 'cups', 'name': 'quinoa, soaked and rinsed'}, {'quantity': '4', 'unit': '', 'name': 'Persian cucumbers - peeled, trimmed, and cut into 1/4-inch cubes'}, {'quantity': '1', 'unit': 'cup', 'name': 'chopped Italian parsley'}, {'quantity': '¼', 'unit': 'cup', 'name': 'extra-virgin olive oil'}, {'quantity': '¼', 'unit': 'cup', 'name': '1/4-inch cubed onion'}, {'quantity': '1', 'unit': '', 'name': 'lemon, juiced'}, {'quantity': '2', 'unit': 'tablespoons', 'name': 'red wine vinegar'}, {'quantity': '', 'unit': '', 'name': 'salt and ground black pepper to taste'}, {'quantity': '5', 'unit': '', 'name': 'endive spears to garnish (Optional)'}","Preheat oven to 350 degrees F (175 degrees C). Line a baking sheet with aluminum foil; add yams.. Bake in the preheated oven until yams are tender and wrinkled at the edges, about 20 minutes. Cool to room temperature, about 15 minutes. Bring water to a boil in a large saucepan. Add quinoa, stirring once; return to boil. Cook uncovered until water is absorbed, 10 to 12 minutes. Strain, shaking the sieve well to remove all moisture. Transfer to a mixing bowl.. Stir cucumbers, yams, parsley, olive oil, onion, lemon juice, red wine vinegar, salt, and pepper into the quinoa. Garnish with endive spears.","calories: 453, fat: 16g, carbs: 69g, protein: 13g, servings: 5",https://www.allrecipes.com/thmb/3KZGtB-HcSndE-mw5EXBo3FtAYA=/1500x0/filters:no_upscale():max_bytes(150000):strip_icc()/5529247-bf83c5e776e448f7b0f85750d601282b.jpg
Never Kiss a Yammy,https://www.allrecipes.com/recipe/65655/never-kiss-a-yammy/,"{'quantity': '4', 'unit': '', 'name': 'sweet potatoes'}, {'quantity': '½', 'unit': 'cup', 'name': 'orange juice'}, {'quantity': '⅔', 'unit': 'cup', 'name': 'light brown sugar'}, {'quantity': '¼', 'unit': 'cup', 'name': 'margarine, softened'}, {'quantity': '½', 'unit': 'teaspoon', 'name': 'freshly grated orange peel'}, {'quantity': '¼', 'unit': 'teaspoon', 'name': 'ground cinnamon'}","Preheat an oven to 425 degrees F (220 degrees C). Cover a cookie sheet with aluminum foil.. Scrub the sweet potatoes, prick them deeply in several places with a fork, and place them on the lined cookie sheet.. Bake the potatoes in the preheated oven until tender, about 45 minutes. Allow them to cool until they can be handled, about 15 minutes. Scoop out the sweet potato flesh into a large bowl and mash well. Stir in orange juice, brown sugar, margarine, orange peel, and cinnamon. If you prefer the sweet potatoes to be very smooth, you can mix them with an electric mixer. Spread the potatoes in a microwave-safe dish.. Microwave on HIGH until heated through, about 5 minutes.","calories: 510, fat: 12g, carbs: 98g, protein: 6g, servings: 4",https://www.allrecipes.com/thmb/Hz2vpD4TwXm34p7fJtr9k55NcFc=/1500x0/filters:no_upscale():max_bytes(150000):strip_icc()/167972-c0c7afe5646541f3aa4d1e7b2c284c91.jpg
Yummy Candied Yams,https://www.allrecipes.com/recipe/23140/yummy-candied-yams/,"{'quantity': '4', 'unit': '', 'name': 'sweet potatoes, peeled and cubed'}, {'quantity': '½', 'unit': 'cup', 'name': 'water'}, {'quantity': '1', 'unit': 'cup', 'name': 'butter'}, {'quantity': '2', 'unit': 'cups', 'name': 'white sugar'}","In a large pot over medium heat, place potatoes in water. Top with butter and sugar, cover and bring to a boil. Reduce heat to low and simmer, without stirring, until mixture is thick and syrupy, 40 minutes. Mixture will thicken slightly as it cools. Remove from heat and serve warm.","calories: 446, fat: 23g, carbs: 62g, protein: 1g, servings: 8",https://www.allrecipes.com/thmb/2OFXVE0nyIDDYakK29uzHSNZ9uc=/1500x0/filters:no_upscale():max_bytes(150000):strip_icc()/1110431-80d0ea6d4f354f08b4410ec2c07c38fa.jpg
Yam and Turnip Stew with Mini-Biscuits,https://www.allrecipes.com/recipe/216708/yam-and-turnip-stew-with-mini-biscuits/,"{'quantity': '2', 'unit': 'cups', 'name': 'all-purpose flour'}, {'quantity': '1', 'unit': 'teaspoon', 'name': 'baking powder'}, {'quantity': '¼', 'unit': 'cup', 'name': 'margarine'}, {'quantity': '3', 'unit': 'tablespoons', 'name': 'sunflower seeds'}, {'quantity': '2', 'unit': 'tablespoons', 'name': 'grated Parmesan cheese'}, {'quantity': '⅔', 'unit': 'cup', 'name': 'milk, divided'}, {'quantity': '3', 'unit': 'tablespoons', 'name': 'vegetable oil'}, {'quantity': '1', 'unit': '', 'name': 'onion, sliced'}, {'quantity': '2', 'unit': '', 'name': 'carrots, chopped'}, {'quantity': '3', 'unit': '', 'name': 'turnips, chopped'}, {'quantity': '1', 'unit': 'small', 'name': 'yam, peeled and diced'}, {'quantity': '2', 'unit': 'stalks', 'name': 'celery, sliced'}, {'quantity': '2', 'unit': 'cups', 'name': 'chopped broccoli'}, {'quantity': '½', 'unit': 'teaspoon', 'name': 'ground coriander'}, {'quantity': '½', 'unit': 'teaspoon', 'name': 'dried oregano'}, {'quantity': '½', 'unit': 'teaspoon', 'name': 'dried basil'}, {'quantity': '', 'unit': '', 'name': 'salt and ground black pepper to taste'}, {'quantity': '1', 'unit': '(19 ounce) can', 'name': 'diced tomatoes'}, {'quantity': '1', 'unit': 'cup', 'name': 'vegetable broth'}","Preheat an oven to 375 degrees F (190 degrees C).. Whisk the flour and baking powder together in a mixing bowl. Cut the margarine into the flour mixture with a knife or pastry blender until the mixture resembles fine crumbs. Fold the sunflower seeds and Parmesan cheese into the mixture. Add most of the milk and mix to a firm dough.. Turn the dough out onto a lightly floured surface and lightly roll to a thickness of 3/8 inch. Cut into 2-inch rounds and arrange on a baking sheet. Brush the tops of the biscuits with the remaining milk.. Bake in the preheated oven until the biscuits are lightly browned and no longer wet in the middle, about 20 minutes. Set aside.. Heat the oil in a large pot over medium-high heat; cook and stir the onion, carrots, turnips, yam, celery, and broccoli in the hot oil until the vegetables are soft, about 10 minutes. Season with the coriander, oregano, basil, salt, and pepper; add the tomatoes and vegetable broth. Simmer the mixture until hot and the liquid has reduced slightly, about 20 minutes. Serve in bowls topped with the mini-biscuits.","calories: 448, fat: 16g, carbs: 66g, protein: 10g, servings: 6",https://www.allrecipes.com/thmb/zbiZm2dr0zwQxJLLQd2O2zwny6s=/1500x0/filters:no_upscale():max_bytes(150000):strip_icc()/5928011-1173064afa634add8b6a379039a78692.jpg
Gluten-Free Golden Yam Brownies,https://www.allrecipes.com/recipe/213220/gluten-free-golden-yam-brownies/,"{'quantity': '2', 'unit': 'tablespoons', 'name': 'dry egg replacer (such as Ener-G®)'}, {'quantity': '½', 'unit': 'cup', 'name': 'water'}, {'quantity': '1 ½', 'unit': 'cups', 'name': 'sweet rice flour (mochiko)'}, {'quantity': '1 ½', 'unit': 'teaspoons', 'name': 'xanthan gum'}, {'quantity': '1', 'unit': 'teaspoon', 'name': 'baking powder'}, {'quantity': '½', 'unit': 'teaspoon', 'name': 'salt'}, {'quantity': '1', 'unit': 'cup', 'name': 'vegan margarine (such as Earth Balance®)'}, {'quantity': '1', 'unit': 'cup', 'name': 'packed brown sugar'}, {'quantity': '1', 'unit': 'cup', 'name': 'turbinado sugar (such as Sugar in the Raw®)'}, {'quantity': '2', 'unit': 'teaspoons', 'name': 'gluten-free vanilla extract'}, {'quantity': '2', 'unit': 'cups', 'name': 'peeled and finely shredded yam'}, {'quantity': '¾', 'unit': 'cup', 'name': 'turbinado sugar (such as Sugar in the Raw®)'}, {'quantity': '¼', 'unit': 'cup', 'name': 'cornstarch'}, {'quantity': '2', 'unit': 'tablespoons', 'name': 'vegan margarine (such as Earth Balance®), softened'}, {'quantity': '2', 'unit': 'tablespoons', 'name': 'almond milk'}","Preheat an oven to 350 degrees F (175 degrees C). Grease a 9x13-inch baking dish.. Stir the egg replacer and water together in a small bowl until the powder is completely integrated. Stir the rice flour, xanthan gum, baking powder, and salt together in a separate bowl.. Beat 1 cup margarine, brown sugar, and 1 cup turbinado sugar with an electric mixer in a large bowl until light and fluffy. Add the egg replacer about 1/2 cup at a time, allowing each addition to blend into the butter mixture before adding the next. Add the vanilla extract with the last of the egg replacer. Pour the rice flour mixture into the batter, mixing until just incorporated. Fold the shredded yam into the batter, mixing just enough to evenly combine. Pour the batter into prepared pan.. Bake in the preheated oven until a toothpick inserted into the center comes out clean, about 30 minutes.. Stir 3/4 cup turbinado sugar, cornstarch, 2 tablespoons margarine, and almond milk together in a small bowl until smooth. Spread over the brownies while still warm; they will absorb some of the glaze. Serve warm.","calories: 209, fat: 7g, carbs: 37g, protein: 1g, servings: 24",https://cdn.jwplayer.com/v2/media/CcXBXRhx/poster.jpg?width=720
