name,link,ingredients,steps,nutrition
Pineapple Upside Down Cupcakes,https://www.allrecipes.com/recipe/220808/pineapple-upside-down-cupcakes/,"{'quantity': '', 'unit': '', 'name': 'cooking spray'}, {'quantity': '½', 'unit': 'cup', 'name': 'butter, melted'}, {'quantity': '1 ½', 'unit': 'cups', 'name': 'brown sugar'}, {'quantity': '24', 'unit': '', 'name': 'maraschino cherries'}, {'quantity': '1', 'unit': '(20 ounce) can', 'name': 'crushed pineapple'}, {'quantity': '1', 'unit': '(15.25 ounce) package', 'name': 'pineapple cake mix (such as Duncan Hines Pineapple Supreme)'}, {'quantity': '1 ⅓', 'unit': 'cups', 'name': 'pineapple juice'}, {'quantity': '⅓', 'unit': 'cup', 'name': 'vegetable oil'}, {'quantity': '3', 'unit': 'large', 'name': 'eggs'}, {'quantity': '1', 'unit': 'tablespoon', 'name': ""confectioners' sugar for dusting, or as needed""}","Preheat the oven to 350 degrees F (175 degrees C). Move an oven rack to the middle of the oven. Spray 24 muffin cups with cooking spray.. Spoon 1 teaspoon melted butter into the bottom of each sprayed muffin cup. Spoon 1 tablespoon brown sugar into each muffin cup. Press a maraschino cherry into the center of the brown sugar in each muffin cup. Spoon a heaping tablespoon of crushed pineapple on top and compact it with the back of a spoon into an even layer.. Mix pineapple cake mix, pineapple juice, vegetable oil, and eggs in a large bowl with an electric mixer on low speed until moistened, about 30 seconds. Increase speed to medium; mix for 2 minutes.. Pour batter into the muffin cups, filling them to the top; do not overfill.. Bake in the preheated oven until a toothpick inserted into the center of a cupcake comes out clean, about 20 minutes.. Line a work surface with waxed paper. Allow cupcakes to cool at least 5 minutes before inverting muffin cups onto the waxed paper; serve with pineapple and cherry sides up. Sprinkle cupcakes lightly with confectioners' sugar before serving.","calories: 207, fat: 8g, carbs: 33g, protein: 2g, servings: 24"
Strawberry Spinach Salad,https://www.allrecipes.com/recipe/14276/strawberry-spinach-salad-i/,"{'quantity': '½', 'unit': 'cup', 'name': 'white sugar'}, {'quantity': '½', 'unit': 'cup', 'name': 'olive oil'}, {'quantity': '¼', 'unit': 'cup', 'name': 'distilled white vinegar'}, {'quantity': '2', 'unit': 'tablespoons', 'name': 'sesame seeds'}, {'quantity': '1', 'unit': 'tablespoon', 'name': 'poppy seeds'}, {'quantity': '1', 'unit': 'tablespoon', 'name': 'minced onion'}, {'quantity': '¼', 'unit': 'teaspoon', 'name': 'paprika'}, {'quantity': '¼', 'unit': 'teaspoon', 'name': 'Worcestershire sauce'}, {'quantity': '1', 'unit': 'quart', 'name': 'strawberries - cleaned, hulled and sliced'}, {'quantity': '10', 'unit': 'ounces', 'name': 'fresh spinach - rinsed, dried and torn into bite-size pieces'}, {'quantity': '¼', 'unit': 'cup', 'name': 'almonds, blanched and slivered'}","Gather all ingredients.. Make dressing: Whisk together sugar, oil, vinegar, sesame seeds, poppy seeds, onion, paprika, and Worcestershire in a medium bowl. Cover and chill for 1 hour.. Make salad: Combine strawberries, spinach, and almonds in a large bowl.. Pour dressing over salad; toss to coat.. Refrigerate for 10 to 15 minutes before serving.","calories: 491, fat: 35g, carbs: 43g, protein: 6g, servings: 4"
How to Cook a Perfect Ham,https://www.allrecipes.com/article/prepare-the-perfect-ham/,,,
Ham with Pineapple,https://www.allrecipes.com/recipe/45000/ham-with-pineapple/,"{'quantity': '1', 'unit': '(12-pound)', 'name': 'bone-in ham'}, {'quantity': '½', 'unit': 'cup', 'name': 'whole cloves'}, {'quantity': '1', 'unit': '(20 ounce) can', 'name': 'pineapple rings in heavy syrup'}, {'quantity': '1', 'unit': '(12 fluid ounce) can or bottle', 'name': 'lemon-lime flavored carbonated beverage'}, {'quantity': '½', 'unit': 'cup', 'name': 'packed brown sugar'}, {'quantity': '1', 'unit': '(4 ounce) jar', 'name': 'chopped maraschino cherries'}","Preheat the oven to 325 degrees F (160 degrees C).. Place ham in a roasting pan. Use a sharp knife to score ham rind with a diamond pattern. Press a clove into the center of each diamond.. Drain juice from pineapple rings into a medium bowl; stir in lemon-lime soda and brown sugar. Coat ham with juice mixture and arrange pineapple rings on ham. Place a maraschino cherry in the center of each pineapple ring and secure with a toothpick.. Bake uncovered, basting frequently with pan juices, in the preheated oven until the internal temperature of the ham is 160 degrees F (72 degrees C), 4 to 5 hours. Be sure the meat thermometer does not touch the bone. Remove toothpicks before serving.","calories: 586, fat: 36g, carbs: 16g, protein: 47g, servings: 20"
Hard Candy,https://www.allrecipes.com/recipe/35842/hard-candy/,"{'quantity': '', 'unit': '', 'name': 'cooking spray'}, {'quantity': '3 ¾', 'unit': 'cups', 'name': 'white sugar'}, {'quantity': '1 ½', 'unit': 'cups', 'name': 'light corn syrup'}, {'quantity': '1', 'unit': 'cup', 'name': 'water'}, {'quantity': '1', 'unit': 'tablespoon', 'name': 'orange, or other flavored extract'}, {'quantity': '½', 'unit': 'teaspoon', 'name': 'food coloring (Optional)'}, {'quantity': '¼', 'unit': 'cup', 'name': ""confectioners' sugar for dusting""}","Grease a cookie sheet with cooking spray.. Stir white sugar, corn syrup, and water together in a medium saucepan. Cook, stirring, over medium heat until sugar dissolves, then bring to a boil.. Without stirring, heat to 300 to 310 degrees F (149 to 154 degrees C), or until a small amount of syrup dropped into cold water forms hard, brittle threads.. Remove from the heat and stir in flavored extract and food coloring. Pour onto the prepared cookie sheet. Dust top with confectioners' sugar.. Let cool until hardened, about 15 minutes. Break into about 36 pieces and store in an airtight container.","calories: 124, carbs: 32g, servings: 36"
Sautéed Asparagus,https://www.allrecipes.com/recipe/92845/sauteed-garlic-asparagus/,"{'quantity': '3', 'unit': 'tablespoons', 'name': 'butter'}, {'quantity': '1', 'unit': 'bunch', 'name': 'fresh asparagus'}, {'quantity': '3', 'unit': 'cloves', 'name': 'garlic, chopped'}","Gather the ingredients.. Melt butter in a large skillet over medium heat. Add asparagus spears and garlic; cover and cook until asparagus is tender-crisp, about 5 to 10 minutes depending on thickness of asparagus.. If you like your asparagus well done, reduce heat and cook for an additional few minutes.. Serve and enjoy!","calories: 102, fat: 9g, carbs: 5g, protein: 3g, servings: 4"
Strawberry Shortcake,https://www.allrecipes.com/recipe/8201/strawberry-shortcake/,"{'quantity': '6', 'unit': 'cups', 'name': 'fresh strawberries'}, {'quantity': '⅓', 'unit': 'cup', 'name': 'white sugar'}, {'quantity': '2 ¼', 'unit': 'cups', 'name': 'all-purpose flour'}, {'quantity': '¼', 'unit': 'cup', 'name': 'white sugar'}, {'quantity': '1', 'unit': 'tablespoon', 'name': 'baking powder'}, {'quantity': '¼', 'unit': 'teaspoon', 'name': 'salt'}, {'quantity': '½', 'unit': 'cup', 'name': 'butter cold unsalted butter, cut into ½-inch pieces'}, {'quantity': '1', 'unit': 'large', 'name': 'egg, lightly beaten'}, {'quantity': '¾', 'unit': 'cup', 'name': 'half-and-half'}, {'quantity': '2', 'unit': 'teaspoons', 'name': 'vanilla extract, divided'}, {'quantity': '1 ½', 'unit': 'cups', 'name': 'whipped heavy cream'}, {'quantity': '¼', 'unit': 'cup', 'name': 'powdered sugar'}",,"calories: 430, fat: 21g, carbs: 55g, protein: 7g, servings: 8"
Deviled Eggs,https://www.allrecipes.com/recipe/222589/simple-deviled-eggs/,"{'quantity': '6', 'unit': None, 'name': 'hard-boiled eggs'}, {'quantity': '2', 'unit': 'tablespoons', 'name': 'mayonnaise'}, {'quantity': '1', 'unit': 'teaspoon', 'name': 'white sugar, or to taste'}, {'quantity': '1', 'unit': 'teaspoon', 'name': 'white vinegar'}, {'quantity': '1', 'unit': 'teaspoon', 'name': 'prepared mustard'}, {'quantity': '1', 'unit': 'tablespoon', 'name': 'finely chopped onion'}, {'quantity': '1', 'unit': 'tablespoon', 'name': 'finely chopped celery'}, {'quantity': '½', 'unit': 'teaspoon', 'name': 'salt, or to taste'}, {'quantity': '1', 'unit': 'pinch', 'name': 'paprika, or to taste'}",,"calories: 328, fat: 26g, carbs: 5g, protein: 19g, servings: 6"
Asparagus Wrapped in Crisp Prosciutto,https://www.allrecipes.com/recipe/73565/asparagus-wrapped-in-crisp-prosciutto/,"{'quantity': '1', 'unit': 'tablespoon', 'name': 'olive oil'}, {'quantity': '16', 'unit': 'spears', 'name': 'fresh asparagus, trimmed'}, {'quantity': '16', 'unit': 'slices', 'name': 'prosciutto'}","Preheat the oven to 450 degrees F (220 degrees C). Line a baking sheet with aluminum foil, and coat with olive oil.. Wrap one slice of prosciutto around each asparagus spear, starting at the bottom, and spiraling up to the tip. Place the wrapped spears on the prepared baking sheet.. Bake in the preheated oven for 5 minutes. Remove, and shake the pan back and forth to roll the spears over. Return to the oven until asparagus is tender and prosciutto is crisp, another 5 minutes. Serve immediately.","calories: 255, fat: 22g, carbs: 3g, protein: 13g, servings: 4"
