name,link,ingredients,steps,nutrition,image_url
Sopa de Mariscos (Seafood Soup),https://www.allrecipes.com/recipe/272207/sopa-de-mariscos-seafood-soup/,"{'quantity': '2', 'unit': 'tablespoons', 'name': 'olive oil'}, {'quantity': '1', 'unit': 'medium', 'name': 'onion, chopped'}, {'quantity': '2', 'unit': 'cloves', 'name': 'garlic, minced'}, {'quantity': '3', 'unit': '', 'name': 'medium carrots, diced'}, {'quantity': '1', 'unit': 'ear', 'name': 'fresh corn, kernels cut from cob'}, {'quantity': '1', 'unit': 'stalk', 'name': 'celery, halved and diced'}, {'quantity': '6', 'unit': 'cups', 'name': 'chicken stock (such as Swanson®)'}, {'quantity': '1', 'unit': '(10 ounce) can', 'name': 'diced tomatoes with green chile peppers'}, {'quantity': '1', 'unit': '(10 ounce) can', 'name': 'diced tomatoes with green chile peppers, lime, and cilantro (such as RO*TEL®)'}, {'quantity': '1', 'unit': '', 'name': 'ancho chile pepper, diced'}, {'quantity': '1', 'unit': 'tablespoon', 'name': 'chili powder'}, {'quantity': '2', 'unit': 'teaspoons', 'name': 'ground cumin'}, {'quantity': '1', 'unit': 'pound', 'name': 'fresh littleneck clams'}, {'quantity': '1', 'unit': 'pound', 'name': 'fresh mussels'}, {'quantity': '1', 'unit': 'pound', 'name': 'fresh cod, cut into bite-sized pieces'}, {'quantity': '¾', 'unit': 'pound', 'name': 'fresh shrimp, peeled and deveined'}, {'quantity': '¼', 'unit': 'cup', 'name': 'fresh cilantro, chopped, or to taste'}, {'quantity': '1', 'unit': '', 'name': 'avocado, peeled and sliced'}","Heat olive oil in a stockpot over medium heat. Add onion and cook until translucent, 5 to 7 minutes. Add garlic and cook until fragrant, about 1 minute.. Add carrots, corn, and celery and cook until softened, about 5 minutes. Add chicken stock, tomatoes, ancho chili, chili powder, and cumin and bring to a boil. Reduce heat, cover, and simmer for 45 minutes.. Meanwhile, place clams and mussels in a bowl of cold water to filter out sand.. Drain clams and mussels; add to the soup. Stir in cod and shrimp. Cover and boil until cod is white and flaky, mussels and clams are open, and shrimp is pink, 5 to 10 minutes. Serve immediately, topped with cilantro and avocado.","calories: 278, fat: 10g, carbs: 16g, protein: 33g, servings: 10",https://www.allrecipes.com/thmb/NZMJomG1Vy8Je3_jOz7QQSP9rmo=/1500x0/filters:no_upscale():max_bytes(150000):strip_icc()/6443171-sopa-de-mariscos-seafood-soup-Rob-4x3-1-7ca9928bfd2b4a3ebb71d2b03cb2d83b.jpg
Tomato Salsa without Onions,https://www.allrecipes.com/recipe/24247/tomato-salsa-without-onions/,"{'quantity': '1', 'unit': '', 'name': 'poblano pepper'}, {'quantity': '3', 'unit': 'cloves', 'name': 'garlic, peeled'}, {'quantity': '5', 'unit': '', 'name': 'ripe tomatoes'}, {'quantity': '1', 'unit': 'cup', 'name': 'chopped fresh cilantro'}, {'quantity': '½', 'unit': 'teaspoon', 'name': 'ground cumin'}, {'quantity': '1', 'unit': 'teaspoon', 'name': 'chili powder'}, {'quantity': '2', 'unit': 'tablespoons', 'name': 'lime juice'}","Preheat the oven's broiler.. Place poblano pepper and garlic cloves on a medium baking sheet. Turning pepper frequently, broil at maximum distance from heat until browned, about 15 minutes.. In a food processor, place roasted pepper, roasted garlic, tomatoes, cilantro, cumin, chili powder, and lime juice. Process using pulse setting until an evenly chunky texture is obtained. Chill until serving.","calories: 7, fat: 0g, carbs: 2g, protein: 0g, servings: 24",https://www.allrecipes.com/thmb/ht_4usM4iKouCoCElef4P2QBq7c=/1500x0/filters:no_upscale():max_bytes(150000):strip_icc()/1850211-1363b672b981477cbad386cc67d4fc99.jpg
Chili Lime Chicken,https://www.allrecipes.com/recipe/273685/chili-lime-chicken/,"{'quantity': '¼', 'unit': 'cup', 'name': 'ancho chile powder'}, {'quantity': '1', 'unit': 'tablespoon', 'name': 'salt'}, {'quantity': '1', 'unit': 'tablespoon', 'name': 'garlic powder'}, {'quantity': '1', 'unit': 'tablespoon', 'name': 'onion powder'}, {'quantity': '½', 'unit': 'teaspoon', 'name': 'ground cumin'}, {'quantity': '½', 'unit': 'teaspoon', 'name': 'chipotle chile powder'}, {'quantity': '⅔', 'unit': 'cup', 'name': 'canola oil, or more as needed'}, {'quantity': '1', 'unit': 'large', 'name': 'lime, juiced'}, {'quantity': '8', 'unit': '', 'name': 'skinless, boneless chicken breast halves'}","Combine ancho chile powder, salt, garlic powder, onion powder, cumin, and chipotle powder in a medium glass or ceramic bowl. Whisk in canola oil and lime juice until well-combined; thin with additional canola oil if mixture seems too thick.. Arrange chicken in a glass or ceramic baking dish; pour marinade over chicken, covering it completely. Marinate in the refrigerator for 3 hours.. Preheat the oven to 400 degrees F (200 degrees C). Line a baking sheet with aluminum foil.. Arrange chicken on the baking sheet; do not crowd. Discard any excess marinade.. Bake in the preheated oven until chicken is no longer pink in the centers, about 30 minutes. An instant-read thermometer inserted into the center should read at least 165 degrees F (74 degrees C). Remove from the oven and let stand for 5 to 6 minutes.","calories: 301, fat: 22g, carbs: 3g, protein: 24g, servings: 8",https://www.allrecipes.com/thmb/7JqphAAYnxq_Y70osMMi-_l6bNs=/1500x0/filters:no_upscale():max_bytes(150000):strip_icc()/6680450-chili-lime-chicken-SunnyDaysNora-4x3-1-c8831d6a15d844509dd2e063831bbd5c.jpg
Tex-Mex Enchiladas,https://www.allrecipes.com/recipe/216898/tex-mex-enchiladas/,"{'quantity': '2', 'unit': '(11.25 ounce) cans', 'name': 'chili without beans'}, {'quantity': '1', 'unit': 'cup', 'name': 'enchilada sauce'}, {'quantity': '½', 'unit': 'cup', 'name': 'vegetable oil'}, {'quantity': '1', 'unit': 'tablespoon', 'name': 'chili powder'}, {'quantity': '15', 'unit': 'medium', 'name': 'corn tortillas'}, {'quantity': '1', 'unit': 'pound', 'name': 'shredded Cheddar cheese'}, {'quantity': '1', 'unit': None, 'name': 'onion, chopped'}","Preheat the oven to 350 degrees F (175 degrees C).. Combine chili and enchilada sauce in a small saucepan over medium-low heat. Bring to a simmer, stirring occasionally. Set aside.. Meanwhile, heat vegetable oil and chili powder in a small skillet over medium heat. Fry one tortilla until it starts to puff. Remove with a spatula and place on a plate. Immediately sprinkle about 1/4 cup cheese and 1 tablespoon onion down center of tortilla. Roll tortilla tightly around mixture and transfer, seam-side down, to a 9x13-inch baking dish. Repeat with remaining tortillas.. Sprinkle about 2/3 of remaining cheese over rolled enchiladas. Pour warm chili mixture evenly over enchiladas. Scatter remaining cheese over chili mixture.. Bake in the preheated oven until the cheese is bubbling, 20 to 25 minutes.","calories: 933, fat: 59g, carbs: 69g, protein: 35g, servings: 5",https://www.allrecipes.com/thmb/Pi8rZf4-01JEgW5A0U6_IhfUhVs=/1500x0/filters:no_upscale():max_bytes(150000):strip_icc()/8062237-b3231a095c634cd69527fcceef5f3ce1.jpg
Easy Enchilada Casserole,https://www.allrecipes.com/recipe/8969/easy-enchilada-casserole/,"{'quantity': '1', 'unit': '(10.5 ounce) can', 'name': 'condensed cream of chicken soup'}, {'quantity': '4', 'unit': '', 'name': 'cooked skinless, boneless chicken breast halves, chopped'}, {'quantity': '8', 'unit': 'ounces', 'name': 'sour cream'}, {'quantity': '½', 'unit': 'cup', 'name': 'chopped green onions'}, {'quantity': '3', 'unit': 'cups', 'name': 'salsa'}, {'quantity': '1', 'unit': '(4 ounce) can', 'name': 'diced green chiles'}, {'quantity': '4', 'unit': 'cups', 'name': 'shredded Monterey Jack cheese'}, {'quantity': '12', 'unit': '(8 inch)', 'name': 'flour tortillas'}","Preheat the oven to 350 degrees F (175 degrees C). Lightly grease a 9x13-inch baking dish.. In a medium bowl combine soup, chicken, sour cream, and green onions. Mix together. In another small bowl, combine salsa and green chile peppers; mix.. Cover the bottom of the baking dish with 4 tortillas. Add 1/2 of chicken mixture, 1/2 of salsa mixture, and 1 1/2 cups of shredded cheese. Repeat layers. Add another layer of 4 tortillas and top with remaining cup of cheese.. Cover and bake in the preheated oven for 55 minutes. Uncover and bake for an additional 5 minutes, until cheese is melted on top. Let stand for 5 minutes before cutting.","calories: 576, fat: 29g, carbs: 47g, protein: 33g, servings: 9",https://www.allrecipes.com/thmb/ojY_yKdHp-agh3KgfRkn3bDZxE0=/1500x0/filters:no_upscale():max_bytes(150000):strip_icc()/8464548-ece408c2981e41d39d1fef563ca855cb.jpg
Buffalo Chicken Chili,https://www.allrecipes.com/recipe/186699/buffalo-chicken-chili/,"{'quantity': '1', 'unit': 'tablespoon', 'name': 'extra-virgin olive oil'}, {'quantity': '2', 'unit': 'tablespoons', 'name': 'butter'}, {'quantity': '2', 'unit': 'pounds', 'name': 'ground chicken breast'}, {'quantity': '1', 'unit': 'large', 'name': 'carrot, peeled and finely chopped'}, {'quantity': '1', 'unit': 'large', 'name': 'onion, chopped'}, {'quantity': '3', 'unit': 'stalks', 'name': 'celery, finely chopped'}, {'quantity': '5', 'unit': 'cloves', 'name': 'garlic, chopped'}, {'quantity': '5', 'unit': 'tablespoons', 'name': 'chili powder'}, {'quantity': '2', 'unit': 'tablespoons', 'name': 'ground cumin'}, {'quantity': '1', 'unit': 'tablespoon', 'name': 'ground paprika'}, {'quantity': '', 'unit': '', 'name': 'salt and pepper to taste'}, {'quantity': '½', 'unit': 'cup', 'name': ""hot buffalo wing sauce (such as Frank's® REDHOT Buffalo Wing Sauce), or to taste""}, {'quantity': '2', 'unit': '(15 ounce) cans', 'name': 'tomato sauce'}, {'quantity': '1', 'unit': '(15 ounce) can', 'name': 'crushed tomatoes'}, {'quantity': '1', 'unit': '(15 ounce) can', 'name': 'white kidney or cannellini beans, drained'}, {'quantity': '1', 'unit': '(19 ounce) can', 'name': 'red kidney beans, drained'}","Heat olive oil and butter in a large pot over medium-high heat. Place chicken in the pot. Cook and stir until chicken is no longer pink, 7 to 10 minutes.. Stir in carrot, onion, celery, garlic, chili powder, cumin, paprika, salt, and pepper. Cook and stir until onion is translucent and carrots begin to soften, 3 to 4 more minutes.. Stir in hot sauce, tomato sauce, crushed tomatoes, and white and red kidney beans. Bring to a boil, then simmer over medium-low heat until vegetables are tender and flavors have blended, about 1 hour.","calories: 301, fat: 9g, carbs: 30g, protein: 28g, servings: 10",https://www.allrecipes.com/thmb/RR4cnk4gtdReg09L7iqUnNV3Lqg=/1500x0/filters:no_upscale():max_bytes(150000):strip_icc()/786416-d076087dab3943b7a0cfb993622a5b39.jpg
Burrito Casserole,https://www.allrecipes.com/recipe/269476/burrito-casserole/,"{'quantity': '', 'unit': '', 'name': 'cooking spray'}, {'quantity': '2', 'unit': 'tablespoons', 'name': 'olive oil'}, {'quantity': '½', 'unit': 'large', 'name': 'yellow onion, chopped'}, {'quantity': '1', 'unit': 'pound', 'name': 'ground beef'}, {'quantity': '1', 'unit': '(16 ounce) can', 'name': 'refried beans'}, {'quantity': '1', 'unit': '(1 ounce) package', 'name': 'burrito seasoning'}, {'quantity': '1', 'unit': '(10.5 ounce) can', 'name': 'condensed cream of mushroom soup'}, {'quantity': '4', 'unit': 'ounces', 'name': 'sour cream'}, {'quantity': '1', 'unit': '(14.5 ounce) package', 'name': 'tortilla chips'}, {'quantity': '2 ½', 'unit': 'cups', 'name': 'shredded Mexican cheese blend'}, {'quantity': '1', 'unit': '(8 ounce) jar', 'name': 'mild or hot salsa'}","Gather the ingredients. Preheat the oven to 350 degrees F (175 degrees C). Coat a casserole dish with cooking spray.. Heat olive oil in a large skillet over medium heat. Cook and stir onion in hot oil until translucent, 3 to 5 minutes. Add beef and increase heat to medium-high. Cook and stir until beef is browned and crumbly, 5 to 7 minutes. Drain and discard grease.. Mix together refried beans and burrito seasoning in a large bowl; add to beef mixture in the skillet and stir until well combined.. Mix together condensed soup and sour cream in a medium bowl.. Place a layer of tortilla chips into the prepared casserole dish to just cover the bottom, followed by 1/2 of the meat mixture, 1/2 of the soup mixture, 1 cup cheese, and 1/2 of the salsa. Repeat layers once more, then top with remaining cheese.. Bake in the preheated oven, uncovered, until hot and bubbly, 20 to 30 minutes.","calories: 454, fat: 26g, carbs: 34g, protein: 21g, servings: 12",https://www.allrecipes.com/thmb/oUcilyiYigUpT0zUz5_9u_DPOG4=/1500x0/filters:no_upscale():max_bytes(150000):strip_icc()/ALR-recipe-269476-burrito-casserole-hero-01-ddmfs-4x3-a3d31af15f91471483db43df5b64921c.jpg
Mild Cheesy Chicken Enchiladas,https://www.allrecipes.com/recipe/15604/mild-cheesy-chicken-enchiladas/,"{'quantity': '4', 'unit': 'cups', 'name': 'shredded Cheddar cheese, divided'}, {'quantity': '1', 'unit': 'cup', 'name': 'sour cream, divided'}, {'quantity': '2', 'unit': 'cups', 'name': 'cubed, cooked chicken'}, {'quantity': '¼', 'unit': 'cup', 'name': 'chopped onion'}, {'quantity': '8', 'unit': '(8 inch)', 'name': 'flour tortillas'}, {'quantity': '1 ½', 'unit': 'cups', 'name': 'chopped tomatoes'}, {'quantity': '½', 'unit': 'cup', 'name': 'black olives'}","Preheat the oven to 350 degrees F (175 degrees C). Lightly grease a 9x13-inch baking dish.. Combine 3 cups Cheddar cheese and 1/4 cup sour cream in a saucepan over low heat. Cook, stirring occasionally, until melted.. Meanwhile, mix chicken, remaining 1 cup Cheddar cheese, remaining 3/4 cup sour cream, and onion in a medium bowl until well combined.. Arrange tortillas on a large, flat work surface. Divide chicken mixture evenly among tortillas, then roll tortillas up over the filling. Arrange in a single layer in the prepared baking dish. Pour cheese sauce over enchiladas, then top with tomatoes and olives.. Bake in the preheated oven until hot and bubbly, 20 to 30 minutes.","calories: 520, fat: 31g, carbs: 32g, protein: 29g, servings: 8",https://www.allrecipes.com/thmb/DuKNdIFSdvp9suPmddByi1f-PgM=/1500x0/filters:no_upscale():max_bytes(150000):strip_icc()/418239-705696c3bcd34ae889d5619830c65193.jpg
Easy King Ranch Chicken Casserole,https://www.allrecipes.com/recipe/8721/king-ranch-chicken-casserole-iii/,"{'quantity': '2', 'unit': 'cups', 'name': 'chicken broth'}, {'quantity': '1', 'unit': '(10.5 ounce) can', 'name': 'condensed cream of chicken soup'}, {'quantity': '1', 'unit': '(10.5 ounce) can', 'name': 'condensed cream of mushroom soup'}, {'quantity': '1', 'unit': '(10 ounce) can', 'name': 'diced tomatoes with green chile peppers'}, {'quantity': '1', 'unit': '(12 ounce) package', 'name': 'corn tortillas'}, {'quantity': '3', 'unit': 'cups', 'name': 'diced, cooked chicken breast'}, {'quantity': '1', 'unit': '', 'name': 'onion, chopped'}, {'quantity': '1', 'unit': '', 'name': 'green bell pepper, chopped'}, {'quantity': '8', 'unit': 'ounces', 'name': 'shredded Cheddar cheese'}, {'quantity': '1 ½', 'unit': 'teaspoons', 'name': 'chili powder'}, {'quantity': '1', 'unit': 'teaspoon', 'name': 'garlic salt'}","Preheat the oven to 350 degrees F (175 degrees C). Lightly grease a shallow 3-quart casserole dish.. Combine broth, chicken soup, mushroom soup, and tomatoes with chiles in a large bowl; set aside.. Layer 1/2 each of tortillas, chicken, onion, bell pepper, and cheese in the prepared casserole dish. Pour 1/2 the soup mixture over layers. Repeat layers with remaining 1/2 each tortillas, chicken, onion, and bell pepper; pour remaining 1/2 soup mixture over top, then top with remaining 1/2 cheese. Sprinkle with chili powder and garlic salt.. Bake in the preheated oven for 30 to 45 minutes.","calories: 375, fat: 17g, carbs: 28g, protein: 28g, servings: 8",https://www.allrecipes.com/thmb/rGo6_6_umrx3SjivbNUjZOJcdMM=/1500x0/filters:no_upscale():max_bytes(150000):strip_icc()/8721easyking-ranch-chicken-casserole-iiiYoly4x3-00b7764369314fff8660b29d0b47f0cb.jpg
Tex-Mex Beef and Cheese Enchiladas,https://www.allrecipes.com/recipe/71436/tex-mex-beef-and-cheese-enchiladas/,"{'quantity': '2', 'unit': 'pounds', 'name': 'ground beef'}, {'quantity': '3', 'unit': 'tablespoons', 'name': 'chili powder'}, {'quantity': '2', 'unit': 'tablespoons', 'name': 'paprika'}, {'quantity': '1', 'unit': 'tablespoon', 'name': 'ground cumin'}, {'quantity': '1', 'unit': 'tablespoon', 'name': 'garlic powder'}, {'quantity': '1', 'unit': 'teaspoon', 'name': 'salt'}, {'quantity': '1', 'unit': '(8 ounce) can', 'name': 'tomato sauce'}, {'quantity': '4', 'unit': 'cups', 'name': 'water'}, {'quantity': '½', 'unit': 'cup', 'name': 'all-purpose flour, divided'}, {'quantity': '1 ½', 'unit': 'teaspoons', 'name': 'sugar'}, {'quantity': '2', 'unit': 'tablespoons', 'name': 'cooking oil'}, {'quantity': '12', 'unit': '(6 inch)', 'name': 'corn tortillas'}, {'quantity': '4', 'unit': 'cups', 'name': 'shredded American cheese'}","Preheat the oven to 350 degrees F (175 degrees C).. Heat ground beef in a large skillet over medium heat. Cook, stirring to crumble, until no longer pink. Drain off grease and season with chili powder, paprika, cumin, garlic powder, and salt. Mix in tomato sauce and 2 cups water. Simmer over low heat.. Mix remaining water with flour and sugar until flour is dissolved; stir into the simmering meat sauce. Simmer until thickened, about 10 minutes.. While the sauce is cooking, heat oil in another skillet over medium-high heat. Warm tortillas in hot oil until pliable. Fill each tortilla with a little bit of cheese, and place in a 9x13-inch baking dish, reserving some of the cheese to sprinkle on top. Pour meat sauce evenly over the rolled tortillas. Top with remaining cheese.. Bake for 25 minutes in the preheated oven, until cheese is melted and lightly browned.","calories: 794, fat: 49g, carbs: 40g, protein: 47g, servings: 6",https://www.allrecipes.com/thmb/bQMPGhmfJrTekFuIvONvRq6_-so=/1500x0/filters:no_upscale():max_bytes(150000):strip_icc()/71436tex-mex-beef-and-cheese-enchiladasMyHotSouthernMess4x3-3067c1e6229949bba97e4b3481a23756.jpg
Tex-Mex Chicken Casserole,https://www.allrecipes.com/recipe/233686/tex-mex-chicken-casserole/,"{'quantity': '1', 'unit': '(10 ounce) bag', 'name': 'nacho cheese-flavored corn chips (such as Doritos), crushed into crumbs'}, {'quantity': '1', 'unit': 'tablespoon', 'name': 'unsalted butter'}, {'quantity': '1', 'unit': 'small', 'name': 'onion, finely chopped'}, {'quantity': '1', 'unit': '(14.5 ounce) can', 'name': 'diced tomatoes'}, {'quantity': '1', 'unit': '(10.5 ounce) can', 'name': 'condensed cream of chicken soup'}, {'quantity': '1', 'unit': '(10.5 ounce) can', 'name': 'cream of mushroom soup'}, {'quantity': '1', 'unit': '(4.5 ounce) can', 'name': 'chopped green chiles'}, {'quantity': '⅓', 'unit': 'cup', 'name': 'milk'}, {'quantity': '2', 'unit': 'tablespoons', 'name': 'sour cream'}, {'quantity': '1', 'unit': 'teaspoon', 'name': 'chili powder'}, {'quantity': '1', 'unit': 'teaspoon', 'name': 'ground cumin'}, {'quantity': '2 ½', 'unit': 'cups', 'name': 'chopped cooked chicken'}, {'quantity': '1', 'unit': '(8 ounce) package', 'name': 'shredded sharp Cheddar cheese'}","Preheat the oven to 350 degrees F (175 degrees C). Lightly grease a 9x13-inch baking dish.. Spread corn chip crumbs over bottom of the baking dish; press crumbs into place.. Melt butter in a large skillet over medium-high heat. Add onion; cook and stir until tender, 6 to 7 minutes.. Combine diced tomatoes, cream of chicken soup. cream of mushroom soup, green chiles, milk, sour cream, chili powder, and cumin in a large bowl. Stir in chicken and onion to combine; pour over corn chips. Top with Cheddar cheese.. Bake in the preheated oven until bubbly and cheese is melted, 55 to 60 minutes. Let stand for 10 minutes before serving.","calories: 480, fat: 30g, carbs: 31g, protein: 24g, servings: 8",https://www.allrecipes.com/thmb/HOrAQam1tno3cyRt3puxlHPLPjs=/1500x0/filters:no_upscale():max_bytes(150000):strip_icc()/1978691-3a7ad322740744cdb9c7f6da5c661fc0.jpg
Tex-Mex Burger with Cajun Mayo,https://www.allrecipes.com/recipe/75290/tex-mex-burger-with-cajun-mayo/,"{'quantity': '½', 'unit': 'cup', 'name': 'mayonnaise'}, {'quantity': '4', 'unit': '4 teaspoons', 'name': 'Cajun seasoning, divided'}, {'quantity': '1 ⅓', 'unit': 'pounds', 'name': 'ground beef sirloin'}, {'quantity': '1', 'unit': None, 'name': 'jalapeño pepper, seeded and chopped'}, {'quantity': '½', 'unit': 'cup', 'name': 'diced white onion'}, {'quantity': '1', 'unit': 'clove', 'name': 'garlic, minced'}, {'quantity': '1', 'unit': 'teaspoon', 'name': 'Worcestershire sauce'}, {'quantity': '4', 'unit': 'slices', 'name': 'pepperjack cheese'}, {'quantity': '4', 'unit': None, 'name': 'hamburger buns, split'}, {'quantity': '4', 'unit': 'leaves', 'name': 'lettuce'}, {'quantity': '4', 'unit': 'slices', 'name': 'tomato'}","Preheat the grill for medium-high heat.. Mix mayonnaise and 1 teaspoon Cajun seasoning together in a small bowl. Set aside.. Mix ground sirloin, jalapeño, onion, garlic, remaining 3 teaspoons Cajun seasoning, and Worcestershire sauce together in a large bowl. Divide into 4 balls, and flatten into patties.. Lightly oil the grill. Grill burgers until an instant-read thermometer inserted into the thickest part of burgers reaches at least 165 degrees F (74 degrees C), about 5 minutes per side. During the last 2 minutes of grilling, top each burger with cheese slices.. Spread mayo on buns, add burgers, lettuce, and tomatoes, and serve.","calories: 714, fat: 49g, carbs: 29g, protein: 38g, servings: 4",https://www.allrecipes.com/thmb/U0BaeBD_CIoVp9hblxhGGb309js=/1500x0/filters:no_upscale():max_bytes(150000):strip_icc()/379901-06eae14ee9ad42dbae9d3bc5dcfec2e9.jpg
Spicy Tex-Mex Salad,https://www.allrecipes.com/recipe/14270/spicy-tex-mex-salad/,"{'quantity': '1', 'unit': '(15 ounce) can', 'name': 'pinto beans, drained and rinsed'}, {'quantity': '1', 'unit': '(15 ounce) can', 'name': 'black beans, rinsed and drained'}, {'quantity': '3', 'unit': '', 'name': 'tomatoes, chopped'}, {'quantity': '1 ½', 'unit': 'cups', 'name': 'shredded Cheddar and Monterey cheese blend'}, {'quantity': '1', 'unit': '(10 ounce) package', 'name': 'chopped romaine lettuce'}, {'quantity': '1', 'unit': '(16 ounce) bottle', 'name': 'Catalina salad dressing'}, {'quantity': '1', 'unit': '(16 ounce) package', 'name': 'corn chips'}","In a large bowl, combine pinto beans, black beans, tomatoes, cheese blend, and lettuce. Add 3/4 of the dressing and mix well. Add corn chips before serving.","calories: 542, fat: 33g, carbs: 53g, protein: 11g, servings: 10",https://www.allrecipes.com/thmb/zkx2Aa6f7BfL2D-iHyDY5_uMCL8=/1500x0/filters:no_upscale():max_bytes(150000):strip_icc()/2988348-25033348ee41427e8cf29bcd5e5f8416.jpg
Brown Spanish Rice,https://www.allrecipes.com/recipe/222050/brown-spanish-rice/,"{'quantity': '1', 'unit': '(15 ounce) can', 'name': 'diced tomatoes with green chile peppers'}, {'quantity': '1', 'unit': '(14 ounce) can', 'name': 'chicken broth'}, {'quantity': '1', 'unit': 'teaspoon', 'name': 'salt'}, {'quantity': '1', 'unit': 'cup', 'name': 'brown rice'}","Bring diced tomatoes, chicken broth, and salt to a boil in a medium saucepan. Add rice. Cover, reduce the heat to medium-low, and simmer until rice is cooked and liquid is absorbed, about 1 hour. Stir before serving.","calories: 156, fat: 1g, carbs: 32g, protein: 4g, servings: 6",https://www.allrecipes.com/thmb/mRhNqm4x2bid2Pb7bh8XHTLscX8=/1500x0/filters:no_upscale():max_bytes(150000):strip_icc()/9200640-7b437748042b46abba35acc27222f5a9.jpg
Chef John's Best Mexican Recipes,https://www.allrecipes.com/gallery/chef-johns-best-mexican-recipes/,,,,https://www.allrecipes.com/thmb/JWMuFRmCGUIyNcREQVKMwwfuKT8=/1500x0/filters:no_upscale():max_bytes(150000):strip_icc()/8671830_beef-birria_chef-john-2000-a7de5d753aa14bd3a8c1c91ff2ddf6f4.jpg
What's the Difference Between Mexican Cuisine and Tex Mex?,https://www.allrecipes.com/article/mexican-vs-tex-mex/,,,,https://www.allrecipes.com/thmb/iSf-VWA6DordSuQFsezS9kBKues=/1500x0/filters:no_upscale():max_bytes(150000):strip_icc()/101073275-steak-fajitas-meredith-78cbffdd94014d88831a5504ddfdb1ad.jpg
