name,link,ingredients,steps,nutrition,image_url
Tex-Mex Ground Beef and Potato Skillet,https://www.allrecipes.com/tex-mex-ground-beef-and-potato-skillet-recipe-8738717,"{'quantity': '1', 'unit': 'pound', 'name': 'ground beef'}, {'quantity': '2', 'unit': 'pounds', 'name': 'hash brown potatoes'}, {'quantity': '1', 'unit': 'cup', 'name': 'corn kernels'}, {'quantity': '1', 'unit': None, 'name': 'zucchini'}, {'quantity': '1', 'unit': 'cup', 'name': 'beef broth'}, {'quantity': '1', 'unit': '(10 ounce) can', 'name': 'diced tomatoes and green chilies, (such as Ro-Tel® Original)'}, {'quantity': '1', 'unit': 'tablespoon', 'name': 'taco seasoning, mild or hot'}, {'quantity': '2', 'unit': 'teaspoons', 'name': 'ground cumin'}, {'quantity': None, 'unit': None, 'name': 'salt and freshly ground black pepper to taste'}, {'quantity': '1 1/2', 'unit': 'cups', 'name': 'shredded Cheddar cheese'}, {'quantity': '1/2', 'unit': 'cup', 'name': 'sour cream'}, {'quantity': '3', 'unit': None, 'name': 'green onions, sliced'}","Heat a large skillet over medium heat. Cook and stir ground beef, breaking up the pieces as it cooks, until browned and crumbly. 3 to 5 minutes. Drain off excess fat.. Add potatoes, corn, zucchini, beef broth, RO-TEL, taco seasoning, and cumin. Season with salt and pepper. Bring to a boil, cover, reduce heat, and simmer until vegetables are tender, 20 to 25 minutes. Taste and adjust seasonings.. Stir in Cheddar, and allow to melt. Remove from heat. Garnish with dollops of sour cream and sliced green onions, and serve immediately.","calories: 938, fat: 59g, carbs: 65g, protein: 40g, servings: 5",https://www.allrecipes.com/thmb/oF7uJAUNHxlmVt_imfHokcsppZk=/1500x0/filters:no_upscale():max_bytes(150000):strip_icc()/8738717_Tex-Mex-Ground-Beef-and-Potato-Skillet_Brenda-Venable_4x3-4125f411da9f44378e66561c1ed3aaf6.jpg
12 Copycat Chipotle Recipes to Make At Home,https://www.allrecipes.com/copycat-chipotle-recipes-8696397,,,,https://www.allrecipes.com/thmb/w2WekH0XGb0pxsj0qAXwvFdSwR0=/1500x0/filters:no_upscale():max_bytes(150000):strip_icc()/14041-delicious-black-bean-burritos-ddmfs-3x2-008-7fbf871b145f4f35a45650ee903fce73.jpg
Loaded Beef Nachos,https://www.allrecipes.com/loaded-beef-nachos-recipe-7489045,"{'quantity': '5', 'unit': 'teaspoons', 'name': 'paprika'}, {'quantity': '1 1/4', 'unit': 'teaspoons', 'name': 'garlic powder'}, {'quantity': '1 1/4', 'unit': 'teaspoons', 'name': 'ground cumin'}, {'quantity': '1 1/4', 'unit': 'teaspoons', 'name': 'onion powder'}, {'quantity': '1', 'unit': 'teaspoon', 'name': 'chili powder'}, {'quantity': '1', 'unit': 'teaspoon', 'name': 'oregano leaves'}, {'quantity': '1 1/2', 'unit': 'teaspoons', 'name': 'salt'}, {'quantity': '2', 'unit': 'tablespoons', 'name': 'vegetable oil'}, {'quantity': '1', 'unit': 'pound', 'name': 'ground beef'}, {'quantity': '1', 'unit': 'cup', 'name': 'onion'}, {'quantity': '1', 'unit': 'cup', 'name': 'green bell pepper'}, {'quantity': '1', 'unit': '10 ounce) can', 'name': 'diced tomatoes with green chiles (such as'}, {'quantity': '1', 'unit': '(15 ounce) can Mexican-style', 'name': 'corn (optional)'}, {'quantity': '1', 'unit': 'can', 'name': 'refried beans'}, {'quantity': '1', 'unit': 'cup', 'name': 'shredded Cheddar cheese, or as needed'}, {'quantity': '4', 'unit': 'ounces', 'name': 'tortilla chips, or as needed'}, {'quantity': None, 'unit': None, 'name': '1/2 cup sour cream (optional)'}, {'quantity': '1/2', 'unit': 'cup', 'name': 'salsa (optional)'}, {'quantity': '1/4', 'unit': 'cup', 'name': 'black olives (optional)'}, {'quantity': '1/4', 'unit': 'cup sliced', 'name': 'jalapenos (optional)'}, {'quantity': '1/4', 'unit': 'cup', 'name': 'green onion'}","For taco seasoning, stir paprika, garlic powder, cumin, onion powder, chili powder, oregano, and salt together in a small bowl; set aside.. Heat oil in a large skillet over medium-high heat; cook and stir ground beef in the hot skillet until browned and crumbly, 5 to 7 minutes. Stir in onion and green pepper; cook and stir with oil and juices from browned meat until much of the liquid has evaporated, about 2 minutes more.. Stir 1/2 can diced tomatoes with chilies and Mexican-style corn into skillet. Season beef mixture to taste with prepared taco seasoning mix.. Stir together the remaining 1/2 can diced tomatoes with chilies and refried beans in a microwave-safe bowl. Microwave on High until heated through, stirring every 30 seconds, 1 to 3 minutes.. To assemble nachos, lay half of tortilla chips in a single layer on a microwave-safe plate, then drop teaspoons of refried beans onto chips, followed by meat mixture and shredded cheese. Repeat with remaining chips, beans, meat, and cheese to make a second layer.. Microwave on High until cheese is melted and nachos are warm, 2 to 3 minutes. Top with sour cream, salsa, olives, jalapenos, and green onion as desired.","calories: 817, fat: 46g, carbs: 56g, protein: 48g, servings: 4",https://www.allrecipes.com/thmb/wGUnIfJKpAeYrdLL-qCsFDMUBXU=/1500x0/filters:no_upscale():max_bytes(150000):strip_icc()/7489045loaded-beef-nachos-recipe-lutzflcat4x3-6c7ba4f55c514056894c920446cfd0b2.jpg
Instant Pot Salsa Chicken,https://www.allrecipes.com/recipe/260193/instant-pot-salsa-chicken/,"{'quantity': '1', 'unit': 'pound', 'name': 'frozen skinless, boneless chicken breast halves'}, {'quantity': '1', 'unit': '(1 ounce) packet', 'name': 'taco seasoning mix'}, {'quantity': '½', 'unit': 'cup', 'name': 'salsa'}, {'quantity': '½', 'unit': 'cup', 'name': 'low-sodium chicken broth'}","Place chicken breasts in a multi-functional cooker (such as Instant Pot). Sprinkle all sides with taco seasoning. Pour salsa and chicken broth on top.. Close and lock the lid. Select Poultry setting; set the timer for 15 minutes. Allow 10 to 15 minutes for pressure to build.. Release pressure using the natural-release method according to manufacturer's instructions, about 20 minutes. Unlock and remove the lid.. Shred chicken and serve as desired.","calories: 300, fat: 5g, carbs: 14g, protein: 46g, servings: 2",https://cdn.jwplayer.com/v2/media/Kib0jH77/poster.jpg?width=720
10 Best Burrito Recipes,https://www.allrecipes.com/article/our-best-burrito-recipes/,,,,
Spinach Quiche with Chicken,https://www.allrecipes.com/recipe/228592/spinach-quiche-with-chicken/,"{'quantity': '1', 'unit': 'cup', 'name': 'shredded Cheddar cheese'}, {'quantity': '1', 'unit': '(9 inch)', 'name': 'unbaked pastry shell'}, {'quantity': '1', 'unit': 'cup', 'name': 'diced cooked chicken'}, {'quantity': '1', 'unit': 'cup', 'name': 'chopped fresh spinach'}, {'quantity': '½', 'unit': 'cup', 'name': 'chopped sweet onion (such as Vidalia®)'}, {'quantity': '3', 'unit': 'large', 'name': 'eggs'}, {'quantity': '¾', 'unit': 'cup', 'name': 'half-and-half'}, {'quantity': '½', 'unit': 'cup', 'name': 'mayonnaise'}, {'quantity': '¼', 'unit': 'teaspoon', 'name': 'salt'}, {'quantity': '⅛', 'unit': 'teaspoon', 'name': 'ground black pepper'}, {'quantity': '1', 'unit': 'pinch', 'name': 'salt-free seasoning blend (such as Mrs. Dash), or to taste'}, {'quantity': '1', 'unit': 'pinch', 'name': 'herbes de Provence, or to taste'}","Preheat the oven to 350 degrees F (175 degrees C).. Sprinkle 1/4 cup Cheddar cheese into pastry shell. Mix together chicken, spinach, remaining 3/4 cup Cheddar cheese, and onion in a medium bowl; transfer mixture to pastry shell.. Whisk together eggs, half-and-half, mayonnaise, salt, black pepper, seasoning blend, and herbes de Provence in a second medium bowl until well combined; pour over chicken mixture.. Bake in the preheated oven until a knife inserted into the center comes out clean, 35 to 40 minutes. Let stand for 15 minutes before slicing and serving.","calories: 352, fat: 28g, carbs: 13g, protein: 12g, servings: 8",https://www.allrecipes.com/thmb/EQdyglzyC70wh2oKpVI2TuqSMqk=/1500x0/filters:no_upscale():max_bytes(150000):strip_icc()/880904-8afcdc0e7594403997835884e41fbc97.jpg
Mexican Layered Dip,https://www.allrecipes.com/recipe/15340/mexican-layered-dip/,"{'quantity': '1', 'unit': '(16 ounce) can', 'name': 'refried beans'}, {'quantity': '1', 'unit': '(1.25 ounce) package', 'name': 'taco seasoning mix'}, {'quantity': '1', 'unit': 'large', 'name': 'tomato, seeded and chopped'}, {'quantity': '1', 'unit': 'cup', 'name': 'sour cream, room temperature'}, {'quantity': '1', 'unit': 'cup', 'name': 'guacamole'}, {'quantity': '1', 'unit': 'cup', 'name': 'shredded sharp Cheddar cheese'}, {'quantity': '½', 'unit': 'cup', 'name': 'chopped green onions'}, {'quantity': '¼', 'unit': 'cup', 'name': 'chopped black olives'}","Spread refried beans in the bottom of a 1-quart shallow glass serving dish. Sprinkle taco seasoning over beans; top with a layer of diced tomatoes, a layer of sour cream, and a layer of guacamole. Sprinkle Cheddar cheese evenly over dip; top with green onions and black olives.. Cover and refrigerate for 2 hours or until ready to serve.","calories: 195, fat: 13g, carbs: 13g, protein: 7g, servings: 10",https://www.allrecipes.com/thmb/jZmldzrdWzzI45kIiZdQTTXSeHI=/1500x0/filters:no_upscale():max_bytes(150000):strip_icc()/6336184-ed732b5abd404938bd876bbc13fa62fd.jpg
Seven Layer Tex Mex Dip,https://www.allrecipes.com/recipe/23591/seven-layer-tex-mex-dip/,"{'quantity': '1', 'unit': '(16 ounce) can', 'name': 'refried beans'}, {'quantity': '1', 'unit': 'cup', 'name': 'guacamole'}, {'quantity': '¼', 'unit': 'cup', 'name': 'mayonnaise'}, {'quantity': '1', 'unit': '(8 ounce) container', 'name': 'sour cream'}, {'quantity': '1', 'unit': '(1 ounce) package', 'name': 'taco seasoning mix'}, {'quantity': '2', 'unit': 'cups', 'name': 'shredded Cheddar cheese'}, {'quantity': '1', 'unit': '', 'name': 'tomato, chopped'}, {'quantity': '¼', 'unit': 'cup', 'name': 'chopped green onions'}, {'quantity': '¼', 'unit': 'cup', 'name': 'black olives, drained'}","In a large serving dish, spread the refried beans. Layer the guacamole on top of the beans.. In a medium bowl, mix the mayonnaise, sour cream and taco seasoning mix. Spread over the layer of guacamole.. Sprinkle a layer of Cheddar cheese over the mayonnaise mixture layer. Sprinkle tomato, green onions and black olives over the cheese.","calories: 221, fat: 17g, carbs: 11g, protein: 8g, servings: 12",https://www.allrecipes.com/thmb/NAen51Yq1Q0dQEc2IFw_A5jQlCE=/1500x0/filters:no_upscale():max_bytes(150000):strip_icc()/347736-a43256fc17e8487799a931f14b49e728.jpg
Calabacita con Puerco (Pork with Squash),https://www.allrecipes.com/recipe/213466/calabacita-con-puerco-pork-with-squash/,"{'quantity': '2', 'unit': 'tablespoons', 'name': 'olive oil, divided'}, {'quantity': '4', 'unit': None, 'name': 'boneless pork chops'}, {'quantity': '5', 'unit': None, 'name': 'calabaza squash, halved and sliced 1/2-inch thick'}, {'quantity': '1', 'unit': 'cup', 'name': 'whole kernel corn, drained'}, {'quantity': '½', 'unit': 'cup', 'name': 'chopped onion'}, {'quantity': '½', 'unit': 'cup', 'name': 'chopped tomatoes'}, {'quantity': '2', 'unit': 'teaspoons', 'name': 'minced garlic'}, {'quantity': '1', 'unit': '(6 ounce) can', 'name': 'tomato sauce'}, {'quantity': '½', 'unit': 'teaspoon', 'name': 'ground cumin'}, {'quantity': '¼', 'unit': 'teaspoon', 'name': 'salt'}, {'quantity': '¼', 'unit': 'teaspoon', 'name': 'ground black pepper'}, {'quantity': '¼', 'unit': 'teaspoon', 'name': 'garlic powder'}, {'quantity': '2', 'unit': 'cups', 'name': 'chicken stock, or more as needed'}","Heat 1 tablespoon olive oil in a saucepan over medium-high heat. Add pork chops; cook until no longer pink in center, about 4 minutes per side. Cool until easy to handle, about 5 minutes; cut into bite-sized cubes.. Heat remaining 1 tablespoon olive oil in the same saucepan. Add cubed pork, calabaza squash, corn, onion, tomatoes, and garlic; cook until onion translucent, about 5 minutes. Stir in tomato sauce, cumin, salt, pepper, and garlic powder; stir in chicken stock and simmer, covered, until flavors combined, about 2 hours, stirring and checking periodically to see if more stock needed.","calories: 348, fat: 8g, carbs: 62g, protein: 15g, servings: 8",https://www.allrecipes.com/thmb/aMn68Ky-s-NLoybwurZhRUPYYr0=/1500x0/filters:no_upscale():max_bytes(150000):strip_icc()/8155493-0468df9131b84c1eb3c3f2e690c9ce89.jpg
Keto Tex-Mex Ground Beef Casserole,https://www.allrecipes.com/recipe/276216/keto-tex-mex-ground-beef-casserole/,"{'quantity': None, 'unit': None, 'name': 'cooking spray'}, {'quantity': '1 ½', 'unit': 'pounds', 'name': 'ground beef'}, {'quantity': '2 ½', 'unit': 'teaspoons', 'name': 'chili powder, divided'}, {'quantity': '2', 'unit': 'teaspoons', 'name': 'onion powder, divided'}, {'quantity': '2', 'unit': 'teaspoons', 'name': 'garlic powder, divided'}, {'quantity': '1', 'unit': 'teaspoon', 'name': 'ground cumin'}, {'quantity': '1', 'unit': 'teaspoon', 'name': 'ground coriander'}, {'quantity': None, 'unit': None, 'name': 'salt and ground black pepper to taste'}, {'quantity': '2', 'unit': '', 'name': 'eggs'}, {'quantity': '2', 'unit': 'tablespoons', 'name': 'heavy cream'}, {'quantity': '1', 'unit': 'tablespoon', 'name': 'extra-virgin olive oil'}, {'quantity': '½', 'unit': 'cup', 'name': 'chopped onion'}, {'quantity': '3', 'unit': 'tablespoons', 'name': 'tomato paste'}, {'quantity': '1', 'unit': 'pound', 'name': 'frozen riced cauliflower, thawed and drained'}, {'quantity': '1 ½', 'unit': 'cups', 'name': 'grated Cheddar cheese, divided'}","Preheat the oven to 350 degrees F (175 degrees C). Coat an 11x7-inch baking dish with cooking spray.. Heat a large nonstick skillet over medium-high heat. Add ground beef; cook and stir until browned and crumbly, 5 to 7 minutes. Stir in 1 1/2 teaspoons chili powder, 1 teaspoon onion powder, 1 teaspoon garlic powder, cumin, coriander, salt, and black pepper until evenly distributed. Cook until fragrant, 4 to 5 minutes. Remove from heat.. Whisk eggs and cream together in a bowl; add to beef mixture. Transfer to the prepared baking dish; pat down evenly.. Wipe skillet clean; add olive oil and heat over medium heat. Add onion; cook until soft and translucent, about 2 minutes. Add remaining 1 teaspoon each chili powder, garlic powder, and onion powder; season with salt and black pepper. Stir in tomato paste; cook, stirring often, 2 to 3 minutes. Add cauliflower rice; continue cooking for 4 to 5 minutes. Remove from heat, stir in 1 cup Cheddar cheese; transfer to baking dish on top of beef mixture, smoothing with a spatula to flatten top.. Bake in the preheated oven for 25 to 30 minutes. Sprinkle remaining 1/2 cup Cheddar over top; bake until cheese has melted, about 5 minutes. Remove from oven; cool about 5 minutes. Serve warm.","calories: 447, fat: 31g, carbs: 9g, protein: 33g, servings: 6",https://www.allrecipes.com/thmb/Q4TKLTgPggt02FJP71oGdJLHpKg=/1500x0/filters:no_upscale():max_bytes(150000):strip_icc()/7301526-d88f1a55046643759e4a5499e45da7a8.jpg
14 Tasty Ways to Use Tortillas,https://www.allrecipes.com/gallery/recipes-that-use-tortillas/,,,,https://www.allrecipes.com/thmb/WRtBfa5u8ekzlK_XLl9sNkCTLUk=/1500x0/filters:no_upscale():max_bytes(150000):strip_icc()/2914356_crispy-turkey-flautas_chef-john-96d49c2b355d483680ac27cd196633c6.jpg
Tex-Mex Turkey Soup,https://www.allrecipes.com/recipe/154784/tex-mex-turkey-soup/,"{'quantity': '1', 'unit': 'tablespoon', 'name': 'olive oil'}, {'quantity': '½', 'unit': 'cup', 'name': 'minced onion'}, {'quantity': '3', 'unit': 'cloves', 'name': 'garlic, minced'}, {'quantity': '2', 'unit': 'teaspoons', 'name': 'chili powder'}, {'quantity': '½', 'unit': 'teaspoon ground', 'name': 'cumin'}, {'quantity': '½', 'unit': 'teaspoon dried', 'name': 'oregano'}, {'quantity': '4', 'unit': 'cups', 'name': 'water'}, {'quantity': '4', 'unit': 'cups', 'name': 'shredded cooked turkey'}, {'quantity': '1', 'unit': '(28 ounce) can', 'name': 'diced tomatoes'}, {'quantity': '1', 'unit': '(10.75 ounce) can', 'name': 'condensed tomato soup'}, {'quantity': '1', 'unit': 'cup', 'name': 'salsa'}, {'quantity': '3', 'unit': '', 'name': 'chicken bouillon cubes'}, {'quantity': '1', 'unit': 'tablespoon', 'name': 'dried parsley'}, {'quantity': '2', 'unit': 'cups', 'name': 'frozen corn'}, {'quantity': '1', 'unit': '(14 ounce) can', 'name': 'black beans, rinsed, drained'}, {'quantity': '½', 'unit': 'cup', 'name': 'sour cream'}, {'quantity': '¼', 'unit': 'cup', 'name': 'chopped fresh cilantro'}, {'quantity': '6', 'unit': 'cups', 'name': 'corn tortilla chips, crushed'}, {'quantity': '1', 'unit': 'cup', 'name': 'shredded Cheddar-Monterey Jack cheese blend'}, {'quantity': '¾', 'unit': 'cup', 'name': 'chopped green onion'}, {'quantity': '½', 'unit': 'cup', 'name': 'chopped fresh cilantro'}, {'quantity': '½', 'unit': 'cup', 'name': 'sour cream'}","Heat oil in a large saucepan over medium heat. Add onion; cook until begins to soften, about 4 minutes. Add garlic, chili powder, cumin and oregano; cook, stirring, for 1 minute.. Stir in water, turkey, diced tomatoes, tomato soup, salsa, bouillon cubes, and parsley. Bring to a boil, then reduce heat, and simmer until bouillon cubes dissolve, 5 minutes. Stir in corn, black beans, 1/2 cup sour cream, and 1/4 cup cilantro; simmer 20 to 30 minutes.. Serve soup with crushed tortilla chips, cheese, green onion, 1/2 cup cilantro, and 1/2 cup sour cream.","calories: 684, fat: 31g, carbs: 59g, protein: 46g, servings: 6",https://www.allrecipes.com/thmb/Vt-7Iror4GlNw85h-AqAfo1WSUQ=/1500x0/filters:no_upscale():max_bytes(150000):strip_icc()/7309721-416854f18eaa4799889eea2691de8977.jpg
Taco Bake I,https://www.allrecipes.com/recipe/14651/taco-bake-i/,"{'quantity': '1 ½', 'unit': 'pounds', 'name': 'lean ground beef'}, {'quantity': '1', 'unit': '(1.25 ounce) package', 'name': 'taco seasoning mix'}, {'quantity': '1', 'unit': '(16 ounce) can', 'name': 'refried beans'}, {'quantity': '1', 'unit': '(16 ounce) jar', 'name': 'salsa'}, {'quantity': '2', 'unit': 'cups', 'name': 'shredded Monterey Jack cheese'}","Preheat oven to 325 degrees F (160 degrees C).. In a large, heavy skillet over medium-high heat, brown ground beef, and drain fat. Mix in dry taco seasoning.. Spoon browned meat into a 9x13 inch glass baking dish. Spoon a layer of refried beans over meat, then salsa. Top with shredded cheese.. Bake about 20 to 25 minutes in the preheated oven.","calories: 413, fat: 27g, carbs: 15g, protein: 26g, servings: 8",https://www.allrecipes.com/thmb/cdHkMT5KNuT_N_ick5p7Ci7sowc=/1500x0/filters:no_upscale():max_bytes(150000):strip_icc()/1124863-828d7702a1b14e32ab311335978c9f49.jpg
22 Best Recipes That Start With A Can of Rotel,https://www.allrecipes.com/gallery/rotel-recipes/,,,,https://www.allrecipes.com/thmb/T2HHHo72p1jjONJi61S34JVQ1fM=/1500x0/filters:no_upscale():max_bytes(150000):strip_icc()/4463431-5d4009be3b2e43e5a31712f6315ce962.jpg
Vegetarian Mexican Lasagna,https://www.allrecipes.com/recipe/278588/vegetarian-mexican-lasagna/,"{'quantity': '', 'unit': '', 'name': 'cooking spray'}, {'quantity': '2', 'unit': 'tablespoons', 'name': 'olive oil'}, {'quantity': '1', 'unit': 'cup', 'name': 'diced sweet onion'}, {'quantity': '2', 'unit': '', 'name': 'jalapeno peppers, seeded and diced'}, {'quantity': '1', 'unit': '', 'name': 'red bell pepper, diced'}, {'quantity': '4', 'unit': 'cloves', 'name': 'garlic, minced'}, {'quantity': '1', 'unit': '(16 ounce) jar', 'name': 'salsa'}, {'quantity': '1', 'unit': '(15.5 ounce) can', 'name': 'black beans, rinsed and drained'}, {'quantity': '1', 'unit': '(15.25 ounce) can', 'name': 'whole kernel corn, drained'}, {'quantity': '1', 'unit': 'teaspoon', 'name': 'chili powder'}, {'quantity': '1', 'unit': 'teaspoon', 'name': 'ground cumin'}, {'quantity': '1', 'unit': '(10 ounce) package', 'name': 'frozen chopped spinach, thawed and drained'}, {'quantity': '3', 'unit': 'cups', 'name': 'shredded pepper Jack cheese, divided'}, {'quantity': '2', 'unit': 'cups', 'name': 'ricotta cheese'}, {'quantity': '1', 'unit': '', 'name': 'egg, beaten'}, {'quantity': '½', 'unit': 'teaspoon', 'name': 'salt'}, {'quantity': '½', 'unit': 'teaspoon', 'name': 'ground black pepper'}, {'quantity': '18', 'unit': '', 'name': 'corn tortillas'}, {'quantity': '1', 'unit': 'cup', 'name': 'enchilada sauce'}","Preheat the oven to 350 degrees F (175 degrees C). Spray a 9x13-inch baking dish with cooking spray.. Heat olive oil in a large skillet over medium heat. Add onion, jalapenos, bell pepper, and garlic; cook and stir until onion is translucent, 5 to 7 minutes. Reduce heat to medium-low and add salsa, black beans, corn, chili powder, and cumin. Bring to a simmer; let simmer for 5 minutes.. Combine 2 cups pepper Jack cheese, ricotta cheese, spinach, egg, salt, and pepper in a bowl.. Place 6 corn tortillas in the bottom of the prepared baking dish. Add 1/2 of the vegetable mixture using a slotted spoon, followed by 1/2 of the cheese and spinach mixture. Add a layer of 6 tortillas and follow with remaining vegetables and remaining cheese mixture. Top with remaining tortillas. Spread enchilada sauce across the top and remaining pepper Jack cheese.. Bake in the preheated oven until cheese is melted and bubbly, 45 minutes to 1 hour.","calories: 411, fat: 21g, carbs: 40g, protein: 19g, servings: 12",https://www.allrecipes.com/thmb/bvOYcmEXjkB2axNxgsOxfBME-ZM=/1500x0/filters:no_upscale():max_bytes(150000):strip_icc()/7687154-9b8041e914484edfa83e709f5d79ef9b.jpg
Spicy Southwestern Slaw,https://www.allrecipes.com/recipe/20390/spicy-southwestern-slaw/,"{'quantity': '3', 'unit': 'cups', 'name': 'shredded cabbage'}, {'quantity': '1', 'unit': '', 'name': 'carrot, shredded'}, {'quantity': '1', 'unit': '', 'name': 'onion, diced'}, {'quantity': '1', 'unit': '', 'name': 'red bell pepper, diced'}, {'quantity': '1', 'unit': '', 'name': 'jalapeno pepper, seeded and diced'}, {'quantity': '1', 'unit': 'tablespoon', 'name': 'chopped fresh cilantro'}, {'quantity': '½', 'unit': 'cup', 'name': 'canola oil'}, {'quantity': '2', 'unit': 'tablespoons', 'name': 'apple cider vinegar'}, {'quantity': '1', 'unit': 'tablespoon', 'name': 'white sugar'}, {'quantity': '1', 'unit': 'teaspoon', 'name': 'cayenne pepper'}, {'quantity': '', 'unit': '', 'name': 'salt and pepper to taste'}","In a large bowl, toss together the cabbage, carrot, onion, red pepper, jalapeno and cilantro. Set aside.. In a small bowl, whisk together the oil, vinegar, sugar, cayenne pepper, salt and pepper. Pour over vegetable mixture and toss to combine. Cover and refrigerate for at least one hour.","calories: 202, fat: 19g, carbs: 8g, protein: 1g, servings: 6",https://www.allrecipes.com/thmb/CGXTHq_44xJF-UdNEwJ-sdcEQrg=/1500x0/filters:no_upscale():max_bytes(150000):strip_icc()/522337-a74a283a96f04a058164e2ce843c1993.jpg
Crispitos,https://www.allrecipes.com/crispitos-recipe-8655236,"{'quantity': '1', 'unit': 'quart', 'name': 'vegetable oil, divided, for frying'}, {'quantity': '1', 'unit': None, 'name': 'onion, chopped'}, {'quantity': '1', 'unit': 'clove', 'name': 'garlic, minced'}, {'quantity': '1', 'unit': 'pound', 'name': 'ground beef'}, {'quantity': '1', 'unit': 'packet', 'name': 'taco seasoning'}, {'quantity': '10', 'unit': None, 'name': 'flour tortillas'}, {'quantity': '1/4', 'unit': 'cup', 'name': 'salsa con queso, divided, or to taste (optional)'}, {'quantity': '2', 'unit': 'cups', 'name': 'grated Cheddar cheese'}, {'quantity': None, 'unit': None, 'name': 'toothpicks'}","Heat 1 tablespoon of the oil to a skillet over medium heat. Add onion and garlic; cook and stir for 1 to 2 minutes. Add beef and taco seasoning and cook until beef is brown and crumbly, about 5 minutes. Drain extra liquid from skillet.. Heat oil in a large skillet over low heat.. Meanwhile, spread a teaspoon of queso sauce onto a tortilla as ""glue"". Add 1/4 cup browned beef in the center and top with 2 tablespoons cheese. Roll up tortilla and secure roll with a toothpick. Repeat with remaining ingredients.. Carefully place rolled up tortillas into the hot oil. Fry until golden brown, 2 to 3 minutes.. Transfer to a wire rack with a slotted spoon. Serve with salsa con questo and enjoy!",,https://cdn.jwplayer.com/v2/media/wKalupoB/thumbnails/rrNQ16Yd.jpg
16 Dinners That Start With a Packet of Taco Seasoning,https://www.allrecipes.com/gallery/taco-seasoning-recipes/,,,,https://www.allrecipes.com/thmb/GvC8MY2kfO5jqzanr2FHeUliR8g=/1500x0/filters:no_upscale():max_bytes(150000):strip_icc()/144650-16bd187b27844fcb95b1f84fd4be2eca.jpg
