name,link,ingredients,steps,nutrition,image_url
Mexina Salsa Verde,https://www.allrecipes.com/recipe/66782/mexina-salsa-verde/,"{'quantity': '3', 'unit': '', 'name': 'green tomatoes'}, {'quantity': '2', 'unit': '', 'name': 'fresh jalapeno chilies'}, {'quantity': '1', 'unit': 'large', 'name': 'red tomato'}, {'quantity': '1', 'unit': 'medium', 'name': 'onion, chopped'}, {'quantity': '¼', 'unit': 'cup', 'name': 'lime juice'}, {'quantity': '', 'unit': '', 'name': 'salt and pepper to taste'}, {'quantity': '½', 'unit': 'cup', 'name': 'chopped cilantro'}","Place tomatoes and jalapeños in a pot; cover with water. Bring to a boil; cook until tomatoes and jalapeños turn light green, about 15 minutes. Drain well.. Transfer tomatoes and jalapeños to a blender; add onion, lime juice, salt, pepper, and cilantro. Puree to desired consistency and chill.","calories: 24, fat: 0g, carbs: 6g, protein: 1g, servings: 8",https://www.allrecipes.com/thmb/XVEGeJojJ_Bd3YZ-7xg3OqSWooU=/1500x0/filters:no_upscale():max_bytes(150000):strip_icc()/1092594-9e0a6f19dee34c9a8b2a546495a5e237.jpg
Fresh Salsa,https://www.allrecipes.com/recipe/96431/fresh-salsa/,"{'quantity': '6', 'unit': '', 'name': 'roma tomatoes, diced'}, {'quantity': '3', 'unit': '', 'name': 'fresh jalapeno peppers, seeded and chopped'}, {'quantity': '¼', 'unit': '', 'name': 'red onion, chopped'}, {'quantity': '3', 'unit': '', 'name': 'green onions, chopped'}, {'quantity': '2', 'unit': 'cloves', 'name': 'cloves garlic, crushed'}, {'quantity': '2', 'unit': 'tablespoons', 'name': 'chopped fresh cilantro'}, {'quantity': '2', 'unit': 'tablespoons', 'name': 'fresh lime juice'}, {'quantity': '2', 'unit': 'tablespoons', 'name': 'fresh lemon juice'}, {'quantity': '1 ½', 'unit': 'teaspoons', 'name': 'ground cumin'}, {'quantity': '1', 'unit': 'small', 'name': 'jicama, peeled and chopped'}, {'quantity': '1', 'unit': '(10 ounce) can', 'name': 'diced tomatoes with green chilies, drained'}, {'quantity': '', 'unit': '', 'name': 'salt and ground black pepper to taste'}","Mix together tomato, jalapeño peppers, red onion, green onions, garlic, cilantro, lime juice, lemon juice, cumin, jicama, and diced tomatoes with chilies in a bowl. Season with salt and pepper. Allow to sit at least 1 hour before serving.","calories: 9, fat: 0g, carbs: 2g, protein: 0g, servings: 36",https://www.allrecipes.com/thmb/py7pXwIxmX2rH93empgmMakTi2o=/1500x0/filters:no_upscale():max_bytes(150000):strip_icc()/452139-fresh-salsa-Hannah-Culbertson-4x3-1-0db181487720428697fc7469162ed7d9.jpg
Tomato Salsa without Onions,https://www.allrecipes.com/recipe/24247/tomato-salsa-without-onions/,"{'quantity': '1', 'unit': '', 'name': 'poblano pepper'}, {'quantity': '3', 'unit': 'cloves', 'name': 'garlic, peeled'}, {'quantity': '5', 'unit': '', 'name': 'ripe tomatoes'}, {'quantity': '1', 'unit': 'cup', 'name': 'chopped fresh cilantro'}, {'quantity': '½', 'unit': 'teaspoon', 'name': 'ground cumin'}, {'quantity': '1', 'unit': 'teaspoon', 'name': 'chili powder'}, {'quantity': '2', 'unit': 'tablespoons', 'name': 'lime juice'}","Preheat the oven's broiler.. Place poblano pepper and garlic cloves on a medium baking sheet. Turning pepper frequently, broil at maximum distance from heat until browned, about 15 minutes.. In a food processor, place roasted pepper, roasted garlic, tomatoes, cilantro, cumin, chili powder, and lime juice. Process using pulse setting until an evenly chunky texture is obtained. Chill until serving.","calories: 7, fat: 0g, carbs: 2g, protein: 0g, servings: 24",https://www.allrecipes.com/thmb/ht_4usM4iKouCoCElef4P2QBq7c=/1500x0/filters:no_upscale():max_bytes(150000):strip_icc()/1850211-1363b672b981477cbad386cc67d4fc99.jpg
Toe's Best Salsa,https://www.allrecipes.com/recipe/213490/toes-best-salsa/,"{'quantity': '1', 'unit': None, 'name': 'white onion, chopped'}, {'quantity': '2', 'unit': '(15 ounce) cans', 'name': 'tomato sauce'}, {'quantity': '2', 'unit': None, 'name': 'jalapeño peppers, halved, seeds and veins removed'}, {'quantity': '1', 'unit': None, 'name': 'serrano pepper, halved, seeds and veins removed'}, {'quantity': '4', 'unit': 'cloves', 'name': 'garlic'}, {'quantity': '1', 'unit': None, 'name': 'lime, juiced'}, {'quantity': '½', 'unit': 'teaspoon', 'name': 'salt, or more to taste'}, {'quantity': '1', 'unit': 'pinch', 'name': 'ground black pepper'}, {'quantity': '½', 'unit': 'bunch', 'name': 'cilantro'}","Place onion in a large bowl and set aside. Combine tomato sauce, jalapeño peppers, serrano pepper, garlic, lime juice, salt, and black pepper in a blender. Blend well. Place cilantro in the blender, and pulse several times to chop. Do not over-blend.. Pour the tomato sauce mixture into the bowl with onion and stir well to combine. Refrigerate at least 1 hour to blend flavors before serving.","calories: 18, fat: 0g, carbs: 4g, protein: 1g, servings: 16",https://www.allrecipes.com/thmb/hSxQc5OD8KSYJ0tIYsfn-IiNG10=/1500x0/filters:no_upscale():max_bytes(150000):strip_icc()/616268-4300678dedae4a1f9b2c11753f9a97a0.jpg
Salsa Borracha (Drunk Salsa),https://www.allrecipes.com/recipe/72955/salsa-borracha-drunk-salsa/,"{'quantity': '4', 'unit': '', 'name': 'fresh tomatoes'}, {'quantity': '10', 'unit': '', 'name': 'fresh jalapeno peppers, halved lengthwise and seeded'}, {'quantity': '1', 'unit': '(12 fluid ounce) bottle', 'name': 'Mexican beer'}, {'quantity': '½', 'unit': 'cup', 'name': 'water, or as needed'}, {'quantity': '1', 'unit': 'clove', 'name': 'garlic'}, {'quantity': '1', 'unit': 'slice', 'name': 'onion'}, {'quantity': '', 'unit': '', 'name': 'salt to taste'}","Place tomatoes and jalapeños in a saucepan; pour in beer and enough water to cover tomatoes and jalapeños. Simmer over medium heat until soft; remove from heat and let cool slightly.. Transfer tomatoes and jalapeños to a blender; add garlic and onion. Pulse until well blended, adding some of the cooking liquid to help with blending if necessary. Taste and season with salt.","calories: 38, fat: 0g, carbs: 6g, protein: 1g, servings: 8",https://www.allrecipes.com/thmb/peia5TwUrUeDZqGLsYAKFC-7pJw=/1500x0/filters:no_upscale():max_bytes(150000):strip_icc()/2772699-4fd479404ea24bae856bb83fe6220c52.jpg
Spicy Avocado Sauce,https://www.allrecipes.com/recipe/213708/spicy-avocado-sauce/,"{'quantity': '5', 'unit': '', 'name': 'fresh tomatillos, husks removed'}, {'quantity': '4', 'unit': '', 'name': 'serrano chile peppers, or to taste'}, {'quantity': '2', 'unit': 'tablespoons', 'name': 'chopped fresh cilantro'}, {'quantity': '1', 'unit': '', 'name': 'ripe avocado - peeled, pitted, and quartered'}, {'quantity': '', 'unit': '', 'name': 'salt to taste'}","Blend tomatillos, serrano chile peppers, and cilantro in a blender until smooth. Add 1 avocado quarter and continue blending until avocado is fully incorporated into mixture; repeat with each piece of avocado. Season with salt; continue processing until smooth. Serve immediately.","calories: 64, fat: 5g, carbs: 5g, protein: 1g, servings: 6",https://www.allrecipes.com/thmb/xY7HuxgmDQlb5zueb7Hyo68TuQ0=/1500x0/filters:no_upscale():max_bytes(150000):strip_icc()/1042854-d300152f8a7842e1a58946c59bfa6330.jpg
Cliff's Hot Sauce,https://www.allrecipes.com/recipe/181056/cliffs-hot-sauce/,"{'quantity': '2', 'unit': '', 'name': 'jalapeno peppers'}, {'quantity': '1', 'unit': '(28 ounce) can', 'name': 'whole tomatoes in juice'}, {'quantity': '1', 'unit': 'slice', 'name': 'white onion'}, {'quantity': '1', 'unit': 'teaspoon', 'name': 'minced garlic'}, {'quantity': '½', 'unit': 'teaspoon', 'name': 'ground cumin'}, {'quantity': '¼', 'unit': 'teaspoon', 'name': 'dried oregano'}, {'quantity': '¼', 'unit': 'teaspoon', 'name': 'salt'}","Remove stems from jalapeño peppers and seeds from one jalapeño. Place both jalapeño peppers, tomatoes with liquid, onion, garlic, cumin, oregano, and salt in a blender; pulse to desired consistency.","calories: 10, fat: 0g, carbs: 2g, protein: 0g, servings: 16",https://www.allrecipes.com/thmb/Oa87244WYv47A-1LkBCo_nw4c_M=/1500x0/filters:no_upscale():max_bytes(150000):strip_icc()/1024597-cliffs-hot-sauce-Melissa-Goff-4x3-1-f1d23fc475454ce19ed59c456ca82ec2.jpg
Avocado Feta Salsa,https://www.allrecipes.com/recipe/87678/avocado-feta-salsa/,"{'quantity': '2', 'unit': '', 'name': 'plum tomatoes, chopped'}, {'quantity': '1', 'unit': '', 'name': 'ripe avocado - peeled, pitted and chopped'}, {'quantity': '¼', 'unit': 'cup', 'name': 'finely chopped red onion'}, {'quantity': '1', 'unit': 'clove', 'name': 'garlic, minced'}, {'quantity': '1', 'unit': 'tablespoon', 'name': 'snipped fresh parsley'}, {'quantity': '1', 'unit': 'tablespoon', 'name': 'chopped fresh oregano'}, {'quantity': '1', 'unit': 'tablespoon', 'name': 'olive oil'}, {'quantity': '1', 'unit': 'tablespoon', 'name': 'red or white wine vinegar'}, {'quantity': '4', 'unit': 'ounces', 'name': 'crumbled feta cheese'}","In a bowl, gently stir together tomatoes, avocados, onion, and garlic. Mix in parsley and oregano. Gently stir in olive oil and vinegar, then stir in feta cheese. Cover and chill for 2 to 6 hours.","calories: 66, fat: 6g, carbs: 3g, protein: 2g, servings: 12",https://www.allrecipes.com/thmb/N6HZb5IbMIiv0Zbx6wFt_D-Ozcc=/1500x0/filters:no_upscale():max_bytes(150000):strip_icc()/1073749-e5ee968105db4a259c6bfb514e965a6e.jpg
"Avocado, Tomato and Mango Salsa",https://www.allrecipes.com/recipe/74694/avocado-tomato-and-mango-salsa/,"{'quantity': '4', 'unit': 'medium', 'name': 'tomatoes, diced'}, {'quantity': '1', 'unit': None, 'name': 'mango, peeled, seeded, and diced'}, {'quantity': '1', 'unit': None, 'name': 'avocado, peeled, pitted, and diced'}, {'quantity': '1', 'unit': None, 'name': 'jalapeño chile pepper, seeded and minced'}, {'quantity': '½', 'unit': 'cup', 'name': 'chopped fresh cilantro'}, {'quantity': '3', 'unit': 'cloves', 'name': 'garlic, minced'}, {'quantity': '¼', 'unit': 'cup', 'name': 'chopped red onion'}, {'quantity': '3', 'unit': 'tablespoons', 'name': 'olive oil'}, {'quantity': '2', 'unit': 'tablespoons', 'name': 'fresh lime juice'}, {'quantity': '1', 'unit': 'teaspoon', 'name': 'salt'}","Combine tomatoes, mango, avocado, jalapeño, cilantro, and garlic in a medium bowl; stir in red onion, olive oil, lime juice, and salt. Refrigerate for about 30 minutes before serving to blend the flavors.","calories: 158, fat: 12g, carbs: 14g, protein: 2g, servings: 6",https://www.allrecipes.com/thmb/FW6soo8majaUFWS3eEhpL1NDK-E=/1500x0/filters:no_upscale():max_bytes(150000):strip_icc()/74694avocado-tomato-and-mango-salsa1010lisalynn4x3-663452a9456c49d7be19c5508f230aeb.jpg
Peach Salsa,https://www.allrecipes.com/recipe/39988/peach-salsa-ii/,"{'quantity': '', 'unit': '', 'name': 'canning jars'}, {'quantity': '4', 'unit': 'cups', 'name': 'fresh peaches - peeled, pitted and chopped'}, {'quantity': '4', 'unit': '', 'name': 'jalapeno peppers, minced'}, {'quantity': '½', 'unit': 'cup', 'name': 'chopped onion'}, {'quantity': '½', 'unit': 'cup', 'name': 'chopped red bell pepper'}, {'quantity': '¼', 'unit': 'cup', 'name': 'chopped fresh cilantro'}, {'quantity': '¼', 'unit': 'cup', 'name': 'distilled white vinegar'}, {'quantity': '3', 'unit': 'cloves', 'name': 'garlic, minced'}, {'quantity': '1 ½', 'unit': 'teaspoons', 'name': 'ground cumin'}, {'quantity': '1', 'unit': 'teaspoon', 'name': 'grated lime zest'}, {'quantity': '1', 'unit': '(49 gram) package', 'name': 'light fruit pectin crystals'}, {'quantity': '3 ¾', 'unit': 'cups', 'name': 'white sugar'}","Inspect canning jars for cracks and rings for rust, discarding any defective ones. Immerse in simmering water until salsa is ready. Wash new, unused lids and rings in warm soapy water.. Combine peaches, jalapeño, onion, bell pepper, cilantro, vinegar, garlic, cumin, and lime zest in a large saucepan. Mix together pectin and 1/4 cup sugar in a small bowl, then stir into peach mixture in the saucepan. Bring to a boil. Stir in remaining 3 1/2 cups sugar. Boil for 1 minute, stirring constantly. Remove from heat and stir for 5 minutes.. Pack salsa into hot, sterilized jars, filling to within 1/4 inch of the top. Run a clean knife or thin spatula around the insides of the jars to remove any air bubbles. Wipe the rims with a moist paper towel to remove any residue. Top with the lids and screw the rings on tightly. Place a rack in the bottom of a large stockpot and fill halfway with water. Bring to a boil and lower jars 2 inches apart into boiling water using a holder. Pour in more boiling water to cover jars by at least 1 inch. Bring to a rolling boil, cover, and process for 15 minutes.. Remove the jars from the stockpot and let rest, several inches apart, for 12 to 24 hours. Press the center of each lid with a finger to ensure the lid does not move up or down. Remove the rings for storage and store in a cool, dark area.","calories: 118, fat: 0g, carbs: 30g, protein: 0g, servings: 28",https://www.allrecipes.com/thmb/C5yK8x43Xg2Y2k2NVFdd53YvIZc=/1500x0/filters:no_upscale():max_bytes(150000):strip_icc()/6887841-100770ad19644bd695d3aea4270fc97a.jpg
Peach Avocado Salsa,https://www.allrecipes.com/recipe/228866/peach-avocado-salsa/,"{'quantity': '2', 'unit': '', 'name': 'fresh peaches - peeled, pitted, and diced'}, {'quantity': '1', 'unit': None, 'name': 'jalapeño pepper, seeded and minced'}, {'quantity': '½', 'unit': '', 'name': 'red onion, minced'}, {'quantity': '½', 'unit': '', 'name': 'red bell pepper, minced'}, {'quantity': '¼', 'unit': 'cup', 'name': 'chopped fresh cilantro, or to taste'}, {'quantity': '2', 'unit': 'cloves', 'name': 'garlic, grated'}, {'quantity': '½', 'unit': '', 'name': 'lime, juiced'}, {'quantity': '½', 'unit': '', 'name': 'lemon, juiced'}, {'quantity': '', 'unit': '', 'name': 'salt and ground black pepper to taste'}, {'quantity': '1', 'unit': '', 'name': 'avocado - peeled, pitted, and diced'}","Gently mix peaches, jalapeño, onion, bell pepper, cilantro, garlic, lime juice, and lemon juice in a bowl; season with salt and pepper.. Cover the bowl with plastic wrap and refrigerate for at least 30 minutes. Fold avocado into salsa to serve.","calories: 112, fat: 8g, carbs: 13g, protein: 2g, servings: 4",https://www.allrecipes.com/thmb/cy9oAF4auY-tQZqx3hOiE_C2las=/1500x0/filters:no_upscale():max_bytes(150000):strip_icc()/1032934-peach-avocado-salsa-Deb-C-4x3-1-a92b03d06ec04725b06d0c78cbfcfce9.jpg
