name,link,ingredients,steps,nutrition,image_url
Our 10 Best Tomatillo Salsa Recipes,https://www.allrecipes.com/gallery/tomatillo-salsa-recipes/,,,,https://www.allrecipes.com/thmb/3li-CWgeHsut_ChECDnDCPWk_Yg=/1500x0/filters:no_upscale():max_bytes(150000):strip_icc()/280496-air-fryer-roasted-salsa-verde-f1769809c121442f934ac1f752548aba.jpg
7 Secrets For Sensational Homemade Salsa,https://www.allrecipes.com/article/homemade-salsa-secrets/,,,,https://www.allrecipes.com/thmb/PR4loUJ94pzWPJVgg3GnQrwX_4M=/1500x0/filters:no_upscale():max_bytes(150000):strip_icc()/230878-fresh-homemade-salsa-lutzflcat-4x3-bf1746f15c1d48c7818a49d8bb73d7fb.jpg
11 Spicy Salsa Recipes,https://www.allrecipes.com/gallery/spicy-salsa-recipes/,,,,https://www.allrecipes.com/thmb/072CtkL8brRpPcjvR1iQIkm32kU=/1500x0/filters:no_upscale():max_bytes(150000):strip_icc()/176137-ancho-chipotle-salsa-linda2d-e9f11360f405414fbb09b062017f295b.jpg
10 Fresh Peach Salsa Recipes to Use Up Your Sweet Summer Peaches,https://www.allrecipes.com/gallery/summer-peach-salsa-recipes/,,,,https://www.allrecipes.com/thmb/9DRWvav5kcMZUxBET6UXHUP5-As=/1500x0/filters:no_upscale():max_bytes(150000):strip_icc()/9277162_ChipotlePeachSalsawithCilantro4x3-75f64c10399f4c3f9ce4d78fed607fbc.jpg
Chicken Adobo Tacos,https://www.allrecipes.com/chicken-adobo-tacos-recipe-8736734,"{'quantity': '1/3', 'unit': 'cup', 'name': 'soy sauce'}, {'quantity': '1/3', 'unit': 'cup', 'name': 'white vinegar'}, {'quantity': '3', 'unit': None, 'name': 'bay leaves'}, {'quantity': '1', 'unit': 'teaspoon', 'name': 'granulated garlic'}, {'quantity': '1 1/2', 'unit': 'pounds', 'name': 'skinless, boneless chicken thighs'}, {'quantity': '2', 'unit': 'tablespoons', 'name': 'white vinegar'}, {'quantity': '1', 'unit': 'tablespoon', 'name': 'fish sauce'}, {'quantity': '1/2', 'unit': 'teaspoon', 'name': 'avocado oil'}, {'quantity': '2', 'unit': 'teaspoons', 'name': 'white sugar'}, {'quantity': '1', 'unit': 'pinch', 'name': 'white pepper'}, {'quantity': '1', 'unit': None, 'name': 'mango'}, {'quantity': '1', 'unit': None, 'name': 'oma tomato'}, {'quantity': '1/4', 'unit': 'cup', 'name': 'red onion'}, {'quantity': '1/4', 'unit': 'cup', 'name': 'jalapeno pepper'}, {'quantity': '1/2', 'unit': 'cup', 'name': 'chopped fresh cilantro'}, {'quantity': '2', 'unit': 'tablespoons', 'name': 'oil'}, {'quantity': '1/2', 'unit': 'cup', 'name': 'onion'}, {'quantity': '3', 'unit': None, 'name': 'garlic cloves'}, {'quantity': '1 1/2', 'unit': 'cups', 'name': 'water'}, {'quantity': '2', 'unit': 'tablespoons', 'name': 'brown sugar'}, {'quantity': '1', 'unit': 'teaspoon', 'name': 'ground black pepper,'}, {'quantity': '8', 'unit': '(8 inch)', 'name': 'flour tortillas'}, {'quantity': None, 'unit': None, 'name': 'chopped cilantro'}","Combine soy sauce, vinegar, bay leaves, and garlic in a large plastic bag with a zipper. Gently squeeze to mix well. Add chicken and coat with marinade. Squeeze out as much air from the bag as possible, coat all the chicken pieces with marinade, seal, and refrigerate for at least 20 minutes.. Meanwhile, combine vinegar, fish sauce, avocado oil, sugar, and black pepper in a bowl for the salsa. Stir with a whisk or fork until sugar is dissolved. Add mango, tomato, red onion, jalapeño, and chopped cilantro to the bowl. Toss to combine, and refrigerate salsa until ready to serve.. For tacos, remove chicken pieces from the marinade and reserve the marinade.. Heat oil in a large nonstick skillet over medium-high heat. Carefully add the chicken thighs, and brown on each side, 1 to 2 minutes, then remove chicken to a plate.. To the same skillet, add onion, and cook for about 1 minute. Stir in minced garlic and cook until fragrant, about 30 seconds. Add reserved marinade, water, brown sugar, and black pepper, and bring to a boil.. Return chicken to the skillet, smooth side down. Reduce heat to low, and simmer chicken uncovered, about 15 minutes. The liquid should bubble gently. Turn chicken and simmer 10 minutes more. Remove chicken from skillet to rest.. Cook sauce over medium heat until syrupy, thick, and reduced, about 10 minutes. Remove skillet from heat. Remove bay leaves and discard.. Slice chicken into 1/2-inch slices and return to the skillet to coat in the sauce. Garnish with fresh cilantro and chopped green onions, if desired.. Fill each tortilla with chicken strips and top with mango salsa. Serve immediately.",,https://www.allrecipes.com/thmb/oDLo4wo7PvHZjD_5-V61aomKMco=/1500x0/filters:no_upscale():max_bytes(150000):strip_icc()/8736734_Chicken-Adobo-Tacos_Brenda-Venable_4x3-30f03f195b1547b8b23ea85f647beec6.jpg
Roscoe's Chilaquiles,https://www.allrecipes.com/roscoe-s-chilaquiles-recipe-8739658,"{'quantity': '3', 'unit': None, 'name': 'chile peppers'}, {'quantity': '1', 'unit': None, 'name': 'chile pepper,'}, {'quantity': '4', 'unit': 'cups', 'name': 'water'}, {'quantity': '4', 'unit': None, 'name': 'Roma tomatoes'}, {'quantity': '1', 'unit': None, 'name': 'white onion'}, {'quantity': '3', 'unit': None, 'name': 'garlic cloves,'}, {'quantity': '2', 'unit': 'tablespoons', 'name': 'olive oil'}, {'quantity': '1', 'unit': None, 'name': 'beef bouillon cube'}, {'quantity': '2', 'unit': None, 'name': 'culantro leaves'}, {'quantity': '1', 'unit': None, 'name': 'lime, juiced'}, {'quantity': None, 'unit': None, 'name': 'salt and freshly ground black pepper to taste'}, {'quantity': '2 1/4', 'unit': 'cups', 'name': 'oil, divided'}, {'quantity': '12', 'unit': None, 'name': 'corn tortillas'}, {'quantity': '4', 'unit': 'large', 'name': 'eggs'}, {'quantity': '1/4', 'unit': 'cup', 'name': 'Mexican crema'}, {'quantity': '1/2', 'unit': 'cup', 'name': 'otija cheese'}, {'quantity': '1', 'unit': None, 'name': 'avocado,'}, {'quantity': '1/4', 'unit': 'cup', 'name': 'cilantro leaves'}, {'quantity': '1', 'unit': None, 'name': 'lime'}, {'quantity': '1/4', 'unit': 'teaspoon', 'name': 'oregano,'}","For salsa roja, pour boiling water over peppers and let sit until softened, 15 to 30 minutes.. Meanwhile, add 2 tablespoons olive oil to a skillet over high heat, and sear tomatoes, onions, and garlic until charred for about 2 minutes.. Place softened peppers, charred vegetables, and 1 cup of the chile soaking water in a blender. Reserve remaining 3 cups chile water.  Blend until smooth. Strain the sauce; pour back into the pan.. Cook sauce over medium heat, scraping any charred bits from the bottom of the pan; add 2 cups of remaining chile water. Simmer until sauce is reduced by 1/3. Stir in bouillon cube and last 1 cup chile water, culantro leaves, lime juice; stir until bouillon cube dissolves. Season with salt and pepper.. For chilaquiles, heat oil to 350 degrees F ( 175 degrees C) in a large saucepan over medium heat. Add tortillas and fry until crisp and golden. 2 minutes per batch.. For each serving, heat 1 tablespoon oil in a small nonstick pan over medium heat. Crack an egg into the skillet, and cook until outer edges become opaque, about 1 minute. Turn egg over and cook until whites are completely opaque, 1 to 2 minutes more.. Add a handful of chips to the salsa roja, and turn to coat completely. Remove to a serving plate with a slotted spoon.. Drizzle with crema, top with an egg, cotija cheese, avocado, cilantro, squeeze of lime juice, and drizzle with more salsa roja. Sprinkle with oregano. Repeat with remaining ingredients.","calories: 856, fat: 66g, carbs: 58g, protein: 18g, servings: 4",https://cdn.jwplayer.com/v2/media/qE3NT4RS/thumbnails/O0nm4XIy.jpg
Watermelon-Serrano Salsa,https://www.allrecipes.com/watermelon-serrano-salsa-recipe-8601115,"{'quantity': '1', 'unit': 'cup', 'name': 'oma tomatoes'}, {'quantity': '1', 'unit': 'cup', 'name': 'watermelon'}, {'quantity': '1/4', 'unit': 'cup', 'name': 'red onion'}, {'quantity': '1/4', 'unit': 'cup', 'name': 'lime juice'}, {'quantity': '1', 'unit': 'tablespoon', 'name': 'fresh cilantro'}, {'quantity': '2', 'unit': 'teaspoons', 'name': 'serrano pepper'}, {'quantity': '1/8', 'unit': 'teaspoon', 'name': 'salt'}, {'quantity': '1/8', 'unit': 'teaspoon', 'name': 'black pepper'}","Stir together tomatoes, watermelon, red onion, lime juice, cilantro, serrano pepper, salt, and black pepper in a bowl. Serve immediately or chill, covered, up to 2 hours.","calories: 32, fat: 0g, carbs: 8g, protein: 1g, servings: 4",https://www.allrecipes.com/thmb/i4LFIZJpu8QN-OcErPr3pYjN9HY=/1500x0/filters:no_upscale():max_bytes(150000):strip_icc()/8601115-Watermelon-Serrano-Salsa_3836-1-4x3-32c1f80765954a3384185d607d447692.jpg
Almond and Parsley Salsa Verde,https://www.allrecipes.com/recipe/238263/almond-and-parsley-salsa-verde/,"{'quantity': '⅔', 'unit': 'cup', 'name': 'roasted, salted almonds, finely chopped'}, {'quantity': '1', 'unit': 'bunch', 'name': 'flat-leaf parsley, finely chopped'}, {'quantity': '1', 'unit': 'clove', 'name': 'garlic, minced'}, {'quantity': '1', 'unit': 'cup', 'name': 'olive oil'}",Combine chopped almonds and parsley on a cutting board; chop together again until very finely chopped.. Transfer almond mixture to a bowl and add garlic. Stir olive oil into almond mixture until a thick sauce forms.,"calories: 311, fat: 33g, carbs: 3g, protein: 3g, servings: 8",https://cdn.jwplayer.com/v2/media/rcCGtWLv/poster.jpg?width=720
How Long Does an Open Jar of Salsa Last in the Fridge?,https://www.allrecipes.com/article/how-long-does-jarred-salsa-last/,,,,https://www.allrecipes.com/thmb/zY6_q-FOxeiegFHqqSlQu_ViwS0=/1500x0/filters:no_upscale():max_bytes(150000):strip_icc()/ALR-how-long-does-jarred-salsa-last-625b486dff5a4bd9834ffc26ff790a89.jpg
Pico de Gallo,https://www.allrecipes.com/recipe/203800/pico-de-gallo/,"{'quantity': '6', 'unit': '', 'name': 'roma (plum) tomatoes, diced'}, {'quantity': '½', 'unit': '', 'name': 'red onion, minced'}, {'quantity': '3', 'unit': 'tablespoons', 'name': 'chopped fresh cilantro'}, {'quantity': '½', 'unit': '', 'name': 'jalapeño pepper, seeded and minced'}, {'quantity': '½', 'unit': '', 'name': 'lime, juiced'}, {'quantity': '1', 'unit': 'clove', 'name': 'garlic, minced'}, {'quantity': '1', 'unit': 'pinch', 'name': 'garlic powder'}, {'quantity': '1', 'unit': 'pinch', 'name': 'ground cumin, or to taste'}, {'quantity': '', 'unit': '', 'name': 'salt and ground black pepper to taste'}",,"calories: 10, fat: 0g, carbs: 2g, protein: 0g, servings: 12",https://cdn.jwplayer.com/v2/media/gchfl2eN/poster.jpg?width=720
The Best Canning Salsa,https://www.allrecipes.com/recipe/244149/the-best-canning-salsa/,"{'quantity': '30', 'unit': 'medium', 'name': 'tomatoes, peeled and chopped'}, {'quantity': '10', 'unit': 'cups', 'name': 'chopped onions'}, {'quantity': '2', 'unit': 'cups', 'name': 'vinegar'}, {'quantity': '2', 'unit': '(8 ounce) cans', 'name': 'tomato paste'}, {'quantity': '½', 'unit': 'cup', 'name': 'white sugar, or more to taste'}, {'quantity': '2', 'unit': 'medium', 'name': 'green bell peppers, chopped'}, {'quantity': '2', 'unit': 'medium', 'name': 'red bell peppers, chopped'}, {'quantity': '4', 'unit': '', 'name': 'banana peppers, chopped'}, {'quantity': '10', 'unit': 'cloves', 'name': 'garlic, chopped'}, {'quantity': '8', 'unit': 'teaspoons', 'name': 'pickling salt'}, {'quantity': '2', 'unit': 'teaspoons', 'name': 'ground black pepper'}, {'quantity': '½', 'unit': 'bunch', 'name': 'fresh cilantro, chopped'}",,"calories: 9, fat: 0g, carbs: 2g, protein: 0g, servings: 272",https://cdn.jwplayer.com/v2/media/vLnFuVHa/poster.jpg?width=720
Pineapple Sriracha Salsa,https://www.allrecipes.com/pineapple-sriracha-salsa-recipe-8663130,"{'quantity': '1', 'unit': '(20 ounce) can', 'name': 'pineapple chunks in juice'}, {'quantity': '1', 'unit': 'teaspoon', 'name': 'vegetable oil, for greasing pan'}, {'quantity': '1/2', 'unit': None, 'name': 'yellow onion, roughly chopped'}, {'quantity': '6', 'unit': None, 'name': 'garlic cloves'}, {'quantity': '1/4', 'unit': 'cup', 'name': 'chile garlic sauce (such as Sriracha'}, {'quantity': '3', 'unit': 'tablespoons', 'name': 'mint leaves'}, {'quantity': '1/4', 'unit': 'teaspoon', 'name': 'salt, or to taste'}, {'quantity': '1/4', 'unit': 'cup', 'name': 'rice vinegar'}","Place a strainer over a bowl, and transfer in pineapple chunks. Let drain well, and reserve juice.. Preheat the oven’s broiler to High and set a rack 8 inches from the heat source. Line a rimmed baking sheet with foil, and lightly oil the foil.. Spread pineapple chunks onto the prepared pan. Add onion and garlic and spread out evenly.. Broil pineapple until tops of pineapple chunks and onions are charred, about 5 minutes. Let cool to room temperature, about 15 minutes.. Remove garlic cloves and set aside. Transfer pineapple and onions into a blender. Peel garlic cloves; add to the blender; add in reserved pineapple juice, Sriracha, mint leaves, salt, and vinegar. Blend until the mixture is as smooth or chunky as you like. Taste for seasoning.. Cover and refrigerate for at least 1 hour before serving. Salsa can be made up to 3 days ahead.","calories: 21, fat: 0g, carbs: 5g, protein: 0g, servings: 24",https://cdn.jwplayer.com/v2/media/fWG6gfC5/thumbnails/x8ZL2Hm2.jpg
Mango Pico de Gallo,https://www.allrecipes.com/mango-pico-de-gallo-recipe-8636041,"{'quantity': '1 1/2', 'unit': 'cups', 'name': 'fresh mango'}, {'quantity': '1/3', 'unit': 'cup', 'name': 'red onion'}, {'quantity': '1/3', 'unit': 'cup', 'name': 'jalapeno pepper'}, {'quantity': '1/3', 'unit': 'cup', 'name': 'tomato'}, {'quantity': '1/3', 'unit': 'cup', 'name': 'cilantro'}, {'quantity': '1', 'unit': None, 'name': ''}, {'quantity': '1', 'unit': 'pinch', 'name': 'salt'}, {'quantity': None, 'unit': None, 'name': 'lime'}","Place mango, red onion, jalapeño, tomato, cilantro, and lime zest and juice in a medium bowl. Season to taste with salt. Toss to combine.. Refrigerate at least 30 minutes to an hour. Garnish with additional lime slices and cilantro sprigs. Serve cold.","calories: 60, fat: 0g, carbs: 16g, protein: 1g, servings: 4",https://www.allrecipes.com/thmb/dmw9ANRHF2bOxYvX20iBJDIh_DU=/1500x0/filters:no_upscale():max_bytes(150000):strip_icc()/8636041_Mango-Pico-de-Gallo_Brenda-Venable_4x3-332a6ab2fc2b4f8390f0204e08635336.jpg
Salsa Macha,https://www.allrecipes.com/salsa-macha-recipe-8386066,"{'quantity': '1', 'unit': None, 'name': 'ancho chili pepper'}, {'quantity': '1', 'unit': None, 'name': 'Guajillo chili pepper'}, {'quantity': '6', 'unit': None, 'name': 'chili de árbol peppers'}, {'quantity': '1', 'unit': 'cup', 'name': 'vegetable oil'}, {'quantity': '1', 'unit': 'tablespoon', 'name': 'sesame seeds'}, {'quantity': '4', 'unit': None, 'name': 'garlic cloves, chopped'}, {'quantity': '1', 'unit': 'teaspoon', 'name': 'apple cider vinegar'}, {'quantity': '1/2', 'unit': 'teaspoon', 'name': 'salt, or to taste'}, {'quantity': '1/2', 'unit': 'teaspoon', 'name': 'oregano'}, {'quantity': '1/4', 'unit': 'cup', 'name': 'peanuts'}","Remove the stems and seeds from the chili peppers. Chop into 1/4-inch pieces. Set aside.. Heat oil over medium heat until it begins to shimmer. Add sesame seeds and garlic. Cook, stirring constantly, until sesame seeds are browned and garlic has crisped up, about 5 minutes. Remove from heat. Add chili peppers and stir until combined. Let sit at room temperature until cool, about 10 minutes.. Stir in vinegar, salt, and Mexican oregano. Pour mixture into a food processor and pulse several times until the salsa is combined, making sure not to over process. Stir in peanuts.","calories: 288, fat: 30g, carbs: 5g, protein: 2g, servings: 8",https://www.allrecipes.com/thmb/y7YY136d8xuj_-0jCNjpDTXxPZw=/1500x0/filters:no_upscale():max_bytes(150000):strip_icc()/8386066_Salsa-Macha_Yoly_4x3-437cfd056fff4dd5a535d545548e2f4a.jpg
Tomatillo-Kiwi Salsa,https://www.allrecipes.com/tomatillo-kiwi-salsa-recipe-7255584,"{'quantity': '1', 'unit': 'cup', 'name': 'tomatillos'}, {'quantity': '1', 'unit': 'cup', 'name': 'kiwis'}, {'quantity': '1/4', 'unit': 'cup', 'name': 'green onions'}, {'quantity': '3', 'unit': 'tablespoons', 'name': 'lime juice'}, {'quantity': '1', 'unit': 'tablespoon', 'name': 'fresh cilantro'}, {'quantity': '1 to 2', 'unit': 'teaspoons', 'name': 'minced jalapeño'}, {'quantity': '1/8', 'unit': 'teaspoons', 'name': 'salt'}, {'quantity': '1/8', 'unit': 'teaspoons', 'name': 'black pepper'}","Stir together tomatillos, kiwi, green onions, lime juice, cilantro, jalapeño, salt, and pepper in a bowl. Serve immediately or chill, covered, up to 2 hours.","calories: 43, fat: 1g, carbs: 10g, protein: 1g, servings: 4",https://www.allrecipes.com/thmb/-66GJkfmEwt-keMgR5ChiLQu5v0=/1500x0/filters:no_upscale():max_bytes(150000):strip_icc()/TomatilloKiwiSalsa4x3-6082a06dd5aa4703985cee435fdfbf10.jpg
The Best Fresh Tomato Salsa,https://www.allrecipes.com/recipe/214893/the-best-fresh-tomato-salsa/,"{'quantity': '3', 'unit': 'cups', 'name': 'freshly chopped tomatoes'}, {'quantity': '1', 'unit': 'cup', 'name': 'finely diced onion'}, {'quantity': '½', 'unit': 'cup', 'name': 'chopped green bell pepper'}, {'quantity': '¼', 'unit': 'cup', 'name': 'minced fresh cilantro'}, {'quantity': '2', 'unit': 'tablespoons', 'name': 'fresh lime juice'}, {'quantity': '4', 'unit': 'teaspoons', 'name': 'chopped fresh jalapeño pepper (including seeds)'}, {'quantity': '½', 'unit': 'teaspoon', 'name': 'ground cumin'}, {'quantity': '½', 'unit': 'teaspoon', 'name': 'kosher salt, or to taste'}, {'quantity': '½', 'unit': 'teaspoon', 'name': 'ground black pepper'}","Gather all ingredients.. Stir tomatoes, onion, green bell pepper, cilantro, lime juice, jalapeño pepper, cumin, salt, and pepper together in a bowl until just combined.. Serve and enjoy!","calories: 6, fat: 0g, carbs: 1g, protein: 0g, servings: 40",https://cdn.jwplayer.com/v2/media/5GkUxW8s/thumbnails/nENJFy1u.jpg
Fresh Homemade Salsa,https://www.allrecipes.com/recipe/230878/fresh-homemade-salsa/,"{'quantity': '2', 'unit': 'cups', 'name': 'chopped tomatoes'}, {'quantity': '¼', 'unit': 'cup', 'name': 'chopped red onion'}, {'quantity': '¼', 'unit': 'cup', 'name': 'chopped yellow onion'}, {'quantity': '2', 'unit': 'tablespoons', 'name': 'canned green chilies'}, {'quantity': '2', 'unit': 'tablespoons', 'name': 'fresh lime juice'}, {'quantity': '2', 'unit': 'tablespoons', 'name': 'chopped fresh cilantro'}, {'quantity': '2', 'unit': 'cloves', 'name': 'garlic, peeled'}, {'quantity': '1', 'unit': 'teaspoon', 'name': 'ground cumin'}, {'quantity': '¼', 'unit': 'teaspoon', 'name': 'salt'}",,"calories: 11, fat: 0g, carbs: 2g, protein: 0g, servings: 12",https://cdn.jwplayer.com/v2/media/CF0trvTb/poster.jpg?width=720
Tomatillo Salsa Verde,https://www.allrecipes.com/recipe/94028/tomatillo-salsa-verde/,"{'quantity': '1', 'unit': 'pound', 'name': 'tomatillos, husked'}, {'quantity': '½', 'unit': 'cup', 'name': 'finely chopped onion'}, {'quantity': '1', 'unit': '', 'name': 'serrano chile pepper, minced'}, {'quantity': '1', 'unit': 'teaspoon', 'name': 'minced garlic'}, {'quantity': '2', 'unit': 'tablespoons', 'name': 'chopped cilantro'}, {'quantity': '1', 'unit': 'tablespoon', 'name': 'chopped fresh oregano'}, {'quantity': '1 ½', 'unit': 'teaspoons', 'name': 'salt, or to taste'}, {'quantity': '½', 'unit': 'teaspoon', 'name': 'ground cumin'}, {'quantity': '2', 'unit': 'cups', 'name': 'water'}",,"calories: 24, fat: 1g, carbs: 5g, protein: 1g, servings: 8",https://cdn.jwplayer.com/v2/media/FZPPLpdu/poster.jpg?width=720
"Heather's Cilantro, Black Bean, and Corn Salsa",https://www.allrecipes.com/recipe/143315/heathers-cilantro-black-bean-and-corn-salsa/,"{'quantity': '2', 'unit': '(15 ounce) cans', 'name': 'black beans, drained and rinsed'}, {'quantity': '1', 'unit': '(15 ounce) can', 'name': 'yellow corn, drained'}, {'quantity': '1', 'unit': '(15 ounce) can', 'name': 'white corn, drained'}, {'quantity': '1', 'unit': '(14.5 ounce) can', 'name': 'Italian-style diced tomatoes, drained'}, {'quantity': '1', 'unit': 'bunch', 'name': 'finely chopped cilantro'}, {'quantity': '5', 'unit': '', 'name': 'green onions, finely sliced'}, {'quantity': '1', 'unit': 'small', 'name': 'red onion, finely chopped'}, {'quantity': '1', 'unit': '', 'name': 'red bell pepper, seeded and chopped'}, {'quantity': '1', 'unit': 'tablespoon', 'name': 'minced garlic'}, {'quantity': '¼', 'unit': 'cup', 'name': 'lime juice'}, {'quantity': '1', 'unit': '', 'name': 'avocado - peeled, pitted, and diced'}, {'quantity': '2', 'unit': 'tablespoons', 'name': 'olive oil, or to taste'}","Gather all ingredients.. Stir black beans, yellow and white corn, tomatoes, cilantro, green onions, red onion, bell pepper, and garlic together in a large bowl.. Gently mix in lime juice and avocado.. Drizzle with olive oil to serve.","calories: 30, fat: 1g, carbs: 5g, protein: 1g, servings: 72",https://cdn.jwplayer.com/v2/media/glcTBh5w/thumbnails/xWUlHEMH.jpg
Best-Ever Texas Caviar,https://www.allrecipes.com/recipe/152270/best-ever-texas-caviar/,"{'quantity': '2', 'unit': '(15 ounce) cans', 'name': 'black beans, rinsed and drained'}, {'quantity': '2', 'unit': '(15 ounce) cans', 'name': 'pinto beans, rinsed and drained'}, {'quantity': '2', 'unit': '(15 ounce) cans', 'name': 'white corn, rinsed and drained'}, {'quantity': '1', 'unit': '(4 ounce) can', 'name': 'chopped green chiles, undrained'}, {'quantity': '1', 'unit': '', 'name': 'red bell pepper - cored, seeded and finely chopped'}, {'quantity': '1', 'unit': '', 'name': 'green bell pepper - cored, seeded and finely chopped'}, {'quantity': '1', 'unit': 'small', 'name': 'red onion, finely chopped'}, {'quantity': '1', 'unit': '', 'name': 'jalapeno chile pepper, seeded and finely chopped (Optional)'}, {'quantity': '1', 'unit': 'bunch', 'name': 'cilantro leaves, finely chopped'}, {'quantity': '½', 'unit': 'cup', 'name': 'rice vinegar'}, {'quantity': '½', 'unit': 'cup', 'name': 'olive oil'}, {'quantity': '⅓', 'unit': 'cup', 'name': 'white sugar'}, {'quantity': '½', 'unit': 'teaspoon', 'name': 'garlic powder'}","Gather all ingredients.. Mix together black beans, pinto beans, white corn, green chiles, red and green bell peppers, red onion, jalapeño pepper, and cilantro in a large bowl.. Combine rice vinegar, olive oil, sugar, and garlic powder in a pan. Bring to a boil, then remove from heat. Let cool for at least 10 minutes.. Pour dressing over bean mixture; toss to coat.","calories: 262, fat: 12g, carbs: 36g, protein: 6g, servings: 10",https://www.allrecipes.com/thmb/z6_DMm-sHMWv-LDW_2j268LLAHE=/1500x0/filters:no_upscale():max_bytes(150000):strip_icc()/152270-BestEverTexasCavier-ddmfs-4X3-0032-83f2188f840540af8076d18721cda991.jpg
Mango Salsa,https://www.allrecipes.com/recipe/48032/mango-salsa/,"{'quantity': '1', 'unit': '', 'name': 'mango - peeled, seeded, and chopped'}, {'quantity': '¼', 'unit': 'cup', 'name': 'finely chopped red bell pepper'}, {'quantity': '1', 'unit': '', 'name': 'green onion, chopped'}, {'quantity': '1', 'unit': None, 'name': 'fresh jalapeño chile pepper, finely chopped'}, {'quantity': '2', 'unit': 'tablespoons', 'name': 'chopped cilantro'}, {'quantity': '2', 'unit': 'tablespoons', 'name': 'lime juice'}, {'quantity': '1', 'unit': 'tablespoon', 'name': 'lemon juice'}",,"calories: 21, fat: 0g, carbs: 5g, protein: 0g, servings: 8",https://cdn.jwplayer.com/v2/media/MqSpBGoP/poster.jpg?width=720
Easy Corn Salsa,https://www.allrecipes.com/recipe/187625/easy-corn-salsa/,"{'quantity': '1', 'unit': '(15.25 ounce) can', 'name': 'sweet corn, drained'}, {'quantity': '1', 'unit': '', 'name': 'orange bell pepper, chopped'}, {'quantity': '1', 'unit': '', 'name': 'red onion, chopped'}, {'quantity': '1', 'unit': None, 'name': 'jalapeño pepper, seeded and minced'}, {'quantity': '1', 'unit': 'tablespoon', 'name': 'chopped fresh cilantro, or more to taste'}, {'quantity': '1', 'unit': 'tablespoon', 'name': 'fresh lime juice, or to taste'}, {'quantity': '1', 'unit': 'teaspoon', 'name': 'honey'}, {'quantity': '½', 'unit': 'teaspoon', 'name': 'crushed red pepper'}, {'quantity': '', 'unit': '', 'name': 'salt and black pepper to taste'}",,"calories: 65, fat: 0g, carbs: 15g, protein: 2g, servings: 6",https://cdn.jwplayer.com/v2/media/rNmojtOy/thumbnails/HFvqJHo3.jpg
Salsa,https://www.allrecipes.com/recipe/16542/salsa/,"{'quantity': '4', 'unit': 'large', 'name': 'ripe tomatoes, chopped'}, {'quantity': '1', 'unit': '', 'name': 'onion, chopped'}, {'quantity': '1', 'unit': '', 'name': 'tomatillo, diced (Optional)'}, {'quantity': '½', 'unit': 'cup', 'name': 'chopped fresh cilantro'}, {'quantity': '3', 'unit': 'cloves', 'name': 'garlic, minced'}, {'quantity': '1', 'unit': 'tablespoon', 'name': 'lime juice'}, {'quantity': '', 'unit': '', 'name': 'salt to taste'}, {'quantity': '1', 'unit': None, 'name': 'jalapeño pepper, minced'}","Gather all ingredients.. Combine tomatoes, onion, tomatillo, cilantro, garlic, lime juice, and salt in a medium-sized mixing bowl. Mix well.. Add 1/2 of the jalapeño pepper and taste. If you desire your salsa with more kick, add remaining 1/2 jalapeño.. Cover the salsa and chill until ready to serve.","calories: 53, fat: 1g, carbs: 12g, protein: 2g, servings: 4",https://www.allrecipes.com/thmb/lorX_c7nPrEX4Tjl3jWulOKN1vo=/1500x0/filters:no_upscale():max_bytes(150000):strip_icc()/16542-Salsa-ddmfs-4x3-041-8a68e3aa135c4d35bbaa0a01a9d3403e.jpg
