name,link,ingredients,steps,nutrition
Easy Sausage Manicotti Bake,https://www.allrecipes.com/easy-sausage-manicotti-bake-recipe-8559561,"{'quantity': '7', 'unit': 'links', 'name': 'Italian chicken sausage, cut in half lengthwise'}, {'quantity': '8', 'unit': 'ounces', 'name': 'manicotti pasta shells'}, {'quantity': '1', 'unit': '(15 ounce) jar', 'name': 'prepared Alfredo sauce'}, {'quantity': '8', 'unit': 'ticks', 'name': 'mozzarella string cheese, pulled in half lengthwise'}, {'quantity': '1', 'unit': '24 ounce) jar', 'name': 'marinara sauce'}, {'quantity': '2', 'unit': 'cups', 'name': 'shredded mozzarella cheese'}, {'quantity': '1/4', 'unit': 'cup', 'name': 'grated Parmesan cheese'}, {'quantity': '1', 'unit': 'tablespoon', 'name': 'chopped fresh parsley for garnish, or to taste (optional)'}","Preheat the oven to 350 degrees F (175 degrees C). Fill each pasta shell with half of a sausage link and arrange in a lightly greased 9x13-inch baking dish.. Pour Alfredo sauce evenly over pasta shells. Place a half of a string cheese on top, between each pasta piece. Top evenly with marinara. Add 2/3 cup water to the marinara jar and shake well. Pour water around the edges of the dish. Top with shredded mozzarella and Parmesan. Cover with foil.. Bake in the preheated oven until golden around the edges and bubbly all over, about 1 hour, uncovering during the last 25 minutes. Let stand for 10 minutes before serving. Garnish with chopped parsley.","calories: 583, fat: 41g, carbs: 23g, protein: 31g, servings: 8"
Baked Shotgun Shells,https://www.allrecipes.com/baked-shotgun-shells-recipe-8404342,"{'quantity': '24', 'unit': None, 'name': 'manicotti pasta shells'}, {'quantity': '1/2', 'unit': 'lb.', 'name': 'ground sirloin'}, {'quantity': '1', 'unit': 'lb.', 'name': 'spicy Italian sausage'}, {'quantity': '1/4', 'unit': 'cup', 'name': 'finely chopped onion'}, {'quantity': '1', 'unit': 'teaspoon', 'name': 'kosher salt'}, {'quantity': '1/2', 'unit': 'teaspoon freshly ground black', 'name': 'freshly ground black'}, {'quantity': '1/2', 'unit': 'teaspoon', 'name': 'garlic powder'}, {'quantity': '1/2', 'unit': 'cup', 'name': 'shredded Cheddar and Monterey Jack cheese'}, {'quantity': '1', 'unit': '(8-ounce package)', 'name': 'garlic and herb cream cheese,'}, {'quantity': '24', 'unit': 'slices', 'name': 'bacon'}, {'quantity': '1 ½', 'unit': 'cups', 'name': 'BBQ sauce'}, {'quantity': '2', 'unit': None, 'name': 'jalapenos'}",,"calories: 656, fat: 22g, carbs: 83g, protein: 28g, servings: 12"
Manicotti,https://www.allrecipes.com/recipe/13883/manicotti/,"{'quantity': '5 ½', 'unit': 'ounces', 'name': 'manicotti pasta'}, {'quantity': '1', 'unit': 'pint', 'name': 'part-skim ricotta cheese'}, {'quantity': '8', 'unit': 'ounces', 'name': 'shredded mozzarella cheese'}, {'quantity': '¾', 'unit': 'cup', 'name': 'grated Parmesan cheese, divided'}, {'quantity': '2', 'unit': 'large', 'name': 'eggs'}, {'quantity': '1', 'unit': 'teaspoon', 'name': 'dried parsley'}, {'quantity': '', 'unit': '', 'name': 'salt and ground black pepper to taste'}, {'quantity': '1', 'unit': '(16 ounce) jar', 'name': 'spaghetti sauce'}","Cook manicotti in boiling water until al dente, about 10 to 12 minutes; drain and rinse with cold water.. Preheat the oven to 350 degrees F (175 degrees C).. Mix ricotta, mozzarella, 1/2 cup Parmesan cheese, eggs, parsley, salt, and pepper in a large bowl until well combined.. Pour 1/2 cup spaghetti sauce into an 11x17-inch baking dish. Stuff each manicotti shell with 3 tablespoons cheese mixture, and arrange over sauce. Pour remaining sauce over the top of the shells and sprinkle with remaining Parmesan cheese.. Bake in the preheated oven until bubbly, about 45 minutes.","calories: 676, fat: 31g, carbs: 53g, protein: 46g, servings: 4"
Spinach Cheese Manicotti,https://www.allrecipes.com/recipe/46887/spinach-cheese-manicotti/,"{'quantity': '1', 'unit': '(15 ounce) container', 'name': 'ricotta cheese'}, {'quantity': '1', 'unit': '(10 ounce) package', 'name': 'frozen chopped spinach, thawed and squeezed dry'}, {'quantity': '½', 'unit': 'cup', 'name': 'minced onion'}, {'quantity': '1', 'unit': 'large', 'name': 'egg'}, {'quantity': '2', 'unit': 'teaspoons', 'name': 'minced fresh parsley'}, {'quantity': '½', 'unit': 'teaspoon', 'name': 'pepper'}, {'quantity': '¼', 'unit': 'teaspoon', 'name': 'garlic powder'}, {'quantity': '1 ½', 'unit': 'cups', 'name': 'shredded mozzarella cheese, divided'}, {'quantity': '½', 'unit': 'cup', 'name': 'grated Parmesan cheese, divided'}, {'quantity': '1', 'unit': '(8 ounce) package', 'name': 'manicotti shells'}, {'quantity': '2', 'unit': '(26 ounce) jars', 'name': 'spaghetti sauce'}, {'quantity': '1 ½', 'unit': 'cups', 'name': 'water'}","Preheat the oven to 350 degrees F (175 degrees C).. Mix ricotta, spinach, onion, egg, parsley, pepper, and garlic powder together in a large bowl. Stir in 1 cup mozzarella and 1/4 cup Parmesan. Stuff mixture into uncooked manicotti shells.. Stir spaghetti sauce and water together in a bowl. Spread 1 cup sauce over the bottom of a 9x13-inch baking dish. Arrange stuffed manicotti in a single layer in the dish. Cover with remaining sauce, then sprinkle with remaining mozzarella and Parmesan.. Bake in the preheated oven until shells are tender yet firm to the bite, 45 to 55 minutes.","calories: 576, fat: 21g, carbs: 69g, protein: 30g, servings: 6"
Manicotti Shells,https://www.allrecipes.com/recipe/23048/manicotti-shells/,"{'quantity': '2', 'unit': 'cups', 'name': 'all-purpose flour'}, {'quantity': '2', 'unit': 'cups', 'name': 'water'}, {'quantity': '6', 'unit': '', 'name': 'eggs'}, {'quantity': '¼', 'unit': 'teaspoon', 'name': 'salt'}, {'quantity': None, 'unit': None, 'name': 'cooking spray'}","Mix flour, water, eggs, and salt together in a bowl until a thin, smooth batter forms.. Lightly spray a griddle with cooking spray and heat over medium-low heat. Spoon about 1/4 cup batter into the warm skillet and cook until a film forms on top. Carefully remove to a plate and repeat to make remaining shells.","calories: 335, fat: 8g, carbs: 48g, protein: 16g, servings: 4"
Meat Filled Manicotti,https://www.allrecipes.com/recipe/15222/meat-filled-manicotti/,"{'quantity': '1', 'unit': '(8 ounce) package', 'name': 'manicotti pasta'}, {'quantity': '1', 'unit': 'pound', 'name': 'lean ground beef'}, {'quantity': '1 ½', 'unit': 'cups', 'name': 'cottage cheese'}, {'quantity': '2', 'unit': 'cups', 'name': 'shredded mozzarella cheese'}, {'quantity': '½', 'unit': 'cup', 'name': 'grated Parmesan cheese'}, {'quantity': '2', 'unit': '', 'name': 'egg whites'}, {'quantity': '½', 'unit': 'teaspoon', 'name': 'dried oregano'}, {'quantity': '1', 'unit': '(32 ounce) jar', 'name': 'spaghetti sauce'}","Bring a large pot of lightly salted water to a boil. Add pasta and cook for 8 to 10 minutes or until al dente. Drain and cool. Reserve.. Meanwhile, in a large skillet brown beef on medium heat. Drain and cool.. Preheat oven to 350 degrees F (175 degrees C).. Combine beef, cottage cheese, 1 cup mozzarella cheese, Parmesan cheese, egg whites and oregano. Mix well. Stuff shells with mixture.. Lightly grease a 9x13 inch baking dish. Pour enough spaghetti sauce in dish to cover the bottom. Place stuffed noodles in the dish. Cover with spaghetti sauce and top with the remaining 1 cup mozzarella cheese. Bake in preheated oven for 50 minutes.","calories: 668, fat: 33g, carbs: 51g, protein: 40g, servings: 6"
Three Cheese Manicotti II,https://www.allrecipes.com/recipe/86446/three-cheese-manicotti-ii/,"{'quantity': '1', 'unit': '(8 ounce) package', 'name': 'manicotti shells'}, {'quantity': '4', 'unit': 'cups', 'name': 'shredded mozzarella cheese, divided'}, {'quantity': '2', 'unit': 'cups', 'name': 'ricotta cheese'}, {'quantity': '1', 'unit': 'cup', 'name': 'grated Parmesan cheese, divided'}, {'quantity': '1', 'unit': 'tablespoon', 'name': 'minced garlic'}, {'quantity': '1', 'unit': '', 'name': 'egg'}, {'quantity': '2', 'unit': 'tablespoons', 'name': 'dried basil'}, {'quantity': '2', 'unit': '(26 ounce) jars', 'name': 'pasta sauce'}","Bring a large pot of lightly salted water to a boil. Add manicotti and cook for 8 to 10 minutes or until al dente; drain.. Preheat oven to 350 degrees F (175 degrees C). Lightly grease a 9x13 inch baking dish.. In a bowl, mix 3 cups mozzarella cheese, ricotta cheese, 1/2 cup Parmesan cheese, garlic, egg, and basil. Stuff cooked manicotti with the mixture.. Spread about 2 cups pasta sauce over the bottom of the prepared baking dish. Arrange stuffed manicotti in the dish, and cover with remaining sauce. Sprinkle with remaining mozzarella cheese.. Bake 15 minutes in the preheated oven. Sprinkle with remaining Parmesan, and continue baking 10 minutes, until mozzarella is melted and bubbly.","calories: 612, fat: 24g, carbs: 65g, protein: 34g, servings: 6"
Manicotti Italian Casserole,https://www.allrecipes.com/recipe/87845/manicotti-italian-casserole/,"{'quantity': '1', 'unit': 'pound', 'name': 'rigatoni pasta'}, {'quantity': '1', 'unit': 'pound', 'name': 'ground beef'}, {'quantity': '1', 'unit': 'pound', 'name': 'Italian sausage'}, {'quantity': '1', 'unit': '(8 ounce) can', 'name': 'mushrooms, drained'}, {'quantity': '2', 'unit': '(32 ounce) jars', 'name': 'spaghetti sauce'}, {'quantity': '1 ½', 'unit': 'pounds', 'name': 'shredded mozzarella cheese'}, {'quantity': '', 'unit': '', 'name': 'thinly sliced pepperoni'}","Preheat oven to 350 degrees F (175 degrees C).. Bring a large pot of lightly salted water to boil. Pour in rigatoni, and cook until al dente, about 8 to 10 minutes. Drain, and set pasta aside.. Meanwhile, brown ground beef and Italian sausage in a large skillet over medium heat. With a slotted spoon, remove beef and sausage to a baking dish. Stir mushrooms, spaghetti sauce, and cooked pasta into the baking dish. Sprinkle cheese and pepperoni over the top.. Bake in preheated oven until the cheese is brown and bubbly, about 20 minutes.","calories: 909, fat: 43g, carbs: 78g, protein: 52g, servings: 8"
Chicken Manicotti Alfredo,https://www.allrecipes.com/recipe/12069/chicken-manicotti-alfredo/,"{'quantity': '3', 'unit': '', 'name': 'skinless, boneless chicken breast halves'}, {'quantity': '½', 'unit': 'cup', 'name': 'distilled white vinegar'}, {'quantity': '1', 'unit': 'cup', 'name': 'olive oil'}, {'quantity': '1', 'unit': 'clove', 'name': 'crushed garlic'}, {'quantity': '1', 'unit': '(12 ounce) package', 'name': 'manicotti pasta'}, {'quantity': '6', 'unit': 'tablespoons', 'name': 'butter'}, {'quantity': '2', 'unit': 'cups', 'name': 'heavy whipping cream'}, {'quantity': '¼', 'unit': 'teaspoon', 'name': 'ground nutmeg'}, {'quantity': '1', 'unit': 'teaspoon', 'name': 'ground black pepper'}, {'quantity': '1 ½', 'unit': 'cups', 'name': 'grated Parmesan cheese'}, {'quantity': '1', 'unit': 'teaspoon', 'name': 'salt'}, {'quantity': '1', 'unit': 'pint', 'name': 'part-skim ricotta cheese'}, {'quantity': '1', 'unit': '', 'name': 'egg'}, {'quantity': '1', 'unit': 'tablespoon', 'name': 'chopped fresh oregano'}, {'quantity': '1', 'unit': 'tablespoon', 'name': 'chopped fresh marjoram'}, {'quantity': '1', 'unit': 'tablespoon', 'name': 'chopped fresh basil'}, {'quantity': '1', 'unit': 'cup', 'name': 'shredded mozzarella cheese'}","In a large resealable plastic bag, marinate chicken with vinegar, olive oil, and garlic for at least 30 minutes. Saute in a little olive oil until done. Set aside.. Cook pasta in a large pot of boiling water until al dente. Drain, and set aside.. Meanwhile, melt butter or margarine in a small saucepan over medium-high heat. Add heavy cream, salt, nutmeg, and ground black pepper, and stir until sauce thickens. Reduce heat to low. Add grated Parmesan cheese, and stir until the cheese melts. Set Alfredo sauce aside.. In a large bowl, mix together ricotta cheese, egg, oregano, marjoram, and basil. Mix in cooked chicken.. Stuff cooked manicotti shells with chicken and ricotta mixture. Cover the bottom of a 9x13 inch baking dish with half of the Alfredo sauce. Place stuffed shells on top of sauce. Pour remaining sauce over shells. Top with one cup shredded mozzarella cheese. Cover with aluminum foil.. Bake at 350 degree F (175 degree C) oven for 45 minutes. Let stand 10 minutes before serving.","calories: 813, fat: 60g, carbs: 37g, protein: 33g, servings: 8"
Manicotti Alla Romana,https://www.allrecipes.com/recipe/25300/manicotti-alla-romana/,"{'quantity': '2', 'unit': 'tablespoons', 'name': 'olive oil'}, {'quantity': '½', 'unit': 'cup', 'name': 'chopped onion'}, {'quantity': '6', 'unit': 'cloves', 'name': 'garlic, finely chopped'}, {'quantity': '1', 'unit': 'pound', 'name': 'ground beef'}, {'quantity': '', 'unit': '', 'name': 'salt to taste'}, {'quantity': '1', 'unit': '(10 ounce) package', 'name': 'frozen chopped spinach, thawed and drained'}, {'quantity': '1', 'unit': '(12 ounce) package', 'name': 'manicotti shells'}, {'quantity': '2', 'unit': 'cups', 'name': 'ricotta cheese'}, {'quantity': '2', 'unit': '', 'name': 'eggs, beaten'}, {'quantity': '3', 'unit': 'cups', 'name': 'spaghetti sauce, divided'}, {'quantity': '2', 'unit': 'tablespoons', 'name': 'butter'}, {'quantity': '2', 'unit': 'tablespoons', 'name': 'all-purpose flour'}, {'quantity': '2', 'unit': 'tablespoons', 'name': 'chicken bouillon granules'}, {'quantity': '2', 'unit': 'cups', 'name': 'half-and-half'}, {'quantity': '¼', 'unit': 'cup', 'name': 'chopped fresh parsley'}, {'quantity': '1', 'unit': 'tablespoon', 'name': 'chopped fresh basil'}, {'quantity': '½', 'unit': 'cup', 'name': 'grated Parmesan cheese'}","Heat oil in a large skillet over medium heat. Saute onions until translucent. Saute garlic for 1 minute and stir in ground beef. Cook until well browned and crumbled. Season with salt and set aside to cool.. Cook spinach according to package directions. Meanwhile, bring a large pot of lightly salted water to a boil. Add manicotti shells and parboil for half of the time recommended on the package. Drain and cover with cool water to stop the cooking process and prevent the shells from cracking.. To the ground beef mixture add the cooked spinach and ricotta cheese. When the mixture is cool, add the beaten eggs. Spread 1/4 cup spaghetti sauce in the bottom of a 9x13 inch baking dish. Gently drain the manicotti shells and carefully stuff each one with the meat and cheese mixture; place shells in prepared dish. Lightly cover the dish with plastic wrap or a clean, damp towel to prevent shells from cracking.. Preheat oven to 350 degrees F (175 degrees C).. Prepare the white sauce by melting the butter in a small saucepan over medium heat. Stir in flour and chicken bouillon. Increase heat to medium-high and cook, stirring constantly, until it begins to bubble. Stir in half and half and bring to a boil, stirring frequently. Cook for 1 minute, stirring constantly. Remove from heat and stir in parsley. Pour or ladle the sauce evenly over the stuffed shells.. Stir the basil into the remaining spaghetti sauce. Carefully pour or ladle spaghetti sauce over the white sauce, trying to layer the sauces without mixing.. Cover and bake for 40 minutes. Remove from oven, uncover and sprinkle with Parmesan cheese. Bake, uncovered, for 10 minutes more.","calories: 612, fat: 30g, carbs: 59g, protein: 28g, servings: 7"
Make-Ahead Manicotti,https://www.allrecipes.com/recipe/11857/make-ahead-manicotti/,"{'quantity': '1', 'unit': 'pint', 'name': 'ricotta cheese'}, {'quantity': '2', 'unit': 'large', 'name': 'eggs'}, {'quantity': '1', 'unit': '(10 ounce) package', 'name': 'frozen chopped spinach, thawed and drained'}, {'quantity': '1', 'unit': 'cup', 'name': 'shredded mozzarella cheese'}, {'quantity': '½', 'unit': 'cup', 'name': 'grated Parmesan cheese, divided'}, {'quantity': '1 ½', 'unit': 'tablespoons', 'name': 'white sugar'}, {'quantity': '⅛', 'unit': 'teaspoon', 'name': 'salt'}, {'quantity': '¼', 'unit': 'teaspoon', 'name': 'ground black pepper'}, {'quantity': '12', 'unit': '', 'name': 'manicotti shells'}, {'quantity': '1', 'unit': '(32 ounce) jar', 'name': 'spaghetti sauce'}","Mix ricotta cheese and eggs together in a medium bowl until blended. Stir in spinach, mozzarella cheese, 1/4 cup Parmesan cheese, sugar, salt, and pepper. Stuff mixture into uncooked pasta shells.. Pour 1/2 cup spaghetti sauce into a medium baking dish; spread to cover the bottom. Arrange stuffed shells in a single layer over sauce. Pour remaining sauce over shells. Cover and chill in the refrigerator, 8 hours to overnight.. When ready to bake, preheat the oven to 400 degrees F (200 degrees C). Remove shells from the refrigerator.. Bake, covered, in the preheated oven for 40 minutes. Uncover, sprinkle with remaining Parmesan cheese, and bake for 15 more minutes.","calories: 507, fat: 19g, carbs: 56g, protein: 29g, servings: 6"
Christmas Eve Manicotti,https://www.allrecipes.com/recipe/230438/christmas-eve-manicotti/,"{'quantity': '4', 'unit': None, 'name': 'eggs'}, {'quantity': '¼', 'unit': 'teaspoon', 'name': 'salt'}, {'quantity': '2', 'unit': 'cups', 'name': 'all-purpose flour'}, {'quantity': '2 ¼', 'unit': 'cups', 'name': 'milk'}, {'quantity': '¼', 'unit': 'cup', 'name': 'unsalted butter, melted'}, {'quantity': '1', 'unit': 'tablespoon', 'name': 'vegetable oil, or more as needed'}, {'quantity': '1', 'unit': '(15 ounce) container', 'name': 'ricotta cheese'}, {'quantity': '1', 'unit': '(10 ounce) package', 'name': 'frozen chopped spinach, thawed, drained, and squeezed dry'}, {'quantity': '½', 'unit': 'cup', 'name': 'grated Parmesan cheese'}, {'quantity': '1', 'unit': '(3 ounce) package', 'name': 'cream cheese, softened'}, {'quantity': '¼', 'unit': 'cup', 'name': 'chopped fresh parsley'}, {'quantity': '3', 'unit': 'tablespoons', 'name': 'chopped green onion'}, {'quantity': '2', 'unit': None, 'name': 'eggs, lightly beaten'}, {'quantity': '1', 'unit': 'tablespoon', 'name': 'onion powder'}, {'quantity': '1', 'unit': 'teaspoon', 'name': 'dried oregano'}, {'quantity': '½', 'unit': 'teaspoon', 'name': 'salt'}, {'quantity': '2', 'unit': 'cups', 'name': 'prepared marinara sauce, or as needed'}, {'quantity': '1', 'unit': 'cup', 'name': 'shredded mozzarella cheese, or to taste'}","Whisk 4 eggs and 1/4 teaspoon salt together in a bowl; gradually whisk in flour, alternating with milk, until smooth. Whisk in melted butter; refrigerate batter at least 1 hour.. Heat a small skillet over medium heat; brush skillet with vegetable oil using a pastry brush. Ladle in about 1/4 cup batter (enough to lightly cover bottom of the skillet) and immediately swirl the skillet to spread batter out to cover bottom completely. Cook until crêpe turns lightly golden brown on the bottom; flip and cook until other side has small brown spots. Transfer crêpe to a plate; layered between waxed paper. Repeat with remaining batter, brushing the skillet with oil as needed to prevent crêpes from sticking.. Preheat the oven to 350 degrees F (175 degrees C).. Lightly stir ricotta cheese, spinach, Parmesan cheese, cream cheese, parsley, green onion, 2 eggs, onion powder, oregano, and 1/2 teaspoon salt together in a bowl until filling is thoroughly combined.. Spread 1 cup marinara sauce into the bottom of a 9x13-inch baking dish. Place 1 crêpe onto a work surface; spoon about 3 tablespoons filling, or more as needed, down the center of crêpe. Roll crêpe over filling; place into baking dish. Repeat with remaining crêpes and filling. Spread remaining marinara sauce over filled crêpes; sprinkle with mozzarella cheese.. Bake in the preheated oven until bubbling and mozzarella cheese is melted and slightly browned, 20 to 30 minutes.","calories: 505, fat: 26g, carbs: 42g, protein: 25g, servings: 8"
Manicotti with Cheese,https://www.allrecipes.com/recipe/15407/manicotti-with-cheese/,"{'quantity': '1', 'unit': '(8 ounce) package', 'name': 'manicotti pasta'}, {'quantity': '2', 'unit': 'cups', 'name': 'whole milk ricotta cheese'}, {'quantity': '2', 'unit': 'cups', 'name': 'shredded mozzarella cheese'}, {'quantity': '¼', 'unit': 'cup', 'name': 'grated Parmesan cheese'}, {'quantity': '2', 'unit': 'tablespoons', 'name': 'chopped fresh parsley'}, {'quantity': '½', 'unit': 'teaspoon', 'name': 'salt'}, {'quantity': '¼', 'unit': 'teaspoon', 'name': 'ground black pepper'}, {'quantity': '3 ½', 'unit': '(32 ounce) jars', 'name': 'spaghetti sauce'}","Bring a large pot of lightly salted water to a boil. Add pasta and cook for 8 to 10 minutes or until al dente. Drain and cool on waxed paper or aluminum foil to prevent noodles from sticking together.. Preheat the oven to 350 degrees F (175 degrees C).. In a medium bowl, combine ricotta cheese, mozzarella cheese, Parmesan cheese, parsley, salt, and pepper; fill manicotti with cheese mixture.. In a 9x13-inch baking dish, spread a thin layer of spaghetti sauce on the bottom and arrange manicotti in a single layer; cover with remaining sauce. Cover dish with aluminum foil and bake in preheated oven for 40 minutes. Remove foil and bake for 15 minutes longer; serve.","calories: 736, fat: 30g, carbs: 88g, protein: 28g, servings: 7"
Cheese Stuffed Manicotti,https://www.allrecipes.com/recipe/232912/cheese-stuffed-manicotti/,"{'quantity': '1', 'unit': 'pound', 'name': 'ground beef'}, {'quantity': '1', 'unit': 'small', 'name': 'onion, diced'}, {'quantity': '1', 'unit': 'teaspoon', 'name': 'roasted garlic'}, {'quantity': '1', 'unit': '(28 ounce) can', 'name': 'diced tomatoes with garlic and onion'}, {'quantity': '1', 'unit': '(12 ounce) can', 'name': 'tomato paste'}, {'quantity': '1', 'unit': 'tablespoon', 'name': 'white sugar'}, {'quantity': '1 ½', 'unit': 'teaspoons', 'name': 'salt'}, {'quantity': '1', 'unit': '', 'name': 'bay leaf'}, {'quantity': '½', 'unit': 'teaspoon', 'name': 'dried oregano'}, {'quantity': '½', 'unit': 'teaspoon', 'name': 'dried thyme'}, {'quantity': '½', 'unit': 'teaspoon', 'name': 'ground black pepper'}, {'quantity': '¼', 'unit': 'teaspoon', 'name': 'garlic salt'}, {'quantity': '1', 'unit': '(8 ounce) package', 'name': 'manicotti shells'}, {'quantity': '30', 'unit': 'ounces', 'name': 'cottage cheese'}, {'quantity': '1', 'unit': '(8 ounce) package', 'name': 'shredded mozzarella cheese'}, {'quantity': '¼', 'unit': 'cup', 'name': 'grated Parmesan cheese'}, {'quantity': '1', 'unit': '', 'name': 'egg, beaten'}, {'quantity': '½', 'unit': 'teaspoon', 'name': 'salt'}, {'quantity': '½', 'unit': 'teaspoon', 'name': 'ground black pepper'}, {'quantity': '¼', 'unit': 'cup', 'name': 'grated Parmesan cheese'}","Heat a large skillet over medium-high heat. Add beef, onion, and roasted garlic; cook and stir until beef browned and crumbly, 5 to 7 minutes. Continue simmering until pan juices evaporate, about 10 minutes more. Add diced tomatoes, tomato paste, sugar, 1 1/2 teaspoons salt, bay leaf, oregano, thyme, 1/2 teaspoon black pepper, and garlic salt; bring to a boil. Reduce heat to medium-low; simmer until flavors blend, about 30 minutes.. Preheat the oven to 350 degrees F (175 degrees C).. Fill a large pot with lightly salted water and bring to a boil. Add manicotti and return to a boil. Cook manicotti, uncovered, stirring occasionally, until tender yet firm to the bite, about 8 minutes. Drain and cool slightly.. Combine cottage cheese, mozzarella cheese, 1/4 cup Parmesan cheese, egg, 1/2 teaspoon salt, and 1/2 teaspoon black pepper in a bowl. Spoon a generous amount cheese filling into each manicotti shell.. Pour enough sauce to cover bottom of a 9x13-inch baking dish. Arrange stuffed manicotti over sauce; pour remaining sauce over shells. Cover with aluminum foil.. Bake in the preheated oven until bubbly, about 30 minutes. Sprinkle remaining 1/4 cup Parmesan cheese over manicotti and return to the oven. Bake until cheese filling is melted, 10 to 15 minutes more.","calories: 654, fat: 26g, carbs: 55g, protein: 53g, servings: 6"
